company_name,company_core,bing_snippet,has_incentive_mention,incentive_detail,incentive_rate,screened_date,worker_part
アイスタンダード,アイスタンダード,AI (歌手) - Wikipedia AI （アイ、 1981年 11月2日 - ）は、 日系アメリカ人 の シンガーソングライター 、 ラッパー。 本名、 植村 愛 カリーナ （うえむら あい かりーな）。 アメリカ合衆国 生まれ、 鹿児島県 [6] 鹿児島市 育ち。 所属レコード会社は EMI Records。 | Apple（日本） 革新に満ちたAppleの世界へようこそ。AppleのウェブサイトではiPhoneからiPad、Apple Watch、Mac、Apple TVまで、すべての製品の購入ができます。アクセサリやエンターテインメントを探す時も、専任スペシャリストによるデバイスのサポートが必要な時もこのサイトでどうぞ。 | AI OFFICIAL SITE AI - ラッキーアイラブユー 2026.2.27 Release 新たなフェーズへ向かう2026年、第1弾シングル「ラッキーアイラブユー」を2月27日 (金)に配信リリースすることが決定！ | アイとは？ 意味や使い方 - コトバンク デジタル大辞泉 - アイの用語解説 - 1 英語のアルファベットの第9字。 2 〈I〉ローマ数字の「一」。 3 〈I〉《iodine》沃素ようその元素記号。 4 〈i〉数学で、虚数単位。 2乗して－1になる数。 5 〈I〉英語の代名詞で、私の意。 | AI 25周年 スペシャルサイト また25周年ロゴは、昨今の世の中に氾濫する機械的なAI（エーアイ）というワードとは対照的に、有機的な暖かさに満ち溢れたシンガーAI（アイ）の象徴として、グローバルに活躍する彼女のアイデンティティーのひとつである日本の国番号＜81＞ともリンク ...,no,,,2026-07-02,part1/5
アイスプリング,アイスプリング,AI (歌手) - Wikipedia AI （アイ、 1981年 11月2日 - ）は、 日系アメリカ人 の シンガーソングライター 、 ラッパー。 本名、 植村 愛 カリーナ （うえむら あい かりーな）。 アメリカ合衆国 生まれ、 鹿児島県 [6] 鹿児島市 育ち。 所属レコード会社は EMI Records。 | Apple（日本） 革新に満ちたAppleの世界へようこそ。AppleのウェブサイトではiPhoneからiPad、Apple Watch、Mac、Apple TVまで、すべての製品の購入ができます。アクセサリやエンターテインメントを探す時も、専任スペシャリストによるデバイスのサポートが必要な時もこのサイトでどうぞ。 | AI OFFICIAL SITE AI - ラッキーアイラブユー 2026.2.27 Release 新たなフェーズへ向かう2026年、第1弾シングル「ラッキーアイラブユー」を2月27日 (金)に配信リリースすることが決定！ | アイとは？ 意味や使い方 - コトバンク デジタル大辞泉 - アイの用語解説 - 1 英語のアルファベットの第9字。 2 〈I〉ローマ数字の「一」。 3 〈I〉《iodine》沃素ようその元素記号。 4 〈i〉数学で、虚数単位。 2乗して－1になる数。 5 〈I〉英語の代名詞で、私の意。 | AI 25周年 スペシャルサイト また25周年ロゴは、昨今の世の中に氾濫する機械的なAI（エーアイ）というワードとは対照的に、有機的な暖かさに満ち溢れたシンガーAI（アイ）の象徴として、グローバルに活躍する彼女のアイデンティティーのひとつである日本の国番号＜81＞ともリンク ...,no,,,2026-07-02,part1/5
アイスペック・ビジネスブレイン,アイスペックビジネスブレイン,"【2026年6月26日更新】「アイス・コンビニアイス」のおすすめ ... 【2026年6月26日更新】「アイス・コンビニアイス」の週間おすすめランキングです。 最新の人気商品をランキング形式で紹介！ 毎週更新される注目の商品や話題の商品がひと目でわかるランキングページ。 | 【人気投票 1~514位】アイスランキング！全種類総合でおすすめ ... ランキングの前に 1分でわかる「アイスクリーム」 大正時代頃から各家庭に普及するようになった、アイスクリーム ひんやりした口当たりと、クリーミーな甘さが大人気のスイーツといえば“アイスクリーム”。 | アイス | 商品情報 | 株式会社 明治 - Meiji Co., Ltd. アイスのページです。 株式会社 明治は、ヨーグルト・チーズ・牛乳などの乳製品、チョコレート、栄養食品など、おいしさと栄養価値にこだわった商品・サービスを提供しています。 | 市販のアイスクリームおすすめランキング20選。アイスクリーム ... 濃厚なモノからさっぱりとしたモノまで、豊富なラインナップが展開されています。 本記事では、市販のアイスクリームのおすすめをご紹介。 自分好みの商品を見つけてみてください。 | アイス｜シャトレーゼ公式サイト (並び順：並び順) シャトレーゼ（Chateraise）公式オンラインアイス (並び順：並び順)素材・製法にこだわったプレミアムスイーツをお手頃な価格でお届けいたします。 ギフト手土産はシャトレーゼオンラインショップで。",no,,,2026-07-02,part1/5
アイズ,アイズ,"車中泊サンシェード・車用網戸・ハイエースアイテム通販の ... 「こんなのがあったらなぁ・・・」から開発が始まり、作り手自身がより良いもの、納得できるものにしてきました。 小さな会社ではありますが、「アイズの製品です」と誇りと責任をもって言えるよう、日々取り組んでいます。 | I""s - Wikipedia さらには作中で伊織が命名したチーム名「チームI's」（こちらはアポストロフィーが1個で正しい）と混同した「I's」で書かれることも多い他、何も入れない「Is」と言った表記もしばしば使われる。 | 株式会社アイズ 株式会社アイズはNo.1の媒体資料のポータルサイト「メディアレーダー」や日本最大級のクチコミプロモーション「トラミー（旧レビューブログ）」などの独自サービスを複数展開する広告会社です。 | 日総グループ企業（日総工産株式会社など） | 株式会社アイズ Information アイズの最新情報をお届け！ 2026年07月01日 NEWS 日総工産株式会社との事業統合について 2026年02月14日 NEWS 2025年12月Oracle NetSuiteのアライアンスパートナーになりました！ | AIZU｜空間を仕上げる左官材とイタリア製マテリアル 左官材・意匠仕上げの質感と色を確認できるイタリア製マテリアルサイト。空間づくりのヒントに。 ADDRESS 東京支社 〒154-0014 東京都世田谷区新町3-23-2 TEL：03-3420-8484 関西営業所 〒661-0021 兵庫県尼崎市名神町1丁目14-23 アハトハイク名神町イースト 03号室 TEL：080-5344-3631",no,,,2026-07-02,part1/5
アイセル,アイセル,アイセル株式会社 アイセルプレミアムブランドとして「塑性加工・溶接」「FA関連機器」「プレス関連機器」「機密直動機器」「シャッター関連機器」など多岐にわたる製品を製造しているメーカーです。 | 製品情報 | アイセル株式会社 アイセルプレミアムブランド 長年培ってきた専門性の高い技術と経験があるからこそ、 生み出せる「驚き」がある。 実績から開発されたアイセルのプレミアムブランドが お客様のニーズを革新なアイデアで「ときめき」へと導きます。 | 株式会社アイセル － 「顧客満足」の一歩先へ アイセルは、先進のIT技術でお客様の課題や要望にベストなソリューションをご提案します。 豊富な実績と経験を踏まえ、お客様とビジネスに常に親身に、誠実に寄りそいます。 | アイセル 製品一覧 | アイセルグループ製品情報サイト アイセル株式会社の製品を一覧でご紹介します。 ガイドポスト ミリオンガイド、メカロック＆カップリング、シャッター式安全カバー マシンシャッター、塑性・溶接加工機 ベンディングロール機、打ち抜き機 パンチングマシン。 | アイセルグループ株式会社 25.04.16 ホームページメンテナンスのお知らせ アイセルグループ 25.01.28 ホームページメンテナンスのお知らせ タック技研工業 24.08.26 ホームページリニューアルのお知らせ アイセルグループ 24.02.08 アイセルグループ製品情報サイト 開設のお知らせ,no,,,2026-07-02,part1/5
アイソルート,アイソルート,【VALORANT】アイソ (ISO)の使い方とおすすめマップ【ヴァロ ... VALORANTにおけるアイソの使い方とおすすめマップです。 評価や立ち回り、スキル (アビリティ)・ウルト (ult)の性能を掲載。 強化 (バフ)や弱体化 (ナーフ)履歴もまとめているので、VALORANTアイソを調べる際にどうぞ。 | アイソ - VALORANT アイソ 中国出身の雇われフィクサーであるアイソは、フロー状態に入ることで敵の勢力を解体する。 彼は周囲のエネルギーを防弾の守りとして再構築しながら、命を懸けた次の決闘へと向かう。 | 8ヶ月で300時間使い続けたガチ恋勢によるアイソ解説 ｜pallas ！ 自分がアイソ君を使っているのを見て アイソを使いたくなったと言われるのが 実は一番嬉しいです。 ガチ恋なので私の見えない範囲で 是非つかってみてください！ お勧めはしません。 このnoteを見て少しでも アイソ君の事を知ってもらえれば幸いです。 | Iso (VALORANT) (あいそ)とは【ピクシブ百科事典】 アイソの真の目的は VALORANTプロトコルに潜入し、オーメンを暗殺すること。 このことに サイファー 以外は気づいておらず、当の サイファー もアイソを見ているのみで、 オーメン の命は完全にアイソの選択に委ねられていた。 | アイソ - valorant日本語 Wiki* ダブルタップのシールド獲得音が 非常にデカい。 アイソ使い曰く 55m の範囲で聞こえる爆音である。 これはバインドや3サイトのマップだと隣のサイトにいても近ければ聞こえるレベル。 （足音や銃声がおよそ40m） この音のデカさは中々キツイ。,no,,,2026-07-02,part1/5
アイティソリューションズ,アイティソリューションズ,"アイティ｜専門店街｜豊岡駅前｜ショッピングセンター｜兵庫 ... 人が集まる、楽しい場所。 子どもも大人も笑顔になれるアイティ。 ワクワクがいっぱいの場所で、あなたの「やってみたい」をカタチに。 テナント・催事出店者さま募集中です。 | フロアガイド｜アイティ｜専門店街｜豊岡駅前｜ショッピング ... アイティ同友店会のフロアガイドです | TOP | ショップ・グルメ | サービス＆イベント | 駐車場 | テナント・催事募集 | 省エネ･環境への取組 | 防災関連 | 1F | 2F | 3F | 4F | 7F | フロアガイド | 各店舗・施設営業時間 | 各店舗求人情報 | バリアフリー | 障碍者就労応援 | サイトマップ | 個人情報保護 ... | アイティ (兵庫県) - Wikipedia 施設設置の背景には、駐車場を初めとするアイティ関連の第三セクター「豊岡アイティー都市開発」の経営不振があり、市が建物の一部を買い取り、駐車料金を払うという形で同社に対し事実上の経営支援を行っていることになる。 | アイティサービスシステム アイティサービスシステムで想像をカタチに Copyright © Asahi Power Service Co.,ltd All rights reserved. | 株式会社アイティー – auのケータイ、スマートフォンのこと ... What's new MORE 2025年07月16日 下期合同研修を実施致しました！！ 2022年10月24日 合同研修を実施！！ 2022年01月11日 iCracked延岡★移転オープン 2021年10月19日 延岡地区★合同研修 2021年10月19日 宮崎地区★合同研修",no,,,2026-07-02,part1/5
アイティーソリューション,アイティーソリューション,"Login | INSTA Discussion Forum INSTA Prelims Test Series Program - 2021 Prelims Thematic Test Series (June -2020 to October -2020) for Prelims - 2020 (NEW) D-CORE: Delhi - Core Batch - 2020 (Admissions Closed) Contact Nanda Ashirwad Complex, 3rd Floor, Above Village Hyper Market, Chandralyout Main Road, Attiguppe , Bengaluru - 560040 7483163074, 9380863034 support ... | How are you feeling after Seeing 2020 UPSC PRELIMS Results? Express ... Express your heart out! | INSTA Discussion Forum All 227 General 23 UPSC MARKS 2019 1 UPSC PRELIMS 2020 1 MOTIVATION 7 STRATEGY 2021 24 SECURE ANSWER WRITING 9 CURRENT AFFAIRS QUIZ 3 OPTIONAL PREPARATION 48 GENERAL STUDIES 1,2,3,4 PAPER PREPARATION 12 INSTA COURSES 4 ANNOUNCEMENTS 95 | | INSTA Discussion Forum INSTA Prelims Test Series Program - 2021 Prelims Thematic Test Series (June -2020 to October -2020) for Prelims - 2020 (NEW) D-CORE: Delhi - Core Batch - 2020 (Admissions Closed) Contact Nanda Ashirwad Complex, 3rd Floor, Above Village Hyper Market, Chandralyout Main Road, Attiguppe , Bengaluru - 560040 7483163074, 9380863034 support ... | Anyone up for daily answer writing and MCQ solving for 2023? | INSTA ... InsightsOnIndia Forum Looking forward for a partner to discuss about GS Mains and prelims | How are you feeling after Seeing 2020 UPSC PRELIMS Results? Express ... Generally, Topper's Stories is being glorified in the UPSC circle. But, We believe everyone has their own unique stories of perseverance and struggles. A person who fails in prelims by one or two marks or bad performance in paper-2 is no less capable than a Topper. Only a matter of bad luck or a bad day on Prelims must have brought you down. You have every capacity to clear this Exam.",no,,,2026-07-02,part1/5
アイティ総研,アイティ総研,"アイティ｜専門店街｜豊岡駅前｜ショッピングセンター｜兵庫 ... 人が集まる、楽しい場所。 子どもも大人も笑顔になれるアイティ。 ワクワクがいっぱいの場所で、あなたの「やってみたい」をカタチに。 テナント・催事出店者さま募集中です。 | フロアガイド｜アイティ｜専門店街｜豊岡駅前｜ショッピング ... アイティ同友店会のフロアガイドです | TOP | ショップ・グルメ | サービス＆イベント | 駐車場 | テナント・催事募集 | 省エネ･環境への取組 | 防災関連 | 1F | 2F | 3F | 4F | 7F | フロアガイド | 各店舗・施設営業時間 | 各店舗求人情報 | バリアフリー | 障碍者就労応援 | サイトマップ | 個人情報保護 ... | アイティ (兵庫県) - Wikipedia 施設設置の背景には、駐車場を初めとするアイティ関連の第三セクター「豊岡アイティー都市開発」の経営不振があり、市が建物の一部を買い取り、駐車料金を払うという形で同社に対し事実上の経営支援を行っていることになる。 | アイティサービスシステム アイティサービスシステムで想像をカタチに Copyright © Asahi Power Service Co.,ltd All rights reserved. | 株式会社アイティー – auのケータイ、スマートフォンのこと ... What's new MORE 2025年07月16日 下期合同研修を実施致しました！！ 2022年10月24日 合同研修を実施！！ 2022年01月11日 iCracked延岡★移転オープン 2021年10月19日 延岡地区★合同研修 2021年10月19日 宮崎地区★合同研修",no,,,2026-07-02,part1/5
アイテック,アイテック,"アイテック｜情報処理技術者試験対策・IT人材育成 IT人材教育からIT人材派遣まで株式会社アイテックは人材・教育ビジネスでIT社会に貢献します。 これまで11,000団体、130万人以上の情報処理技術者試験やPMP資格など各種IT資格取得の学習をサポート。 | 会社情報 | 株式会社アイ・テック （アイ・テック（ITEC）のCはCommunicationを由来としています）入社1年目、自ら志願して働いた工場で感じたのは、助け合い精神の大切さでした。 社内において日頃からコミュニケーションが取れていれば、困ったときに助け合うことができます。 | アイテック株式会社 確かな技術力で街の未来を支える。アイテック株式会社は技術的請負の総合マネジメント企業です。 事業内容 上下水道 水質分析 修繕・工事 リサイクル焼却発電 高速道路・メンテナンス 焼却発電事業 環境影響評価 お知らせ 施設概要 環境保全協定 大気調査・維持管理 アクセス 専用お問合せ | 株式会社アイテック アイテックの仕事はお客様を含めたチームワークが命。 完成までの道のりはもちろん容易ではありません。 さまざまな制約の中で協⼒しあい、新たな可能性を模索し、ベストを尽くします。 お客様とアイテックのプロジェクトストーリーをご紹介します。 | 会社概要 | アイテック株式会社 確かな技術力で街の未来を支える。アイテック株式会社は技術的請負の総合マネジメント企業です。 事業内容 上下水道 水質分析 修繕・工事 リサイクル焼却発電 高速道路・メンテナンス 焼却発電事業 環境影響評価 お知らせ 施設概要 環境保全協定 大気調査・維持管理 アクセス 専用お問合せ",no,,,2026-07-02,part1/5
アイディーエス,アイディーエス,"世界中の講師とAIが英語添削・英文添削 [アイディー] アイディーとは、世界中で活躍する英語教育のプロフェッショナルが協力しあい運営する「オンライン英文添削」サービスです。 AI講師からのアドバイスや添削指導はもちろん、英語を教えることが得意な世界中の講師が添削指導。 | 電子マネー「iD」ホーム いまから「iD」をはじめる方へのスタートガイドや使えるお店の情報、お得なキャンペーン情報などを掲載。 「ポストペイ（後払い）」に加え、「プリペイド」、「デビット」にも対応した電子マネー「iD」でキャッシュレスをはじめよう。 | IDIYマイページ|英文添削・英語添削・英作文添削 [アイディー] 166円からのオンライン英語添削アイディーマイページ。 はじめてマイページにログインで1,200円分のポイント無料プレゼント中！ 世界中の英語専門家、ネイティブが時差を利用して24時間無料英語添削。 英語メール、英作文、英文添削に最適。 | 【今さら聞けない】「ID」の意味とは？使い方や「パスワード ... 混同されることもありますが、「ID」と「パスワード」は別のもの。 「ID」は個人を識別するものですが、「パスワード」は鍵の役割をする暗号のようなものです。 基本的に「ID」は変更できませんが、「パスワード」は変更が可能です。 | かざしてお支払い「iD」 | サービス | NTTドコモ 「ポストペイ（後払い）」に加え、「プリペイド」、「デビット」にも対応しています。 iDは株式会社NTTドコモ・フィナンシャルグループが提供するサービスです。 iDはこのマークのあるお店で使えます。",no,,,2026-07-02,part1/5
アイデンティティー,アイデンティティー,アイデンティティとは？意味や使い方をわかりやすく解説 「聞いたことがある」「何となく知っている」などの人がほとんどでしょう。 ところが、「正確な意味は？ 」と聞かれると多くの人が答えにくいと思います。 そこで今回はこの「アイデンティティ」について具体例など | アイデンティティの意味や定義 わかりやすく解説 Weblio辞書 アイデンティティとは、「自分は何者か」という自己認識のことである。 Weblio国語辞典では「アイデンティティ」の意味や使い方、用例、類似表現などを解説しています。 | アイデンティティとは？意味を簡単に解説｜高校生にもわかる ... アイデンティティとは？ アイデンティティ（Identity）とは、 「自分は何者なのか」という自己認識や、自分らしさの感覚 を意味します。 簡単に言えば、 自分はどんな人間なのか 何を大切にして生きているのか 将来どんな人生を送りたいのか | 「アイデンティティー」とは？意味や使い方をわかりやすく ... アイデンティティーの意味を詳しく解説。 自己同一性や帰属意識といった概念から、日常生活での使い方、アイデンティティークライシスやコーポレートアイデンティティーなどの関連用語まで、具体例を交えてわかりやすく紹介します。 | アイデンティティとは？意味、類語、使い方・例文をわかり ... 「アイデンティティ」は「自己同一性（じこどういつせい）」と訳されます。 「アイデンティティ」をわかりやすく言えば「自分が何者であるかという認識」のことです。 個人だけでなく、国や企業や民族などについても使います。,no,,,2026-07-02,part1/5
アイトライ,アイトライ,会社概要 | 株式会社アイト／｢印刷＋α」のよろず相談室 アイトは、オリジナリティあふれる、販促＆オリジナルグッズをご提案します。 せっかく作る、配るのなら、その場限りで終わらない、ずっと使いたくなる質のいいグッズを。 お気に入りの品がありましたら、ぜひお声がけください。 | aito(アイトー)製作所 aito (アイトー)製作所の公式ブランドサイト・直営ECサイトです。 aito製作所は「食が変われば食器も変わる」という考えのもとに、毎日の食事を、器や道具によってもっと愉しい時間にしていきたいと考えています。 | 株式会社アイトー | アイトーは食器を中心とした ... 株式会社アイトー | アイトーは食器を中心としたテーブルウェアの卸売・小売事業や店舗開発、イベント企画、ロジスティクス、法人向け商品提案、国内外の商品調達・貿易を展開しております。 | アイト (あいと)とは【ピクシブ百科事典】 そして、妖精たちと共にいるアイトは、かねてから聞いていたフレイヤの幼少期の特徴と合致する存在でもあった。 そう、 アイトの正体は夢の中で幼少期の姿となっていたフレイヤ だったのだ。 | 会社案内 | 株式会社アイトー 会社案内 のページ。アイトーは食器を中心としたテーブルウェアの卸売・小売事業や店舗開発、イベント企画、ロジスティクス、法人向け商品提案、国内外の商品調達・貿易を展開しております。,no,,,2026-07-02,part1/5
アイビス,アイビス,"アイビスペイント - お絵かきアプリ - ibisPaint あなたの『描いてみた』をシェアしよう。ソーシャルお絵かきアプリ - アイビスペイント | アイビスペイント - Windows に無料でダウンロードして ... アイビスペイントはシリーズ累計5億ダウンロードの大人気本格お絵かきアプリです！ 47,000種以上のブラシ！ 27,000点以上の素材！ 2,100種類以上のフォント！ 84本の画像加工用フィルター！ 46種のスクリーントーン！ 27種のレイヤーブレンドモード！ | 企業情報 | 株式会社アイビス 2000年初頭のNTTドコモのi-modeが発表された時代に創業したアイビス。 当時のまだまだPCが優位な時代において、モバイル分野に特化した製品開発・サービスを次々とリリースしてまいりました。 | アイビスペイントX - Google Play のアプリ ＜アイビスペイントのご購入プランについて＞ アイビスペイントのご購入プランは以下のものがあります。 ・ アイビスペイントX（無料版） ・ アイビスペイント（有料版） ・ 広告除去アップグレード ・ プレミアム会員（月額プラン・年額プラン） | (株)アイビス【9343】：株価・株式情報（夜間PTS含む ... (株)アイビス【9343】の株価、チャート、最新の関連ニュース、掲示板、みんなの評価などをご覧いただけます。 前日終値、高値、安値はもちろんのこと年初来高値/安値もご覧いただけます。",no,,,2026-07-02,part1/5
