company_name,company_core,bing_snippet,has_incentive_mention,incentive_detail,incentive_rate,screened_date,worker_part
ウィザース・システム,ウィザースシステム,"YouTube Enjoy the videos and music you love, upload original content and share it all with friends, family and the world on YouTube. | YouTube - Apps on Google Play Get the official YouTube app on Android phones and tablets. See what the world is watching -- from the hottest music videos to what’s popular in gaming, fashion, beauty, news, learning and more.... | ‎YouTube App - App Store Get the official YouTube app on iPhones and iPads. See what the world is watching -- from the hottest music videos to what’s popular in gaming, fashion, beauty, news, learning and more. | Official YouTube Blog for Latest YouTube News & Insights Explore our official blog for the latest news about YouTube, creator and artist profiles, culture and trends analyses, and behind-the-scenes insights. | Download YouTube (free) for Windows, Android, APK, iOS and Web App | Kotaku Discover and enjoy endless videos with YouTube—watch what you love, follow your favorite creators, learn new things, and explore trending topics.",no,,,2026-07-02,part1/5
ウィズクリエイト,ウィズクリエイト,with（ウィズ）価値観で出会う恋活・婚活マッチングアプリ マッチングアプリwith（ウィズ）の公式ページはこちら！ 心理学を元にした無料の価値観診断・性格診断で、内面があったお相手を探せる恋活・婚活アプリ。 結婚がしたい、恋人がほしい、出会いがほしいをサポートするwithのアプリダウンロードはこちらから | 黒ウィズ攻略wiki｜魔法使いと黒猫のウィズ - ゲームウィズ GameWithの魔法使いと黒猫のウィズ (黒ウィズ）攻略サイトです。 精霊の評価や詳しいステータス、最新情報やクエストの攻略方法など、初心者向けまとめ情報などの記事があります。 | 株式会社ウィズ（公式ホームページ） 私たち株式会社ウィズは、福祉用品の製造・販売・レンタル、住宅改修などをおこなっています。 住み慣れたご自宅で、自分らしい日常生活を送っていただけるよう、一人一人に合った福祉用具を選び、ご提案いたします。 | マッチングアプリ with(ウィズ) - 出会い - Google Play のアプリ 【本命探しは自分を知ることから。 】 with (ウィズ)では従来の無料の出会い系アプリとは異なり、理想の条件や趣味嗜好だけでなく、「望む関係性」や「性格タイプ」等といった、性格や価値観の相性・共通点から恋人探しができます。 | ‎マッチングアプリ with (ウィズ) -出会いアプリ - App Store 【本命探しは自分を知ることから。 】 with (ウィズ)では従来の無料の出会い系アプリとは異なり、理想の条件や趣味嗜好だけでなく、「望む関係性」や「性格タイプ」等といった、性格や価値観の相性・共通点から恋人探しができます。,no,,,2026-07-02,part1/5
ウィズ・ワン,ウィズワン,with（ウィズ）価値観で出会う恋活・婚活マッチングアプリ マッチングアプリwith（ウィズ）の公式ページはこちら！ 心理学を元にした無料の価値観診断・性格診断で、内面があったお相手を探せる恋活・婚活アプリ。 結婚がしたい、恋人がほしい、出会いがほしいをサポートするwithのアプリダウンロードはこちらから | 黒ウィズ攻略wiki｜魔法使いと黒猫のウィズ - ゲームウィズ GameWithの魔法使いと黒猫のウィズ (黒ウィズ）攻略サイトです。 精霊の評価や詳しいステータス、最新情報やクエストの攻略方法など、初心者向けまとめ情報などの記事があります。 | 株式会社ウィズ（公式ホームページ） 私たち株式会社ウィズは、福祉用品の製造・販売・レンタル、住宅改修などをおこなっています。 住み慣れたご自宅で、自分らしい日常生活を送っていただけるよう、一人一人に合った福祉用具を選び、ご提案いたします。 | マッチングアプリ with(ウィズ) - 出会い - Google Play のアプリ 【本命探しは自分を知ることから。 】 with (ウィズ)では従来の無料の出会い系アプリとは異なり、理想の条件や趣味嗜好だけでなく、「望む関係性」や「性格タイプ」等といった、性格や価値観の相性・共通点から恋人探しができます。 | ‎マッチングアプリ with (ウィズ) -出会いアプリ - App Store 【本命探しは自分を知ることから。 】 with (ウィズ)では従来の無料の出会い系アプリとは異なり、理想の条件や趣味嗜好だけでなく、「望む関係性」や「性格タイプ」等といった、性格や価値観の相性・共通点から恋人探しができます。,no,,,2026-07-02,part1/5
ウィットシス,ウィットシス,ウィットとは？ 意味や使い方、エスプリ・ユーモアとの比較も ... ビジネスなどで「ウィットに富んだ人」という表現を聞く機会も珍しくないでしょう。 日常的にウィットという言葉を使っていても、はっきり意味が分からない人もいるかもしれません。 ウィットの意味や使い方、類義語や対義語も解説します。 | 「ウィット」の意味と「ウィットに富んだ」の使い方、類語 ... 「ウィット」は英語「wit」が語源で、「時と場合に応じて、とっさに気のきいたことを言ったりできる才能と知恵」という意味です。 「ユーモア」は情緒的なのに対して、「ウィット」は知的なものをいいます。 | Wit - 株式会社ウィット 採用情報 ウィットの採用情報をまとめました。 事業案内 お客様のご要望にお応えできる媒体で柔軟に取り組むことを心掛けています。 セールスプロモーション ニーズに合わせた企画立案・プランニングなどを行う事業です。 採用コンサルティング | 「ウィット」の意味とは？「ウィットに富む」や例文・類語も ... もともと「富む」はたくさん持っている、豊富にあるという意味があり、「ウィットい富む」で”ウィット（機知や知力）がたくさんある”となります。 「ウィット」は斬新なアイデアを求めるときに使われる | ウイット (うぃっと)とは？ 意味や使い方 - コトバンク ウイット ういっと wit 機知、頓知 (とんち)、才知。 ウイットとは本来知力のことだったが、イギリスにおいて17世紀ごろから、当意即妙な発想を意味するようになった。 とりわけダンの詩には鋭い奇想が随所にみられ、それがウイットの典型となった。,no,,,2026-07-02,part1/5
ウィツ,ウィツ,フランス語の「ウィ」の意味は？3つのバリエーションも併せて ... フランス語には欠かせない言葉「ウィ」ですが、その使う場面や「ウィ」にまつわる言葉や、「ウィ」に代る言葉も併せて、詳しくご紹介しますね。 記事を読み終えると「ウィ」について明確になり、さらにフランス語がよりあなたに近づくことでしょう。 | TVアニメ『杖と剣のウィストリア』公式サイト TVアニメ『杖と剣のウィストリア』7月7日よりTBS系全国28局ネットにて毎週日曜ごご4時30分から放送放送終了後ごご5時30分より、各配信サービスにて順次配信開始予定！ | ウィキペディア - Wikipedia 2002年12月、姉妹プロジェクトである ウィクショナリー （Wiktionary）が創設された。 これは、多言語の辞書と シソーラス を制作することを目標にしているプロジェクトである。 ウィキペディアと同じサーバで、同じソフトウェアを使って活動している。 | ミッシェル・ウィが全米女子OPで復帰！ 2児の母が現役引退から ... 23年に現役を退き2児の母になったミッシェル・ウィが今年6月の全米女子オープンへの1回限りの復帰をSNSで発表した。 | 映画『ウィキッド 永遠の約束』公式サイト 共に笑い、時にすれ違い、 傷つき――彼女たちは、自らの選択に答えを出す。 魔法と幻想に満ちたオズの国に、私たちが生きる世界の姿を映し出す『ウィキッド』。 あなたの“これから” を変えていく体験が、映画館で待っている。,no,,,2026-07-02,part1/5
ウィナス,ウィナス,フランス語の「ウィ」の意味は？3つのバリエーションも併せて ... フランス語には欠かせない言葉「ウィ」ですが、その使う場面や「ウィ」にまつわる言葉や、「ウィ」に代る言葉も併せて、詳しくご紹介しますね。 記事を読み終えると「ウィ」について明確になり、さらにフランス語がよりあなたに近づくことでしょう。 | TVアニメ『杖と剣のウィストリア』公式サイト TVアニメ『杖と剣のウィストリア』7月7日よりTBS系全国28局ネットにて毎週日曜ごご4時30分から放送放送終了後ごご5時30分より、各配信サービスにて順次配信開始予定！ | ウィキペディア - Wikipedia 2002年12月、姉妹プロジェクトである ウィクショナリー （Wiktionary）が創設された。 これは、多言語の辞書と シソーラス を制作することを目標にしているプロジェクトである。 ウィキペディアと同じサーバで、同じソフトウェアを使って活動している。 | ミッシェル・ウィが全米女子OPで復帰！ 2児の母が現役引退から ... 23年に現役を退き2児の母になったミッシェル・ウィが今年6月の全米女子オープンへの1回限りの復帰をSNSで発表した。 | 映画『ウィキッド 永遠の約束』公式サイト 共に笑い、時にすれ違い、 傷つき――彼女たちは、自らの選択に答えを出す。 魔法と幻想に満ちたオズの国に、私たちが生きる世界の姿を映し出す『ウィキッド』。 あなたの“これから” を変えていく体験が、映画館で待っている。,no,,,2026-07-02,part1/5
ウィーズ,ウィーズ,会社案内 - 調剤薬局の株式会社ウィーズ調剤薬局の株式会社 ... 社名 [ウィーズ] の由来 Origin of Name 「株式会社ウィーズ」の社名には、「Weeds（雑草はすぐ育つ）」 「With（みんなで一緒に）」 「Will Needs（将来必要とされる）」といった 深い意味合いが込められています。 社内公募の上、投票によって決定しました。 | 株式会社ウィーズ 卸売事業 少しでも医療経営の改善に向けて、弊社がお手伝い致します。 この混沌として不確実な医療業界の状況においても、積み上げた経験と培ってきたノウハウを活かし、皆様の医療経費の収益改善に向けて株式会社ウィーズがお手伝いいたします。 | 株式会社ウィーズ ひとつは、縦の組織ではなく横の組織を重視した、言わば「誰がエライか」ではなく「誰が何を担当するのか」を 決めていくという権限委譲を確立、そのスタイルを貫いていること。 もうひとつは、会社の経営・運営に携わる 大半の役員と管理部門の責任者が調剤の現場実務に明るい薬剤師と ... | 事業所一覧 | 株式会社ウィーズ 卸売事業 医療経費の収益改善に向けて株式会社ウィーズがお手伝い致します。 全国30拠点以上のネットワークで、お客様の身近な場所からきめ細やかなサービスを提供いたします。 北海道から九州まで安心してご利用いただける充実した拠点体制を整えております。 | 調剤薬局の株式会社ウィーズ - ウィーズは次代をリードする ... つい食べすぎてしまう癖をいい加減直... お知らせ information 2026年4月7日 🌸令和8年度E-BONDグループ入社式🌸 2026年1月22日 2026年 E-BONDグル－プ『ウィーズ』新年会 開催！ 2025年12月19日 医療DX推進体制整備加算算定店舗のご案内,no,,,2026-07-02,part1/5
ウイング,ウイング,ウイング｜ワコール直営の公式下着通販サイト ワコールウェブ ... ウイングの商品一覧です。 ブラジャー・ショーツ・ランジェリーなどの「ワコール」公式通販サイト。 充実したサイズとカラー展開で品揃え豊富なワコール公式通販でお買い物。 | 本社・拠点 - ウイング公式サイト ウイング公式サイト。ウイング本社（東京）、ウイング・ウエスト（大阪）、ウイング・セントラル（名古屋）、ウイング・柏のご案内ページとなります。 ウイング本社（東京） 住所 〒150-6036 東京都渋谷区恵比寿4-20-3 恵比寿ガーデンプレイスタワー36F | 株式会社ウイング ... この度、株式会社ウイングは、Forbes JAPANのタイアップ企画にて、株式会社コロナ様、ジェネクサス・ジャパン様との対談が実現しました。 この機会... | 楽天市場 | Wing 公式ショップ楽天市場店 - wing/ウイング公認 ... 更新日：07/01（06/24〜06/30集計） 1 位 ブラトップ ウイング 【シンクロブラトップ 吸汗速乾タイプ】 カップ付きキャミソール Wing ウイング インナー・ルームウェア その他のインナー・ルームウェア ピンク ブラウン ベージュ グレー ホワイト [Rakuten Fashion ... | トップ - ウイング公式サイト 良質は脂質には、「オメガ3（n-3系脂肪酸）」「オメガ6（n-6系脂肪酸）」と「オメガ9（n-9系脂肪酸）」があります。身体のエネルギーとし… 元気な高齢者の多い日本では、大きな病気のために要介護になる人よりも、元気な状態からだんだん弱って（フレイルを経て）要介護状態になる人が ...,no,,,2026-07-02,part1/5
ウイングソリューションズ,ウイングソリューションズ,ウイング｜ワコール直営の公式下着通販サイト ワコールウェブ ... ウイングの商品一覧です。 ブラジャー・ショーツ・ランジェリーなどの「ワコール」公式通販サイト。 充実したサイズとカラー展開で品揃え豊富なワコール公式通販でお買い物。 | 本社・拠点 - ウイング公式サイト ウイング公式サイト。ウイング本社（東京）、ウイング・ウエスト（大阪）、ウイング・セントラル（名古屋）、ウイング・柏のご案内ページとなります。 ウイング本社（東京） 住所 〒150-6036 東京都渋谷区恵比寿4-20-3 恵比寿ガーデンプレイスタワー36F | 株式会社ウイング ... この度、株式会社ウイングは、Forbes JAPANのタイアップ企画にて、株式会社コロナ様、ジェネクサス・ジャパン様との対談が実現しました。 この機会... | 楽天市場 | Wing 公式ショップ楽天市場店 - wing/ウイング公認 ... 更新日：07/01（06/24〜06/30集計） 1 位 ブラトップ ウイング 【シンクロブラトップ 吸汗速乾タイプ】 カップ付きキャミソール Wing ウイング インナー・ルームウェア その他のインナー・ルームウェア ピンク ブラウン ベージュ グレー ホワイト [Rakuten Fashion ... | トップ - ウイング公式サイト 良質は脂質には、「オメガ3（n-3系脂肪酸）」「オメガ6（n-6系脂肪酸）」と「オメガ9（n-9系脂肪酸）」があります。身体のエネルギーとし… 元気な高齢者の多い日本では、大きな病気のために要介護になる人よりも、元気な状態からだんだん弱って（フレイルを経て）要介護状態になる人が ...,no,,,2026-07-02,part1/5
ウインワンズウエイ,ウインワンズウエイ,ウインレーシングクラブ ウインレーシングクラブでは、 セキュリティー保護のため 暗号化通信を導入しています。 Copyright 2002-2012 Win Racing Club. All Rights Reserved. | ウイン - Wikipedia 現役馬 ウインマーベル - 2022年 葵ステークス 、2023年 阪神カップ 、2024年 阪急杯 、 京王杯スプリングカップ ウインカーネリアン - 2022年 関屋記念 、2023年 東京新聞杯 、2025年 スプリンターズステークス [3] ウイングレイテスト - 2023年 スワンステークス | 会社情報 - 株式会社ウイン（愛媛・広島・大阪） 株式会社ウインの会社情報のご案内。情報処理（データエントリー）、システム開発、ホームページ制作（Webマーケティング）、広告企画デザイン、印刷全般、人材派遣とITを基盤としたビジネスソリューションを総合的にサポートする株式会社ウイン。 | 所属馬一覧（所属馬情報）／ウインレーシングクラブ 【並び替え機能について】 ご利用のブラウザのセキュリティレベルが「高」になっている場合、並び替え機能が利用できないことがあります。 お手数ですが、セキュリティを「中」に設定し直して再度ご利用ください。 | 【WINTICKET(ウィンチケット)】公営競技の投票がスマホで簡単 ... WINTICKET (ウィンチケット)は、競馬、地方競馬と並ぶ競輪・オートレースといった公営競技のライブ映像の視聴・投票が可能なインターネット投票サービス。 競輪・オートレースの高画質ライブ映像も無料配信。,no,,,2026-07-02,part1/5
ウェストイノベーション,ウェストイノベーション,"銀座ウエスト 銀座ウエスト公式オンラインショップ『人工の香料、色素等をできるかぎり使用せず、材料本来の風味を生かすべく、ひとつひとつ職人の手作業による成型』との姿勢で1947年の創業以来取り組んでいます。 | WEST.｜STARTO ENTERTAINMENT ノーベル製菓「VC-3000のど飴」 WEST. 出演は変更される場合があります。 あらかじめご了承ください。 また、テレビ・ラジオ番組は各ネット局により、放送時間が異なります。 | ウエスト 公式サイト ウエスト公式サイト｜ホーム 〒812-0887 福岡県福岡市博多区三筑1丁目5番8号 TEL.092-582-3911 / FAX.092-574-0699 | WEST. - Wikipedia 公式お姉さんは 友近 [8]。 公式 ファンネーム は『ジャス民』 [9][10]。 このファンネームは公募で決定したものである [10]。 2023年 10月18日 、グループ名をジャニーズWESTから WEST. に変更すると自身の YouTube チャンネルで発表した [1][11]。 | WEST. - YouTube WEST. (w/English Subtitles!) ""shhhhhhh!!"" Official Music Video [YouTube Ver.] WEST.",no,,,2026-07-02,part1/5
ウェブエッジ,ウェブエッジ,Web (ウェブ)とは？初心者でも分かる意味を解説します ... 本記事では、Webの概要や利用されているサービス、Webページの仕組み、今後の業界動向などについて解説していきます。 Webに関する基礎知識を身につけることで、ビジネスチャンスの拡大や業務効率の向上につながる可能性があります。 | Web (ウェブ)とは何か？超がつくほどわかりやすく解説【とは ... Webは何の略？ Webは、 正式名称がWorld Wide Web（ワールド・ワイド・ウェブ） なのですが少し長いので、略してWeb（ウェブ）と表現するのが一般的になっています。 | World Wide Web - Wikipedia Web 、 ウェブ 、 W3 （ダブリュー スリー） [1] とも呼ばれる。 情報提供を担う者は ウェブサーバ を公開し、一般利用者は ウェブブラウザ を介して ウェブサーバ にある情報を閲覧するようなシステムが基本である。 | webとは何？どういう意味？初心者にもわかりやすく簡単解説し ... Webとは何なのか、どういう意味なのか初心者にも分かりやすく解説します。 インターネットに詳しくない人であればwebと言われてもあまりピンとこない方も多いでしょう。 WebサイトやWebページ、Webサービスなど、ウェブと呼ばれるものは色々とあります。 | Web (ウェブ)とは？ 意味や仕組み、インターネットとの違いなど ... Web (ウェブ)とは Webとは、インターネット上のさまざまな情報 (テキスト・画像・動画など)の閲覧を可能にするシステムのことです。 WebはWorld Wide Web (ワールドワイドウェブ)の略称で、直訳すると「世界規模のくもの巣」になります。,no,,,2026-07-02,part1/5
ウェブフロンティア,ウェブフロンティア,Web (ウェブ)とは？初心者でも分かる意味を解説します ... 本記事では、Webの概要や利用されているサービス、Webページの仕組み、今後の業界動向などについて解説していきます。 Webに関する基礎知識を身につけることで、ビジネスチャンスの拡大や業務効率の向上につながる可能性があります。 | Web (ウェブ)とは何か？超がつくほどわかりやすく解説【とは ... Webは何の略？ Webは、 正式名称がWorld Wide Web（ワールド・ワイド・ウェブ） なのですが少し長いので、略してWeb（ウェブ）と表現するのが一般的になっています。 | World Wide Web - Wikipedia Web 、 ウェブ 、 W3 （ダブリュー スリー） [1] とも呼ばれる。 情報提供を担う者は ウェブサーバ を公開し、一般利用者は ウェブブラウザ を介して ウェブサーバ にある情報を閲覧するようなシステムが基本である。 | webとは何？どういう意味？初心者にもわかりやすく簡単解説し ... Webとは何なのか、どういう意味なのか初心者にも分かりやすく解説します。 インターネットに詳しくない人であればwebと言われてもあまりピンとこない方も多いでしょう。 WebサイトやWebページ、Webサービスなど、ウェブと呼ばれるものは色々とあります。 | Web (ウェブ)とは？ 意味や仕組み、インターネットとの違いなど ... Web (ウェブ)とは Webとは、インターネット上のさまざまな情報 (テキスト・画像・動画など)の閲覧を可能にするシステムのことです。 WebはWorld Wide Web (ワールドワイドウェブ)の略称で、直訳すると「世界規模のくもの巣」になります。,no,,,2026-07-02,part1/5
ウェーブ,ウェーブ,株式会社ウェーブ | WAVE CORPORATION ENJOY YOUR CREATIVE HOBBY LIFE ホビーメーカー ウェーブの公式サイトです。 プラモデル・フィギュア・模型用工具・材料の開発、製造を行なっております。 | ネット印刷・プリント通販なら格安、激安、即日印刷の【WAVE】 登録手続き不要、すぐに購入 ウエーブは、2000年に日本で初めてネット通販印刷を開始以来、ネット印刷の草分けとして実績を積んでまいりました。 弊社独自のノウハウで、高品質な印刷・サービスを短納期で、しかも納得の低価格でご提供いたしており ... | ホコリ残りゼロへ- ウェーブ - ユニ・チャーム ホコリ残りゼロへ | ユニ・チャームのお掃除用品『ウェーブ』シリーズの公式サイトです。 フロアワイパー、ハンディワイパー、超ロングタイプの便利で効果的な使い方をイラストや動画で詳しくご紹介。 [ウェーブ／ユニ・チャーム] | 株式会社ウエーブ会社概要サイト | ネット印刷のパイオニア ... 株式会社ウエーブの会社概要サイトです。 ウエーブは、システム会社として設立。 日本の通販オフセット印刷におけるパイオニアとして、ネット印刷業界で挑戦を続けてきました。 新規事業としてロボット・メカトロ開発、製造をスタート。 | TOP｜株式会社ウェーブ - Making your Solution. ウェーブには、各技術分野にて 専門的なスキルを磨いた技術者が多数在籍しております。 長年蓄積されたノウハウを元に、物事の大小を問わず様々な問題解決に取り組んでまいります。,no,,,2026-07-02,part1/5
