company_name,company_core,bing_snippet,has_incentive_mention,incentive_detail,incentive_rate,screened_date,worker_part
10バトン,10バトン,"A Unique Travel Experience - Anubhav Vacations Anubhav Holidays, discovers new destinations in India while keeping our base in Karnataka. Anubhav Vacations travels with people internationally to distant lands and explores them through the eyes of local culture. | International & World Tour Holiday Packages from India - Anubhav Vacations Book International Holiday Packages - Get the best deal on international tours from Anubhav. Explore the finest holidays and adventure destinations across the world. | Gokarna and Coastal Karnataka | Our Flagship Tour! - Anubhav Vacations Book 6 Nights / 7 Days Coastal Karnataka Tour Packages with Anubhav to create lasting travel memories. Coastal Karnataka Tour has become the most famous tour that we operate. Get in touch with our team. | Domestic - Anubhav Vacations Musical Tour Stories behind old Hindi songs Staying for 3 nights and 4 days in the forest and listening to nature's sounds as well as old Hindi Music is what this tour is abo... | Coorg Tour Packages | Hills of Karnataka by Train - Anubhav Vacations In this tour of Karnataka, the coffee plantation accommodation in Madikeri and the Hoysala Village Resort in Hassan make sure you stay amidst nature. This place is not only full of greenery but also is home to the Belur and Halebidu archaeological sites. With the backing of 24 years of our “Anubhav” in Karnataka, we present to you our most popular tour of this region – “Hills of Karnataka”. We can proudly say that we are pioneers of this tour.",no,,,2026-07-02,part1/5
2PS,2ps,"2PS 株式会社2PSは、最先端のIT技術を駆使したシステム・ソフトウェア開発と得意とし、技術支援サービス、受託開発サービス、AI/IoTソリューションサービスを提供しています。 | 2PS OFFICAL WEBSITE - 2PS - 芸能プロダクション - 4話完結【ヨミドラマ】シリーズ「見上げた空に、あなたを想う」 同じ楽曲を4組のアーティストが異なるバージョンで物語を彩る。 あなたは見上げた空に、誰を想いますか？ 公式サイト：https://www.2ps-twopeace.com/video-production/ | 会社情報 - 株式会社2PS 株式会社2PSは、最先端のIT技術を駆使したシステム・ソフトウェア開発と得意とし、技術支援サービス、受託開発サービス、AI/IoTソリューションサービスを提供しています。 2PSの会社情報のご紹介です。 | COMPANY - 2PS - 芸能プロダクション - 株式会社2PS 2PS Co.,Ltd. 《事業内容》 アーティスト・タレント マネジメント エージェント業務 イベント企画制作 楽曲制作・歌唱指導・ダンス振付 / 指導 映像制作（U-NEXT配信ドラマ「Loved One」製作） レンタルスペース運営（STUDIO TWOPEACE） 《住所》 事務所 ... | ツーピーエス脱毛器公式サイト (2PS)ツーピーエス製品詳細 ツーピーエスは早い！楽々スピード脱毛、片ワキ15秒※でOK ツーピーエスは照射面積（一回に脱毛させるための光を当てられる範囲）が広く、あっという間に脱毛処理が終わります。なんと片ワキ15秒※快速です。※成人女性 Level1 個人差はございます。",no,,,2026-07-02,part1/5
A-STAR,a-star,"A - Wikipedia 筆記体 ジュッターリーン体 大きく分けて3つの字形が使われる。 三角形の左辺と右辺が下にのびた形であり、大文字に使われる。 丸の右に縦に接線を付けた形 (single-storey) であり、多く小文字に使われるが、大文字の筆記体でこの字形を使うことがある。また フラクトゥール では A a ... | 英語「a」の意味・使い方・読み方 | Weblio英和辞書 「a」の意味・翻訳・日本語 - 英語アルファベットの第 1 字、 (連続したものの)第 1 番目 (のもの)、A 字形 (のもの)、 (5 段階評価で)秀、エイ、 (ABO 式血液型の) A 型、イ音、イ調｜Weblio英和・和英辞書 | A の読み方は「エー」？「エイ」？──カタカナ表記と英語発音 ... 言語UXの観点から見ると、「正しい発音」よりも「通じる発音」や「場に合った発音」が重要だと言えます。 まとめ 結論として、英語のアルファベット“ A ”の正しい名前読みは「エイ」です。 「エー」は日本語のカタカナ表記上の便宜であり、実際の英語発音とは異なります。 食事の注文で ... | 尼崎市公式ホームページ 尼崎市公式ホームページ。 くらし・手続き、子育て・教育、文化・スポーツ・学び、産業・ビジネス、市政情報、イベント、施設などの情報を掲載しています。 お問い合わせは、尼崎市コールセンター（06-6375-5639）まで。 | Å - Wikipedia Å, å は、 A に リング符号 を付した 文字。 文字名称は、 Unicode では「latin capital letter a with ring above」「latin small letter a with ring above」、 JIS X 0213 では「上リング付きA」「上リング付きA小文字」。",no,,,2026-07-02,part1/5
AEVIC,aevic,株式会社AEVIC（アビック） AEVICはIT技術集団です。 ソフトウェア・アプリ・ウェブ開発、SESなどのサービスを提供しています。 WEB・アプリの企画立案からシステム設計、開発、運用はもちろん、プロモーションまでお客様の様々なご要望に柔軟にお応えします。 | 企業概要 | 株式会社AEVIC（アビック） 株式会社AEVICの、会社概要のページです。会社概要の詳細、事業所所在地などについてご紹介しています。 | (株)AEVICの新卒採用・会社概要 | マイナビ2027 AEVICには、初めてITに触れる方でも安心して飛び込める場所があります。 業界でも珍しい専任講師2人体制の研修で、ITの基礎からチーム開発までを丁寧にサポート。 システムエンジニア・プログラマーの第一歩を安心して踏み出せます。 | AEVIC - Wikipedia AEVIC ... 株式会社AEVIC （アビック）は、 東京都 東京都千代田区 に 本社 を置き、自社 アプリケーション 開発・運営及び、金融系システム・インフラ受託案件を請負う 日本 の システム開発 企業。 | アクセス | 株式会社AEVIC（アビック） アクセス CI 会社案内パンプレット サービス コンセプト アーキテクト 開発実績 SES ToDotto SaqQutto PottLoood UniQooOne 採用情報 動画紹介 ニュース 行動計画 お問い合わせ ISMS基本方針 コンプライアンス 個人情報保護方針 個人情報適正管理 人権基本方針 Copyright © AEVIC Co. Ltd.,no,,,2026-07-02,part1/5
AGORA TECHNO,agoratechno,"アゴラ 言論プラットフォーム | 経済、ビジネス、情報通信 ... アゴラ 言論プラットフォーム | 経済、ビジネス、情報通信、メディアなどをテーマに、専門家が実名で発言することで政策担当者、ジャーナリスト、一般市民との交流をはかる言論プラットフォーム | 【公式】アゴーラ ホスピタリティーズ | 美しい日本を提供する ... 2026.04 アゴーラ ホテル アライアンス アゴーラ公式アプリ「AGORA」マイルサービス提供開始のお知らせ 2026.03 アゴーラプレイス 京都二条 絵師 Ki-Yan（木村英輝）が描く白虎のロビー壁画が完成 2026.02 ホテル アゴーラ リージェンシー 大阪堺 | 記事一覧 | アゴラ 言論プラットフォーム 2026年07月01日 アゴラ編集部 猛暑で1300人死亡のフランス、左派環境大臣が「脱炭素」叫びながら庶民に我慢強要 2026年07月01日 音喜多 駿 高齢者医療費の負担拡大、ついに全世代で賛成が過半数を超えた 2026年07月01日 黒坂 岳央 ついていいウソ、ついたらダメ ... | Real-Time Engagement & Conversational AI Platform | Agora “The Agora RTE solution is the platform needed to bridge the virtual and physical world, providing everyone a unique view into what’s happening. Its ease of use is an important piece of our innovation puzzle in creating meaningful human connections.” | 【ホテル公式】アゴーラ 東京銀座 | 銀座駅近くのホテル Agora Hotel Alliance× Greater Bay Airlines 香港拠点のエアラインと初のタイアップ 東京・京都・大阪の9ホテルで最大20％OFF 〈プラン特典〉 •Greater Bay Airlines 香港•日本間 対象路線航空券運賃割引 •航空券ご購入の方限定で対象施設の 宿泊料金 最大20％OFF",yes,,,2026-07-02,part1/5
AMSクリエイト,amsクリエイト,"ファッション・アパレル業界のECサイト構築・運用支援なら『AMS ... アパレルECならAMS。 AMSのソリューションでビジネスに力を。 ECシステムからOMOの実現、EC運用業務支援までお客様が抱えるニーズと課題はAMSにお任せください。 一気通貫で売上の向上とビジネスの成長を支援します。 | 制作費0円、月額費用5,500円のホームページ制作AMS | Web ... AMSさんにお問い合わせすると、初歩的な質問でも分かりやすく丁寧に教えていただけるので、とても安心しております。 時間がなくて自分自身で更新作業ができなかったり、作業が多い場合は依頼しています。 | AMSとは？メリットやサービス内容、具体的な活用事例を解説 ... AMSは、トラブル対応に加え、日常的な運用や利用者対応、セキュリティ管理、改善提案など、幅広い業務をカバーします。 AMSを導入することで、企業はIT運用にかかるコストを削減しつつ、貴重な人材を戦略的な業務へと集中させることができます。 | AMO（AMS）とは？ システム運用保守のアウトソーシング ... AMS（Application Management Services）：「Services（サービス）」という提供内容や機能に焦点を当てた呼び方です。 SAPやIBM、アクセンチュアなどの外資系ベンダーや、グローバルなコンサルティングファームでは「AMS」という呼称が主流です。 | 株式会社AMS｜宝飾品・時計の総合商社｜公式サイト Services｜事業内容｜ Brands｜取り扱いブランド｜ Contact Us｜お問い合わせ｜ News & Information Grand Seiko 新作の入荷です TENDENCE新作の入荷です HUBLOT人気モデルの入荷です HUBLOTスピリット オブ ビッグ・バン入荷 タグ・ホイヤー入荷!! Copyright © 株式会社AMS All Rights ...",no,,,2026-07-02,part1/5
ASIANGRACE,asiangrace,"共立女子大学の総合型の基礎学力方式で受験したのですが ... 共立女子大学の基礎学力試験方式の文芸学部を受けたのですが、受けた方去年より難しいと思いましたか？ 3 2025/10/1 1:53 Q&Aをもっと見る（4,764 件） | 昭和女子大学、東京家政大学、共立女子大学、大妻女子大学で ... 昭和女子大学、東京家政大学、共立女子大学、大妻女子大学で迷ってます！学部は国際系と英語系です。それぞれいい所とかおすすめのところ教えてください！ 昭和女子と共立女子は、海外の大学や短大の卒業資格をあわせて取れる制度があるので、やる気があるなら貴重な経験がつめる ... | 共立女子大学と昭和女子大学に受かっているのですがどちらが ... 私なら共立女子大学を選びますね。どちらも昔から評判の良い、歴史ある女子大学。昭和女子大学は就職率がいいと聞きますが、その分高校生の延長のような感覚を持たれることもあるそうです。（課題が多いとか出欠が厳しいとか）共立女子大学は自力した女性のイメージ、そして何より立地 ... | 本日共立女子大学の総合型基礎学力テストを受けてきました ... 本日共立女子大学の総合型基礎学力テストを受けてきました。皆さん何割くらい取れていましたか？？ 誰も知恵袋に質問していなかったので不安です。去年の合格者は何割で合格だったでしょうか。また英国だと5割5割の割合かどうかも去年の得点開示で公に出ていたら教えて頂きたいです ... | 共立女子第二より共立女子の方がレベル圧倒的に高いですよね ... ・共立女子第二は、共立女子の第二校舎として設立された学校で、偏差値は60前後と推定されています。 つまり、偏差値で10ポイント前後の開きがあり、共立女子の方がかなり難易度が高い高校と言えます。",no,,,2026-07-02,part1/5
Adapt,adapt,"英語「adapt」の意味・使い方・読み方 | Weblio英和辞書 adapt 「adapt」は「適応する」「適合させる」などの意味を持つ英単語である。 「adapt」とは・「adapt」の意味 「adapt」は「適応する」「適合させる」「改作する」という意味を持つ動詞である。 adaptの用法 動詞 適応する、適合させる、改作する | 「adapt」と「adopt」の違いが分かりますか？ - ネイティブ ... 「Adapt」と「Adopt」の違いを解説しています。 「Adapt」は環境に適応すること、物語を別の形で再作成することを意味し、「Adopt」は何かを受け入れる、採用する、または養子にすることを指します。 | 英語「adapt」の意味や使い方は？例文を交えて解説 - Weblio ... どのように使う？ 英単語「adapt」は、何かを状況や環境に合わせて変更したり調整したりすることを表します。 特に、「適応する」「慣れる」「適合させる」といった意味があり、時には「改造する」や「翻案する」といったニュアンスも含まれます。 | adaptとadoptの違いの覚え方！意味と使い方を例文で解説 ... 「adapt」と「adopt」の覚え方のポイントは、言葉の成り立ちを比べてみると分かりやすいです。 adaptに含まれる「apt」は「適切な,ふさわしい」という意味の形容詞です。 ですから、adaptには、適切な形に変えるというニュアンスがあります。 | 「adapt」の意味と使い方とは？例文を使って分かりやすく解説 ... 「adapt」は英語の動詞で、「適応する」「適合させる」「改作する」などの意味を持ちます。 日本語では「アダプト」とカタカナで表記されることが多く、新しい環境や状況に合わせて変化することを表す便利な単語です。 基本的な発音は「アダプト」で、発",no,,,2026-07-02,part1/5
Androbo Nexus,androbonexus,"《火影忍者》应该以怎样的顺序观看？ - 知乎 火影忍者疾风传剧场版：The Last 关于后面出的博人传，各位入坑前请三思而后行，前面一百多集除了少部分集数质量不错以外（第65集国人画师吹爆），大部分时间都在给观众喂olg，只是在消费火影迷的情怀而已。（目前动画已经进入漫画的主线剧情，至少比前面的原创剧情要好） 但是不反对看剧场 ... | 就在今日，优酷正式下架《火影忍者》动漫，请问以后永远都 ... 截至2024年3月，中国大陆境内暂未有正规流媒体平台可以播放完整版动漫《火影忍者疾风传》。 腾讯还是只有忍者大战后那一百多集，彻底寄了家人们，这下真的只能看盗版了。 之前还有一些回答猜测腾讯可能接盘的，时间已经证明了一切。 | 魔兽疾风拂晓攻略 - 百度经验 魔兽疾风拂晓攻略,疾风拂晓时一款热门的动漫火影忍者的防守地图，下面分享下疾风拂晓的通关攻略，希望能帮助到大家。 三、出怪的时候再Hc去领了福利和情报任务，然后再买个晓玉守家，打完进攻怪，再去把情报送了，送完不要急着交任务，先回hg回家打晓衣服组件，一般运气好一次就出了，没 ... | 魔兽世界 [迅如疾风]世界任务怎么做-百度经验 每个地图都有一个迅如疾风的任务点，这里以风暴峡湾的迅如疾风为例为大家讲解这个任务的做法。 到达任务地点找到任务NPC就会自动接受任务并且动作条变为任务所需的动作条。 | 在steam上面火影忍者究极风暴四应该买哪一个（要完整版）? 以及你想要玩的《火影忍者：究极忍者风暴4》以及4个DLC。 4个DLC分别是： 鹿丸传 我爱罗传 音隐四人众 博人之路 如果你想重温前作，又想得到完整的体验，那就买这个。 —————— 最后一个捆绑包很好理解，就是你想要玩的《火影忍者：究极忍者风暴4》以及4个DLC。 没有前作。",no,,,2026-07-02,part1/5
Androbo Quick,androboquick,オンラインでPDFの結合や圧縮・編集ができる「iLovePDF」 ビジネスシーンでは公式文書として「PDF」がよく使われますが、加工するのは手間がかかります。そこで今回はPDFが簡単に加工できるサービスをご紹介します。「iLovePDF」はオンラインで結合や圧縮・編集などができるWebサービスです。 | ilovepdfというサイトでwordファイルをpdfファイルに変... - Yahoo!知恵袋 iLovePDFというサイトでテンプレートに文字を打ち込んだのですが 編集保存した後に開いてみたら文字ズレていてこれの再編集をする方法を教えてください。 解決方法にエクセル、ワードを使うなどがあるみたいですが私はその2つを持っていません。 | PDFに画像を貼り付ける方法をおしえてください。オンラインの... - Yahoo!知恵袋 PDFに、無料で画像に添付できる方法を教えてください。 WindowsでもiPhoneでもどちらでもかまいません。Adobe Acrobat Readerは使用しておりテキストの追加・編集はそちらで行っていますが、画像挿入は有料プランでのみ使用可能と知りました。 おそらく今回1度のみの使用なので、できれば無料で画像挿入できる方法を試したいと思います。 Wordへのファイル変換は編集許可な... | 如何将pdf页面调整为统一大小？ - 知乎 很简单，只需要10秒钟~ 操作：文件-->打印-->打印机选择adobe PDF-->页面选择大小（合适或缩小过大的页面皆可）-->最后选择打印！ | 有没有在线免费的pdf转换软件? - 知乎 iLovePDF是一个完全免费、易于使用、丰富的PDF处理工具，包括：合并、拆分、压缩、转换、旋转和解锁PDF文件，以及给PDF文件添加水印的工具等。仅需几秒钟即可完成。 iLovePDF | Online PDF tools for PDF lovers iLovePDF是一个完全免费、易于使用、丰富的PDF处理工具，包括：合并、拆分、压缩、转换、旋转和解锁PDF文件，以及给PDF文件添加水印的工具等。仅需几秒钟即可完成。,no,,,2026-07-02,part1/5
Asikaze,asikaze,Maizen Japanese Channel - YouTube 本日、5月17日で、僕たちまいぜんシスターズのYouTubeチャンネルが開設10周年を迎えました！ 10年間、たくさんの応援を本当にありがとう。 みなさんのおかげで、こうして記念すべき日を迎えることができ、心から感謝の気持ちでいっぱいです。 これからも、笑顔と元気を届けられるように頑張りますので、 11年目も、どうぞよろしくお願いします！... | ホーム Maizen.com まいぜんシスターズのアイテムをご覧いただけます。 グッズ まいぜんシスターズの動画をご覧いただけます。 まいぜんの動画を見る まいぜんシスターズってなに? ぜんいちとマイッキーとその友達について紹介します。 | まいぜんシスターズ - Wikipedia まいぜんシスターズ （Maizen Sisters）は、 ぜんいち と マイッキー という2人のオリジナルキャラクターから構成される男性二人組の YouTuber である。 そして、ゲーム『Minecraft』の 実況動画 の投稿を中心に活動している [1][2]。 また、同チャンネルが使用するキャラクターらも同名である。 名前の由来について過去動画（ギリギリの質問コーナー）にて、2人は女性アイドルのファンであり、憧れてシスターズという名前をつけたと語っている。 2017年からYouTuber事務所のUUUMに所属していたが、2021年9月にUUUMを脱退し、同年10月以降はLaser FZCOに所属している。 | まいぜんシスターズの最新動画｜YouTubeランキング 4月17日（金）より池袋本店を含む13店舗でグッズフェアが開催中です。 オンラインでもグッズの購入ができるので、以下の特設サイトをチェックしてみてね！ さらに、この動画は有楽. 建築対決でチートを使ってズルした結果！ 【まいくら・マインクラフト】 新しい動画をチェックするためにチャンネル登録よろしくお願いします！ / @maizen おすすめプレイリスト：色々なMODを紹介 • ベイビーモードの難易度がヤバすぎる！ Ep1【爆笑MODランキング】 マインクラフ. | まいぜんシスターズ / 動画 [人気順] - YouTube 死ぬほどキケンな箱を100個開封するアスレチックの難易度が高すぎた！ 【まいくら・マインクラフト】 まいぜんシスターズ 18M views • 6 years ago 1: ...,no,,,2026-07-02,part1/5
B-CRUISE,b-cruise,B.LEAGUE（Bリーグ）公式サイト 男子プロバスケットボールリーグ、B.LEAGUE（Bリーグ）。 試合日程・結果、最新の順位・成績、チーム・選手データなど、B.LEAGUEの充実した情報をご案内。 | クラブ | B.LEAGUE（Bリーグ）公式サイト B.LEAGUEの「クラブ」をご紹介。男子プロバスケットボールリーグ、B.LEAGUE（Bリーグ）。 | 用紙のサイズ一覧（A判・B判）【サイズ.com】 A4、B5など紙のサイズを一覧表にしました。パッと見てわかりやすいので、是非ご覧ください。また、Aシリーズ、Bシリーズについての雑学も紹介していますので、用紙のサイズについて知りたい方は参考にして下さい!! | +B LIFETIME+BASEBALL そんな思いを込めたライフスタイルショップ「＋B」をスタートしました。 日常に野球を＋する。 ＋Bは、日常生活で使いたくなるような良質でおしゃれな雑貨や洋服、趣味のグッズに、野球の心を＋します。 | 哔哩哔哩直播，二次元弹幕直播平台 哔哩哔哩（bilibili）直播，在这里看见最年轻的生活方式，学习、游戏、电竞、宅舞、唱见、绘画、美食等等应有尽有，快来捕捉你最喜欢的up主最真实的一面吧！,no,,,2026-07-02,part1/5
CLOCK・IT,clockit,"オンラインクロック｜オンライン時計｜時間｜vClock.jp 今何時ですか。オンラインクロック。このサイトでは、世界のさまざまな国や都市の日時を確認できます。また現在地と別の都市の時差も見ることができます。 | JST Clock - NICT-情報通信研究機構 日本標準時を提供するJST Clockに関する情報を掲載しています。 | Time.is - exact time, any time zone Time.is displays exact, official atomic clock time for any time zone (more than 7 million locations) in 58 languages. What time is it? 几点了？ क्या समय हुआ है? ¿Qué hora es? Quelle heure est-il ? كم الساعة এখন কয়টা বাজে? Который час? Que horas são? Jam berapa? Wieviel Uhr ... | フリップクロック - オンライン時計 シンプルなめくれる動きは見ていて楽です。 ウェブブラウザで動作します。 コンピューター、タブレット、または電話で使用できます。 インストールの必要はありません。 デスククロックとして、または仕事中に時間を把握するために使用できます。 | 日本の現在時刻 日本の秒付き正確なライブ時刻。日本の夏時間の切り替えを含みます。 現在のタイムゾーン UTC+09:00. 情報: 陸地の地域（大陸）, 国旗, 首都, 面積, 人口, 通貨, 国の電話コード, 車両通行方向.",no,,,2026-07-02,part1/5
