company_name,company_core,bing_snippet,has_incentive_mention,incentive_detail,incentive_rate,screened_date,worker_part
アプリケーションスペース,アプリケーションスペース,エボシドリ（phoebus） - eBird エボシドリ（phoebus）について：世界中のバードウォッチャーが集めた写真、音声、観察結果を検索できます。 | バードリサーチ鳴き声図鑑| バードリサーチ / Bird Research ご要望の多かった鳴き声の図鑑をつくりました。 （音声ファイルはwma形式で Windows付属のWindows Media Player等が必要です）。 MacやiPhoneの方はmp3のボタンを押してください。 本録音データは個人的な使用にとどめ，ホームページへの転載や商用の無断使用はしないでください。 鳴き声を覚えるためのページもできました。 鳥の鳴き声 マイスターへの道 クイズ形式やソナグラムを使った実践形式で鳥の声を学べます。 ぜひ挑戦してみてください。 ※ホトトギス，カッコウの鳴き声を今季初めて聞いた方は 季節前線ウォッチ より場所と確認年月日をお知らせください。 雌？ /飛行時. 求愛？ さえずり/地鳴き？ /雄. さえずり/メス？ 警戒？ 警戒/繁殖地/ヒナ？ 雄 威嚇? | 「どうぶつ動画ギャラリー」動物名インデックス - 東京ズーネット 動画コーナー「どうぶつ動画ギャラリー」を、動物名から検索できるページです。 ア行 カ行 サ行 タ行 ナ行 ハ行 マ行 ヤ行 ラ行 ワ行 他分類 | エボシドリ科 - Wikipedia ウィキスピーシーズに エボシドリ科 に関する情報があります。 エボシドリ科 （エボシドリか、 学名 Musophagidae）は 鳥類 エボシドリ目 の唯一の科である。 エボシドリ （烏帽子鳥）と呼ばれる。 | エボシドリとは何者なのか？ 種類ごとの特徴と進化が語る“緑 ... オスとメスで外見にほとんど違いがないのも特徴で、つがいで行動することが多く、仲のよい鳥として知られています。 エボシドリは主に樹上で生活し、森の中を静かに移動しながら果実を食べて暮らしています。 飛行能力はあまり高くありませんが、枝から枝へ軽やかに跳び移るように移動します。 強い脚としっかりした足の構造により、木の上での生活に特化した進化を遂げているのです。,no,,,2026-07-02,part1/5
アプリケーションプランニング,アプリケーションプランニング,"Scratch - Imagine, Program, Share Scratch is a free programming language and online community where you can create your own interactive stories, games, and animations. | Scratch - Explore Scratch is a free programming language and online community where you can create your own interactive stories, games, and animations. | Scratch | Scratch Foundation Scratch is built on free expression, experimentation, and play – whether children are excited about visualizing math equations or making their doodles dance and sing, Scratch can help them make their ideas a reality. | Scratch - Apps on Google Play Scratch is used by millions of kids around the world both in and outside of school. With Scratch, you can code your own interactive stories, games, and animations, then share with your friends,... | Scratch 3 - Free download and install on Windows | Microsoft Store With Scratch, you can program your own interactive stories, games, and animations. Scratch helps young people learn to think creatively, reason systematically, and work collaboratively — essential skills for life in the 21st century.",no,,,2026-07-02,part1/5
アプリコットネットワーク,アプリコットネットワーク,"ウォシュレット® アプリコット | トイレ (ウォシュレット・温水 ... TOTOのウォシュレット「アプリコット」の特長について教えてください。 凹凸や段差を抑えスリムでお掃除しやすいデザインに加えて、きれい除菌水で便器の黒ずみの発生を抑える「便器きれい」の機能が特長として挙げられます。 | アプリコットとは？あんずとの違いや特徴、おいしい食べ方に ... どんな果物か知っていますか？ この記事では、アプリコットの特徴や旬の時期、あんずとの違い、おいしい食べ方について解説します。 記事の後半では、アプリコットを使ったおかずやスイーツのレシピもご紹介するので、ぜひ最後までご覧くださいね。 | アプリコットとは？旬・栄養・選び方や「あんず」との違い ... アプリコットのタルト アプリコットの持つ酸味を活かした、見た目にも華やかなフランス仕立ての焼き菓子です。 タルト生地にアーモンドパウダーを用いたクリームを敷き、その上にアプリコットの半割りを並べてオーブンで焼き上げます。 | TOTO ウォシュレット®アプリコット F3 TCF4734 TOTO ウォシュレット®アプリコット F3 TCF4734瞬間式+リモコン操作+脱臭 年間電気代概ね￥2,500-メーカー希望小売価格（税別）￥187,000-キャンペーン特別本体価格（税別）￥107,800- | アプリコットとはあんずのこと？特徴やおすすめの食べ方 ... アプリコットの旬はいつ？ アプリコットの旬は、主に6〜7月頃です。 日本では初夏に収穫され、この時期にのみ生のアプリコットが店頭に並びます。 収穫後は傷みやすく日持ちもしにくいため、生で楽しめる期間は比較的短めです。",no,,,2026-07-02,part1/5
アベールソリューションズ,アベールソリューションズ,"Sign in - Claude Claude is an AI assistant by Anthropic, designed to assist with creative tasks like drafting websites, graphics, documents, and code collaboratively. | Claude Code 簡報 - HackMD 完整版 Discover Claude Code: Next-gen AI programming tool comparison & cost analysis. Complete guide to choosing between GitHub Copilot, Cursor & Claude. Built with Claude AI. | downloads.claude.ai {""currentRelease"":""1.15962.1"",""releases"":[{""version"":""1.15962.1"",""updateTo"":{""name"":""Claude 1.15962.1"",""version"":""1.15962.1"",""pub_date"":""2026-06-26T20:00:08.400Z ... | downloads.claude.ai mQINBGnK73ABEACnbytJXkjweYrwIr0aLEFRlH+C0nF44KxFc7gQmJ6PjSPMGZAD dxZcaixU7zZl8WxEpVO0wLmIH8cf2zGOdyuZg1Yaugk1vHb2b8WBhAGCQJdPgB8W XquedepEYtk56uP ... | claude.ai echo. echo Installation complete^^! echo. exit /b 0 REM ============================================================================ REM SUBROUTINES REM ...",no,,,2026-07-02,part1/5
アライアンス,アライアンス,アライアンスとは？ 意味や使い方、M&Aとの違いをわかりやすく ... ビジネスでよく耳にするアライアンスは、何気ない会話の中でも使われており、今やビジネス用語として定着しています。 しかし、アライアンスとは一体なんでしょう？ アライアンスが具体的にビジネスシーンにおいてどのような場合に使われ ... | アライアンスとは？M&Aとの違いやメリット・デメリット、事例 ... ここでは、企業の成長・拡大に欠かせないアライアンスについて、概要やM&Aとの違い、メリット・デメリットを解説。 アライアンスを用いたビジネス用語や、アライアンスを結ぶ際の注意点も併せて紹介します。 | アライアンスとは？ 意味やM&Aとの違い、メリット・種類を ... アライアンスの意味や目的、業務提携・資本提携・技術提携などの種類を体系的に解説。 M&Aとの違いやメリット・デメリット、成功させるためのポイントや具体的事例まで、ビジネス戦略に欠かせないアライアンスの基礎知識を網羅しています。 | 「アライアンス」の意味とは？使い方や例文、M＆Aとの違い ... 使い方や例文、M＆Aとの違い アライアンスの意味 「アライアンス」とは、英語の名詞「alliance」を語源とする外来語です。 英語における「alliance」の意味は、「（相互利益のための）同盟」や「同盟関係」、もしくは「縁組」といったものになります。 | ビジネスシーンにおける「アライアンス」の意味と言葉の ... アライアンスとは、他企業や公的機関と協力体制を築くことだ。いわゆる業務提携のことで、ビジネスシーンでは互いの利益獲得や成長といった ...,no,,,2026-07-02,part1/5
アライザー,アライザー,"NAVER 네이버 메인에서 다양한 정보와 유용한 컨텐츠를 만나 보세요 | 네이버지도 모든 여정의 시작, 네이버지도 맛으로 승부하는 원당감자탕 명동1호점 재오픈 합니다. 장소는 변경되었습니다. | 홈 : 네이버스포츠 로그인 전체서비스 문제신고 개인정보처리방침 고객센터 네이버 (주) 사업자정보 대표이사 최수연 주소 경기도 성남시 분당구 정자일로 95 NAVER 1784, 13561 전화 1588-3820 (대표전화/고객센터) | 네이버페이 부동산 매물신고운영 부동산 고객센터 네이버파이낸셜 (주)가 제공하는 부동산 정보는 각 콘텐츠 제공업체로부터 받는 정보로 참고용입니다. 정보의 정확성이나 신뢰성을 보증하지 않으며, 서비스 이용의 결과에 대해서 어떠한 법적인 책임을 지지 않습니다. | 네이버 - NAVER - Google Play 앱 Wear OS 기기에서 네이버앱을 이용해보세요. 손목 위에서 매시간 변화하는 날씨와 증권 정보를 확인하고, 멤버십과 쿠폰, 현장 결제 기능을 사용할 수 있습니다. 또한 날씨, PAY 타일과 각종 컴플리케이션을 통해 자주 쓰는 도구에 바로 접근할 수 있습니다.",no,,,2026-07-02,part1/5
アリス,アリス,アリス (フォークグループ) - Wikipedia バンド名の由来は当時 ロサンジェルス で営業していたレストラン名で、メニューにペン字で「Alice」と書かれてあり、『このロゴがかっこいいなと思って。 プロになるんだったらAliceってバンドの名前にしたい。 』と思った事から。 | Alice Official Site 「アリスコンサート2024」オフィシャルグッズ受注生産受付決定！ 大好評をいただいた「アリスコンサート2024」オフィシャルグッズの受注生産受付が決定しました！ 会場で買いそびれてしまった方、追加で購入を希望される方は… More | アリス | Alice - UNIVERSAL MUSIC JAPAN アリス CD ALICE V +3 [初回生産限定盤] [SHM-CD] アリス CD ALICE VI +4 [初回生産限定盤] [SHM-CD] アリス CD ALICE VII +6 [初回生産限定盤] [SHM-CD] アリス CD ALICE VIII +2 [初回生産限定盤] [SHM-CD] アリス CD ALICE IX -謀反- +1 [初回生産限定盤] [SHM-CD] アリス CD ALICE X +1 [初回生産限 ... | アリス【シングル曲・アルバム収録曲集】 - YouTube アリス【ALICE GREAT 50 BEGINNING 2022 セットリスト】 (2022年11月17日) AOUOA 2.4K views • 3 years ago 1:44 | アリス シングルヒット曲10曲 (一部アルバムより挿入） - YouTube #アリス #今はもうだれも #帰らざる日々 #遠くで汽笛を聞きながら #冬の稲妻#涙の誓い #ジョニーの子守唄 #チャンピオン #夢去し街角 #秋止符 ...,no,,,2026-07-02,part1/5
アルスター,アルスター,株式会社アルスター スマート社会に向け、IoT 技術を活用し パートナー企業と共に、身近な所からDXを推進し 持続可能な地域社会に貢献します。 | アルスター(R)鋼板_Alstar - Nippon Steel Corporation 薄目付製品〔両面(最小付着量)40g/m2〕の 製造が可能です。 これは溶接性および加工性の向上につながり、 作業の能率アップをもたらします。 耐黒変アルスター、高潤滑性アルスター | アルスター - Wikipedia 北アイルランドの ユニオニスト （イギリスとの連合維持を主張）が北アイルランドのことをアルスターと呼ぶ場合もあるが、歴史的に見て9つの県をあわせた地域をアルスターとするのが一般的である。 | アルスター鋼板（日新製鋼）｜在庫情報 | 秋山シャーリング ... アルミメッキ鋼板「アルコスター（日新製鋼アルスター鋼板同等品）」 溶融アルミニウムメッキ鋼板で、鉄の強さにアルミニウムの特性をプラスした高い耐熱性、熱反射性を持ちます。 | アルスターカラーコートのご紹介｜表参道店のスタッフブログ ... 麻布テーラー「表参道店」のスタッフブログです。 この記事では、「アルスターカラーコートのご紹介」という内容で、オーダースーツやオーダーシャツに関する情報を発信しています。,no,,,2026-07-02,part1/5
アルス・ウェアー,アルスウェアー,アルス株式会社｜半導体・EMS・電源開発をワンストップで提供 アルス株式会社は、ウエハテストや半導体PKG組立、EMS実装、電源・エンベデッドシステム等の開発・製造をワンストップで提供。 カスタマイズ対応で最適なものづくりパートナーを目指します。 | 株式会社アルス - アルスは、医療・介護などのさまざまな現場 ... 各種お問い合わせはこちらから 未来を創る商品とサービス 株式会社アルスの想いとビジョンをご紹介します。 私たちがどのような価値を提供し、未来に向けて どんな挑戦をしているのか、ぜひ動画でご覧ください。 | アルスコーポレーション株式会社 | 堺の総合刃物メーカー ... 採用情報 代理店の皆様 ショップ HOME 製品情報 メンテナンス ARSのこだわり 切るを楽しむ 企業情報 採用情報 代理店の皆様 ショップ Q&A ご愛用者登録 サイトマップ お問い合わせ 海外輸出不可の案内 ソーシャルメディアの取り組みについて サイトポリシー 個人情報の取扱 | 剪定バサミ｜アルス〈公式〉オンラインショップ 日本製の高品質な園芸刃物ならアルスへ。 大阪堺で製造する剪定ばさみ ノコギリ 高枝切りばさみ 刈込鋏 クラフトはさみ から 電動バリカン、刃物のメンテナンス用品まで1700アイテムの品揃え! 創業148年の実績。 | 株式会社アルス | 横浜市 ビル・マンションの給排水設備の清掃 ... 株式会社アルスは、神奈川県横浜市でビル・マンションの排水管洗浄や水廻り・給排水設備の工事・修理・保守点検を行う給排水設備の専門業者です。 創業35年の経験と実績があり、ビル・マンションの水廻り・給排水設備のことなら全て対応できます。,no,,,2026-07-02,part1/5
アルト,アルト,"アルト｜スズキ アルト WEB動画「わたしの理想軽」篇 60秒 スズキ株式会社【四輪公式チャンネル】 Watch on このクルマを見た人は、こんなクルマにも興味を持っています。 ワゴンR スマイル | アルト 価格・オンライン見積り | スズキ スズキ アルトの公式サイト。グレードごとのカラー・価格や主要装備・諸元をご確認いただけます。 *全方位モニター用カメラパッケージ・スズキコネクト対応通信機装着車、バックアイカメラ・スズキコネクト対応通信機装着車は対応ナビゲーションの装着を前提とした仕様です。 *対応 ... | スズキ・アルト - Wikipedia スズキの海外拠点で初めて、現行の日本における軽自動車規格と同一のボディー・排気量を採用したモデルで、8代目アルトをベースに、ボディーとエンジンは日本仕様と同じだが、フロントフェンダーの材質を樹脂製から鋼板製に変更し、更に最低地上高を ... | アルト（スズキ）の中古車を探す【カーセンサー】 アルト（スズキ）の中古車を4,401台掲載中。 アルトの中古車検索や中古車販売などの中古車情報なら「カーセンサー」！ リクルートが運営する中古車情報サイトです。 アルトの中古車が様々な条件で検索可能。 あなたの車選びをサポートします。 | 【スズキ新型アルト】フルモデルチェンジ「車重-100kgで500kg台 ... スズキが、軽自動車「アルト」の10代目フルモデルチェンジ発売を2027年に予定しています。 新世代となり性能をアップするスズキ新型アルトについて、スペックや価格などを最新情報からご紹介します。",no,,,2026-07-02,part1/5
アルファパートナーズ,アルファパートナーズ,株式会社アルファ 日本唯一の総合ロックメーカー株式会社アルファは自動車用ロック、住宅用ロック、産業機器用ロック、ロッカーの設計・製造・販売。 最新のキー＆キーレス商品は安全・安心、そして快適なくらしを創造します。 | アルファーが提供する 安心保証 株式会社アルファー alpha 家賃保証のアルファーでは、アパート・マンションを貸す人・借りる人皆様に安心な「アルファープラン」を、鹿児島、熊本、長崎、大分、宮崎、佐賀でご提供しています。 | 株式会社アルファ | 総合販売促進企業 販促のアルファ 公式ホームページ。 最新ニュース、会社概要、IR情報、採用情報などを掲載。 全国に支店・営業所を展開し、お客様のニーズにお応えする「総合販売促進企業」販促のことならお任せ下さい。 | Α - Wikipedia 大文字Αはラテン文字のAと紛らわしいためほとんど使われず、小文字αのみが使われる。 プラスアルファは、元々プラス エックス の誤りである。 “+X”を速記したものを“+α”と読み違えたことが起源だが、現在では 和製外来語 として定着した。 | 企業情報｜株式会社アルファ このページでは株式会社アルファの企業情報についてご案内しています。,no,,,2026-07-02,part1/5
アルファ・ウェーブ,アルファウェーブ,株式会社アルファ 日本唯一の総合ロックメーカー株式会社アルファは自動車用ロック、住宅用ロック、産業機器用ロック、ロッカーの設計・製造・販売。 最新のキー＆キーレス商品は安全・安心、そして快適なくらしを創造します。 | アルファーが提供する 安心保証 株式会社アルファー alpha 家賃保証のアルファーでは、アパート・マンションを貸す人・借りる人皆様に安心な「アルファープラン」を、鹿児島、熊本、長崎、大分、宮崎、佐賀でご提供しています。 | 株式会社アルファ | 総合販売促進企業 販促のアルファ 公式ホームページ。 最新ニュース、会社概要、IR情報、採用情報などを掲載。 全国に支店・営業所を展開し、お客様のニーズにお応えする「総合販売促進企業」販促のことならお任せ下さい。 | Α - Wikipedia 大文字Αはラテン文字のAと紛らわしいためほとんど使われず、小文字αのみが使われる。 プラスアルファは、元々プラス エックス の誤りである。 “+X”を速記したものを“+α”と読み違えたことが起源だが、現在では 和製外来語 として定着した。 | 企業情報｜株式会社アルファ このページでは株式会社アルファの企業情報についてご案内しています。,no,,,2026-07-02,part1/5
アルファ・プランニング,アルファプランニング,株式会社アルファ 日本唯一の総合ロックメーカー株式会社アルファは自動車用ロック、住宅用ロック、産業機器用ロック、ロッカーの設計・製造・販売。 最新のキー＆キーレス商品は安全・安心、そして快適なくらしを創造します。 | アルファーが提供する 安心保証 株式会社アルファー alpha 家賃保証のアルファーでは、アパート・マンションを貸す人・借りる人皆様に安心な「アルファープラン」を、鹿児島、熊本、長崎、大分、宮崎、佐賀でご提供しています。 | 株式会社アルファ | 総合販売促進企業 販促のアルファ 公式ホームページ。 最新ニュース、会社概要、IR情報、採用情報などを掲載。 全国に支店・営業所を展開し、お客様のニーズにお応えする「総合販売促進企業」販促のことならお任せ下さい。 | Α - Wikipedia 大文字Αはラテン文字のAと紛らわしいためほとんど使われず、小文字αのみが使われる。 プラスアルファは、元々プラス エックス の誤りである。 “+X”を速記したものを“+α”と読み違えたことが起源だが、現在では 和製外来語 として定着した。 | 企業情報｜株式会社アルファ このページでは株式会社アルファの企業情報についてご案内しています。,no,,,2026-07-02,part1/5
アローシステム開発,アローシステム開発,Arrow Japan | Home Arrow Japan (アロージャパン)の電子部品、設計サポート、サプライチェーンソリューションをご覧ください。 日本国内の専門知識と、日本に特化したサービスをご提供します。 | 消費者金融アロー公式サイト 通常のお申込みの場合はご自宅に契約書類をお送りしますが、郵送物に社名（アロー）は入っておりません。 年収に対してどのくらいの融資が可能ですか？ 年齢制限はありますか？ どの地域からでも利用できますか？ | キャッシング・消費者金融アロー公式サイト 知って安心!アローのご融資 すぐにご利用いただけます。 ご融資金の受け取り ご融資決定後、お客様の口座に最短でお振込みいたします。 ※お申込み時間によっては対応できない場合がございます。 ご都合に合わせて選べます。 ご返済日について | ARROW/アロー - Wikipedia 『ARROW/アロー』（原題： Arrow）は、2012年10月10日に The CW で放送が始まり、2020年1月28日まで計8シーズンが放送された、 DCコミックス の「グリーンアロー」に基づく アメリカ合衆国 の 実写テレビシリーズ。 | 100の口コミ・評判でわかる消費者金融アローの全知識 本記事では、銀行や消費者金融でカードローン審査をしてきた経験がある私が、アローの口コミや評判をもとに、アローはどんな消費者金融かについてまとめたものです。 口コミでわかるアローのメリット・デメリット,no,,,2026-07-02,part1/5
アンサー,アンサー,龙岩市永定区人民政府 龙岩市永定区人民政府关于印发龙岩市永定区国民经济和社会发展第十五个五年规划纲... 八十八期 《永定区进一步稳定发展2026年... 八十七期发改局:抓项目 促投资 助力高质... | 李强（福建省龙岩市永定区委书记）_百度百科 李强，男，汉族，中国国籍，1979年9月出生，福建南安人，2001年8月参加工作，2000年12月加入中国共产党，大学学历，法学学士。 现任福建省龙岩市永定区委书记。 | 李永定（江苏宝应麦芽厂厂长）_百度百科 李永定 ，男，1940年9月生于江苏宝应 。 中共党员。 现任国营江苏宝应麦芽厂厂长、厂党总支书记。 | 政务公开-龙岩市永定区人民政府 更多> 永定区人民政府全体会议暨廉政工作会议召开 2025-12-29 永定区政府第四十四次常务会议召开 2025-12-17 永定区政府第四十三次常务会议召开 2025-11-26 永定区政府第四十二次常务会议召开 2025-10-23 永定区政府第四十一次常务会议召开 2025-09-13 | 李永定-快懂百科 李永定（1940年9月生于江苏宝应），男，中共党员，现任国营江苏宝应麦芽厂（厂长、厂党总支书记）。,no,,,2026-07-02,part1/5
