company_name,company_core,job_title,employment_type,base_salary_monthly,incentive_description,incentive_rate_pct,incentive_base,incentive_type,incentive_cap,expected_annual_min,expected_annual_max,has_quota,required_experience,employee_count,founded_year,hq_location,remote_policy,notes,source_url,crawl_date,data_source,channel
株式会社の,の,＼裁量大×高インセンティブ／住宅ローンの提案営業｜年収1000万円以上可｜成果は青天井｜賞与年3回,正社員,,＼裁量大×高インセンティブ／住宅ローンの提案営業｜年収1000万円以上可｜成果は青天井｜賞与年3回,nan,不明,不明,上限なし,,,不明,,,,,不明,,https://en-gage.net/user/search/desc/9002746/,2026-07-01,phase3_engage,engage
株式会社林寺メディノール,林寺メディノール,【未経験歓迎】提案営業｜月収50万円以上可｜インセンティブあり｜20代活躍中,正社員,,【未経験歓迎】提案営業｜月収50万円以上可｜インセンティブあり｜20代活躍中,nan,不明,不明,不明,,,不明,未経験可,,,,不明,,https://en-gage.net/user/search/desc/12242671/,2026-07-01,phase3_engage,engage
有限会社東北物産,東北物産,☆成約粗利に対するインセンティブ制度あり（営業成果をしっかり評価） ・粗利額の５％をインセンティブとしてお支払します。 オープニングスタッフ／高いインセンティブ報酬で稼げる！固定月収40万円以上！不用品買取の営業スタッフ,正社員,,☆成約粗利に対するインセンティブ制度あり（営業成果をしっかり評価） ・粗利額の５％をインセンティブとしてお支払します。 オープニングスタッフ／高いインセンティブ報酬で稼げる！固定月収40万円以上！不用品買取の営業スタッフ,5.0,粗利,フロー型,不明,,,なし,未経験可,,,,不明,,https://en-gage.net/user/search/desc/13625986/,2026-07-01,phase3_engage,engage
有限会社モールドモデル,モールドモデル,賃貸営業(未経験者8割)◆20～30代活躍中！／100%反響営業／完全週休2日制／インセンティブ有,正社員,,賃貸営業(未経験者8割)◆20～30代活躍中！／100%反響営業／完全週休2日制／インセンティブ有,nan,不明,不明,不明,,,不明,未経験可,,,,不明,,https://en-gage.net/user/search/desc/5139220/,2026-07-01,phase3_engage,engage
株式会社アンドディファレンス,アンドディファレンス,＼裁量大×高インセンティブ／住宅ローンの提案営業｜年収1000万円以上可｜成果は青天井｜賞与年3回,正社員,,＼裁量大×高インセンティブ／住宅ローンの提案営業｜年収1000万円以上可｜成果は青天井｜賞与年3回,nan,不明,不明,上限なし,4000000,270000,不明,未経験可,,,,不明,,https://en-gage.net/user/search/desc/8373676/,2026-07-01,phase3_engage,engage
株式会社TryAgain,tryagain,求人TOP 求人検索 滋賀県の求人 大津市の求人 営業スタッフ（インセンティブあり） 求人TOP 求人検索 株式会社TryAgain 営業スタッフ（インセンティブあり） 営業スタッフ（インセンティブあり） ※頑張りに合わせてインセンティブ有,正社員,,求人TOP 求人検索 滋賀県の求人 大津市の求人 営業スタッフ（インセンティブあり） 求人TOP 求人検索 株式会社TryAgain 営業スタッフ（インセンティブあり） 営業スタッフ（インセンティブあり） ※頑張りに合わせてインセンティブ有,nan,不明,不明,不明,,,不明,未経験可,,,,不明,,https://en-gage.net/user/search/desc/11676540/,2026-07-01,phase3_engage,engage
株式会社デンカシンキ,デンカシンキ,求人TOP 求人検索 愛媛県の求人 松山市の求人 ☆PR営業スタッフ/◎女性社員が多数活躍しています/未経験者OK/インセンティブ充実/完全週休二日制 求人TOP 求人検索 株式会社デンカシンキ ☆PR営業スタッフ/◎女性社員が多数活躍しています/未経験者OK/インセンティブ充実/完全週休二日制 ☆PR営業スタッフ/◎女性社員が多数活躍しています/未経験者OK/インセンティブ充実/完全週休二日制,正社員,,求人TOP 求人検索 愛媛県の求人 松山市の求人 ☆PR営業スタッフ/◎女性社員が多数活躍しています/未経験者OK/インセンティブ充実/完全週休二日制 求人TOP 求人検索 株式会社デンカシンキ ☆PR営業スタッフ/◎女性社員が多数活躍しています/未経験者OK/インセンティブ充実/完全週休二日制 ☆PR営業スタッフ/◎女性社員が多数活躍しています/未経験者OK/インセンティブ充実/完全週休二日制,nan,不明,不明,不明,,,不明,未経験可,,,,不明,,https://en-gage.net/user/search/desc/3764793/,2026-07-01,phase3_engage,engage
株式会社ＮＮＡ,ｎｎａ,求人TOP 求人検索 東京都の求人 中央区の求人 ★ITコンサルティング営業（DX支援）/年間休日128日★インセンティブ年4回 求人TOP 求人検索 日本総合技術 ★ITコンサルティング営業（DX支援）/年間休日128日★インセンティブ年4回 ★ITコンサルティング営業（DX支援）/年間休日128日★インセンティブ年4回 ◇インセンティブ年4回あり,正社員,,求人TOP 求人検索 東京都の求人 中央区の求人 ★ITコンサルティング営業（DX支援）/年間休日128日★インセンティブ年4回 求人TOP 求人検索 日本総合技術 ★ITコンサルティング営業（DX支援）/年間休日128日★インセンティブ年4回 ★ITコンサルティング営業（DX支援）/年間休日128日★インセンティブ年4回 ◇インセンティブ年4回あり,nan,不明,不明,不明,,,不明,未経験可,,,,不明,,https://en-gage.net/user/search/desc/10787945/,2026-07-01,phase3_engage,engage
株式会社Qvou,qvou,＼裁量大×高インセンティブ／住宅ローンの提案営業｜年収1000万円以上可｜成果は青天井｜賞与年3回,正社員,,＼裁量大×高インセンティブ／住宅ローンの提案営業｜年収1000万円以上可｜成果は青天井｜賞与年3回,nan,不明,不明,上限なし,,,不明,未経験可,,,,ハイブリッド,,https://en-gage.net/user/search/desc/16820487/,2026-07-01,phase3_engage,engage
株式会社の採用・求人情報,の採用求人情報,未経験歓迎｜住宅リフォーム営業｜月給２０万円～＋歩合,正社員,,未経験歓迎｜住宅リフォーム営業｜月給２０万円～＋歩合,nan,不明,不明,不明,,,なし,未経験可,,,,ハイブリッド,,https://en-gage.net/user/search/desc/3357168/,2026-07-01,phase3_engage,engage
株式会社レイズリンクス,レイズリンクス,アポイント取得で歩合給を支給！ さらに！！！契約になればさらに歩合給を支給します。 【人柄重視の採用】営業スタッフ（チーム営業）目指せ高収入。成果報酬としてインセンティブ支給もあり！,正社員,,アポイント取得で歩合給を支給！ さらに！！！契約になればさらに歩合給を支給します。 【人柄重視の採用】営業スタッフ（チーム営業）目指せ高収入。成果報酬としてインセンティブ支給もあり！,nan,不明,不明,不明,,,不明,未経験可,,,,ハイブリッド,,https://en-gage.net/user/search/desc/10277760/,2026-07-01,phase3_engage,engage
株式会社ジェリービーンズグループ,ジェリービーンズグループ,（例：売上目標達成、粗利改善、案件獲得数、既存深耕など数値で語れる実績） ＼裁量大×高インセンティブ／住宅ローンの提案営業｜年収1000万円以上可｜成果は青天井｜賞与年3回,正社員,,（例：売上目標達成、粗利改善、案件獲得数、既存深耕など数値で語れる実績） ＼裁量大×高インセンティブ／住宅ローンの提案営業｜年収1000万円以上可｜成果は青天井｜賞与年3回,nan,粗利,不明,上限なし,,,不明,未経験可,,,,ハイブリッド,,https://en-gage.net/user/search/desc/16999449/,2026-07-01,phase3_engage,engage
株式会社陽幸,陽幸,💰インセンティブあり！ 大きな広告費や無駄なコストを抑え、その分を営業にしっかり還元しています。 ※上記に加えて、販売件数に応じたインセンティブがつきます。 ✨未経験OK✨リフォームアドバイザー★完全週休2日制／インセンティブ充実／独身寮あり／賞与年4回,正社員,,💰インセンティブあり！ 大きな広告費や無駄なコストを抑え、その分を営業にしっかり還元しています。 ※上記に加えて、販売件数に応じたインセンティブがつきます。 ✨未経験OK✨リフォームアドバイザー★完全週休2日制／インセンティブ充実／独身寮あり／賞与年4回,nan,不明,不明,不明,,,不明,未経験可,,,,不明,,https://en-gage.net/user/search/desc/16774673/,2026-07-01,phase3_engage,engage
株式会社の,の,＼裁量大×高インセンティブ／住宅ローンの提案営業｜年収1000万円以上可｜成果は青天井｜賞与年3回,正社員,,＼裁量大×高インセンティブ／住宅ローンの提案営業｜年収1000万円以上可｜成果は青天井｜賞与年3回,nan,不明,不明,上限なし,,,不明,,,,,不明,,https://en-gage.net/user/search/desc/1559861/,2026-07-01,phase3_engage,engage
株式会社エトワール,エトワール,営業実績によりインセンティブ付与あり,正社員,,営業実績によりインセンティブ付与あり,nan,不明,不明,不明,,,不明,未経験可,,,,不明,,https://en-gage.net/user/search/desc/12510249/,2026-07-01,phase3_engage,engage
株式会社Qvou,qvou,＼裁量大×高インセンティブ／住宅ローンの提案営業｜年収1000万円以上可｜成果は青天井｜賞与年3回,正社員,,＼裁量大×高インセンティブ／住宅ローンの提案営業｜年収1000万円以上可｜成果は青天井｜賞与年3回,nan,不明,不明,上限なし,,,不明,未経験可,,,,ハイブリッド,,https://en-gage.net/user/search/desc/16238579/,2026-07-01,phase3_engage,engage
株式会社BIG,big,◆◇買取スタッフ募集◇◆インセンティブあり！業種・営業未経験大歓迎！！！,正社員,,◆◇買取スタッフ募集◇◆インセンティブあり！業種・営業未経験大歓迎！！！,nan,不明,不明,不明,,,不明,未経験可,,,,不明,,https://en-gage.net/user/search/desc/1776578/,2026-07-01,phase3_engage,engage
株式会社テレ・マーカー,テレマーカー,"成果を出すほどインセンティブが増えるため、やりがいを感じながら働けます。 ◎自分の頑張りをしっかり評価・還元されたい ●年収412万円／入社2年目／営業（月給22万円＋インセンティブ） ●年収555万円／入社3年目／営業（月給23万円＋インセンティブ） ●年収851万円／入社5年目／営業（月給40万円＋インセンティブ） 月給280,000円＋インセンティブ（※想定年収：3,360,000円～） 月給 210,000円＋インセンティブ ■インセンティブ 入社2年目の社員の年間平均インセンティブ金額：¥2,534,234 ＜豊富なインセンティブ制度＞ ・四半期歩合制度：年4回 (平均支給実績36万",正社員,280000,"成果を出すほどインセンティブが増えるため、やりがいを感じながら働けます。 ◎自分の頑張りをしっかり評価・還元されたい ●年収412万円／入社2年目／営業（月給22万円＋インセンティブ） ●年収555万円／入社3年目／営業（月給23万円＋インセンティブ） ●年収851万円／入社5年目／営業（月給40万円＋インセンティブ） 月給280,000円＋インセンティブ（※想定年収：3,360,000円～） 月給 210,000円＋インセンティブ ■インセンティブ 入社2年目の社員の年間平均インセンティブ金額：¥2,534,234 ＜豊富なインセンティブ制度＞ ・四半期歩合制度：年4回 (平均支給実績36万円） ・商材別インセンティブ：開催時 (成約商材ごとに最大5万円) 【未経験歓迎】提案営業｜月収50万円以上可｜インセンティブあり｜20代活躍中",nan,不明,フロー型,不明,,,不明,未経験可,,,,不明,,https://en-gage.net/user/search/desc/16664467/,2026-07-01,phase3_engage,engage
株式会社日本マイクロニクス,日本マイクロニクス,＼月35万円～／大手Grで生命保険の事務や営業＊固定給＋インセンティブ♪,正社員,,＼月35万円～／大手Grで生命保険の事務や営業＊固定給＋インセンティブ♪,nan,不明,不明,不明,,,不明,未経験可,,,,ハイブリッド,,https://en-gage.net/user/search/desc/16430796/,2026-07-01,phase3_engage,engage
株式会社IVRESS,ivress,■報奨金（営業職インセンティブ）,正社員,,■報奨金（営業職インセンティブ）,nan,不明,不明,不明,,,不明,未経験可,,,,不明,,https://en-gage.net/user/search/desc/8271820/,2026-07-01,phase3_engage,engage
株式会社の,の,求人TOP 求人検索 東京都の求人 中央区の求人 【ソリューション営業】明確な評価テーブルで成果の分インセンティブ支給！市場価値を高めて稼げる人材へ 求人TOP 求人検索 データアナリティクスラボ株式会社 【ソリューション営業】明確な評価テーブルで成果の分インセンティブ支給！市場価値を高めて稼げる人材へ 【ソリューション営業】明確な評価テーブルで成果の分インセンティブ支給！市場価値を高めて稼げる人材へ ◇インセンティブ制度 成果に見合った高収入を手にしたい！明確なテーブルで成果がインセンティブとして支給される環境！,正社員,,求人TOP 求人検索 東京都の求人 中央区の求人 【ソリューション営業】明確な評価テーブルで成果の分インセンティブ支給！市場価値を高めて稼げる人材へ 求人TOP 求人検索 データアナリティクスラボ株式会社 【ソリューション営業】明確な評価テーブルで成果の分インセンティブ支給！市場価値を高めて稼げる人材へ 【ソリューション営業】明確な評価テーブルで成果の分インセンティブ支給！市場価値を高めて稼げる人材へ ◇インセンティブ制度 成果に見合った高収入を手にしたい！明確なテーブルで成果がインセンティブとして支給される環境！,nan,不明,フロー型,不明,,,不明,未経験可,,,,不明,,https://en-gage.net/user/search/desc/12518549/,2026-07-01,phase3_engage,engage
株式会社Qvou,qvou,＼裁量大×高インセンティブ／住宅ローンの提案営業｜年収1000万円以上可｜成果は青天井｜賞与年3回,正社員,,＼裁量大×高インセンティブ／住宅ローンの提案営業｜年収1000万円以上可｜成果は青天井｜賞与年3回,nan,不明,不明,上限なし,,,不明,未経験可,,,,ハイブリッド,,https://en-gage.net/user/search/desc/16820458/,2026-07-01,phase3_engage,engage
株式会社デスクスタイル,デスクスタイル,1契約につきインセンティブ別途支給（1.3万円～5.0万円） 【人柄重視の採用】営業スタッフ（チーム営業）目指せ高収入。成果報酬としてインセンティブ支給もあり！,正社員,,1契約につきインセンティブ別途支給（1.3万円～5.0万円） 【人柄重視の採用】営業スタッフ（チーム営業）目指せ高収入。成果報酬としてインセンティブ支給もあり！,nan,不明,フロー型,不明,,,不明,未経験可,,,,ハイブリッド,,https://en-gage.net/user/search/desc/17226460/,2026-07-01,phase3_engage,engage
株式会社ジャンボ,ジャンボ,裁量のある環境で、デザインもマーケティングも。自社アプリの成長を牽引！ - 株式会社ジャンボのWebマーケティングの採用 - Wantedly,業務委託,nan,サービスを成長させ、利益を生み出し、その成果をメンバーにしっかり還元する。 少数精鋭で一人一人が事業成長に貢献する分、メンバーにしっかり還元します！ 成果主義の環境で、最短ルートで昇格できる！SNSディレクター募集,nan,不明,不明,不明,nan,nan,不明,,nan,nan,愛知県,不明,,https://www.wantedly.com/projects/2230351,2026-07-03,phase4a_wantedly,wantedly
株式会社nori・nori,norinori,株式会社nori・noriの会社情報 - Wantedly,,nan,悩みや課題は隠すものではなく、今より良くなるためのヒントです。だからこそ早めに吐き出し、チームで一緒に考える。嬉しいことや成果はみんなで共有し、次の挑戦につなげます。 会社が成長したときは、その成果をメンバーにも還元します。報酬や評価の仕組みも、成長に合わせて整えていきます。 私たちの行動指針は「まず仮説を立てて動く」です。正解がないスタートアップだからこそ、挑戦の数だけ学びがあります。うまくいかなかった経験も、次の打ち手を見つける貴重なデータです。試して、振り返り、改善する。その積み重ねが成果につながると考えています。,nan,不明,不明,不明,nan,nan,不明,,nan,nan,神奈川県,不明,,https://www.wantedly.com/companies/nori_nori_bus,2026-07-03,phase4a_wantedly,wantedly
株式会社Recruit,recruit,Misfits株式会社の会社情報 - Wantedly,,nan,努力を重ねれば、6ヶ月という短い期間で競合他社を圧倒するレベルの成果を出し続ける一流のWebマーケターへと成長することが十分に可能です。 段階ごとのインセンティブあり・副業 段階ごとのインセンティブあり・副業,nan,不明,不明,不明,nan,nan,不明,,nan,nan,東京都,不明,,https://www.wantedly.com/companies/company_4963498,2026-07-03,phase4a_wantedly,wantedly
