company_name,company_core,job_title,employment_type,base_salary_monthly,incentive_description,incentive_rate_pct,incentive_base,incentive_type,incentive_cap,expected_annual_min,expected_annual_max,has_quota,required_experience,employee_count,founded_year,hq_location,remote_policy,notes,source_url,crawl_date,data_source,channel
株式会社エイビス,エイビス,不動産賃貸業◎未経験OK／高水準のインセンティブあり／入社1年目で年収500万円～1000万円も可！ 【８割が未経験の業界】◎歩合で収入UP◎キャリアアップ歓迎 ◎週休3日もOK◎アウトソーシング営業,正社員,,不動産賃貸業◎未経験OK／高水準のインセンティブあり／入社1年目で年収500万円～1000万円も可！ 【８割が未経験の業界】◎歩合で収入UP◎キャリアアップ歓迎 ◎週休3日もOK◎アウトソーシング営業,nan,不明,不明,不明,,,なし,未経験可,,,,ハイブリッド,,https://en-gage.net/user/search/desc/16662069/,2026-07-01,phase3_engage,engage
株式会社の,の,✅最大30％の高インセンティブ率！ 賞与(インセンティブ)支給月：6月、12月 ＼裁量大×高インセンティブ／住宅ローンの提案営業｜年収1000万円以上可｜成果は青天井｜賞与年3回,正社員,,✅最大30％の高インセンティブ率！ 賞与(インセンティブ)支給月：6月、12月 ＼裁量大×高インセンティブ／住宅ローンの提案営業｜年収1000万円以上可｜成果は青天井｜賞与年3回,nan,不明,不明,上限なし,,,不明,未経験可,,,,不明,,https://en-gage.net/user/search/desc/15458350/,2026-07-01,phase3_engage,engage
株式会社クレス,クレス,その他、月々の給与の他に営業インセンティブ制度有,正社員,,その他、月々の給与の他に営業インセンティブ制度有,nan,不明,不明,不明,6000000,10000000,不明,未経験可,,,,ハイブリッド,,https://en-gage.net/user/search/desc/11124940/,2026-07-01,phase3_engage,engage
合同会社FYB,fyb,求人TOP 求人検索 東京都の求人 調布市の求人 SES営業／経験者募集／完全在宅／週2日～・1日2h～OK／成果に応じてインセンティブ支給 求人TOP 求人検索 合同会社FYB SES営業／経験者募集／完全在宅／週2日～・1日2h～OK／成果に応じてインセンティブ支給 SES営業／経験者募集／完全在宅／週2日～・1日2h～OK／成果に応じてインセンティブ支給 ■成果をしっかり還元 時給に加えてインセンティブ制度あり。 時給：1250円以上＋ 成果報酬（インセン）あり,正社員,,求人TOP 求人検索 東京都の求人 調布市の求人 SES営業／経験者募集／完全在宅／週2日～・1日2h～OK／成果に応じてインセンティブ支給 求人TOP 求人検索 合同会社FYB SES営業／経験者募集／完全在宅／週2日～・1日2h～OK／成果に応じてインセンティブ支給 SES営業／経験者募集／完全在宅／週2日～・1日2h～OK／成果に応じてインセンティブ支給 ■成果をしっかり還元 時給に加えてインセンティブ制度あり。 時給：1250円以上＋ 成果報酬（インセン）あり,nan,不明,不明,不明,,,不明,未経験可,,,,フルリモート,,https://en-gage.net/user/search/desc/17165538/,2026-07-01,phase3_engage,engage
株式会社サンソフト,サンソフト,求人TOP 求人検索 東京都の求人 中央区の求人 【IT営業／SES営業】土日祝休み｜在宅制度｜インセンティブあり 求人TOP 求人検索 株式会社サンソフト 【IT営業／SES営業】土日祝休み｜在宅制度｜インセンティブあり 【IT営業／SES営業】土日祝休み｜在宅制度｜インセンティブあり ・インセンティブ制度あり,正社員,,求人TOP 求人検索 東京都の求人 中央区の求人 【IT営業／SES営業】土日祝休み｜在宅制度｜インセンティブあり 求人TOP 求人検索 株式会社サンソフト 【IT営業／SES営業】土日祝休み｜在宅制度｜インセンティブあり 【IT営業／SES営業】土日祝休み｜在宅制度｜インセンティブあり ・インセンティブ制度あり,nan,不明,不明,不明,,,不明,未経験可,,,,ハイブリッド,,https://en-gage.net/user/search/desc/17406595/,2026-07-01,phase3_engage,engage
株式会社システム・コミュニケート,システムコミュニケート,キャリアアドバイザー募集【新規事業展開中！高額インセンティブ】あなたも仲間に入りませんか？,正社員,,キャリアアドバイザー募集【新規事業展開中！高額インセンティブ】あなたも仲間に入りませんか？,nan,不明,不明,不明,,,不明,未経験可,,,,ハイブリッド,,https://en-gage.net/user/search/desc/17108010/,2026-07-01,phase3_engage,engage
株式会社の採用・求人情報,の採用求人情報,求人TOP 求人検索 東京都の求人 千代田区の求人 平均年齢29歳！【東京SES営業】成果報酬あり／在宅併用／年間休日127日／完全土日祝休み／副業OK 求人TOP 求人検索 エンパワー株式会社 平均年齢29歳！【東京SES営業】成果報酬あり／在宅併用／年間休日127日／完全土日祝休み／副業OK 平均年齢29歳！【東京SES営業】成果報酬あり／在宅併用／年間休日127日／完全土日祝休み／副業OK 【成果報酬】 毎月の担当稼働売上からのインセンティブ制度があるため、契約数が増えれば増えるほど、毎月の営業手当が増えるため、給与など待遇面に反映され大きなやりがいになります。,正社員,,求人TOP 求人検索 東京都の求人 千代田区の求人 平均年齢29歳！【東京SES営業】成果報酬あり／在宅併用／年間休日127日／完全土日祝休み／副業OK 求人TOP 求人検索 エンパワー株式会社 平均年齢29歳！【東京SES営業】成果報酬あり／在宅併用／年間休日127日／完全土日祝休み／副業OK 平均年齢29歳！【東京SES営業】成果報酬あり／在宅併用／年間休日127日／完全土日祝休み／副業OK 【成果報酬】 毎月の担当稼働売上からのインセンティブ制度があるため、契約数が増えれば増えるほど、毎月の営業手当が増えるため、給与など待遇面に反映され大きなやりがいになります。,nan,不明,不明,不明,,,不明,未経験可,,,,ハイブリッド,,https://en-gage.net/user/search/desc/16243103/,2026-07-01,phase3_engage,engage
株式会社ＮＩＳ,ｎｉｓ,＼月35万円～／大手Grで生命保険の事務や営業＊固定給＋インセンティブ♪,正社員,,＼月35万円～／大手Grで生命保険の事務や営業＊固定給＋インセンティブ♪,nan,不明,不明,不明,,,不明,未経験可,,,,ハイブリッド,,https://en-gage.net/user/search/desc/17333406/,2026-07-01,phase3_engage,engage
株式会社の,の,＼裁量大×高インセンティブ／住宅ローンの提案営業｜年収1000万円以上可｜成果は青天井｜賞与年3回,正社員,,＼裁量大×高インセンティブ／住宅ローンの提案営業｜年収1000万円以上可｜成果は青天井｜賞与年3回,nan,不明,不明,上限なし,,,不明,未経験可,,,,不明,,https://en-gage.net/user/search/desc/16926644/,2026-07-01,phase3_engage,engage
株式会社スタッフライフ,スタッフライフ,求人TOP 求人検索 東京都の求人 渋谷区の求人 SES営業◎インセンティブ制度あり｜ワークライフバランスを整え、人のキャリアサポートを！ 求人TOP 求人検索 株式会社スタッフライフ SES営業◎インセンティブ制度あり｜ワークライフバランスを整え、人のキャリアサポートを！ SES営業◎インセンティブ制度あり｜ワークライフバランスを整え、人のキャリアサポートを！,正社員,,求人TOP 求人検索 東京都の求人 渋谷区の求人 SES営業◎インセンティブ制度あり｜ワークライフバランスを整え、人のキャリアサポートを！ 求人TOP 求人検索 株式会社スタッフライフ SES営業◎インセンティブ制度あり｜ワークライフバランスを整え、人のキャリアサポートを！ SES営業◎インセンティブ制度あり｜ワークライフバランスを整え、人のキャリアサポートを！,nan,不明,不明,不明,,,不明,未経験可,,,,ハイブリッド,,https://en-gage.net/user/search/desc/14428213/,2026-07-01,phase3_engage,engage
株式会社アスタ,アスタ,インセンティブ制度あり。 ＼裁量大×高インセンティブ／住宅ローンの提案営業｜年収1000万円以上可｜成果は青天井｜賞与年3回,正社員,,インセンティブ制度あり。 ＼裁量大×高インセンティブ／住宅ローンの提案営業｜年収1000万円以上可｜成果は青天井｜賞与年3回,nan,不明,不明,上限なし,4000000,270000,不明,未経験可,,,,ハイブリッド,,https://en-gage.net/user/search/desc/15360637/,2026-07-01,phase3_engage,engage
株式会社ユニバーサルコンツェルン,ユニバーサルコンツェルン,※上記に加え、営業インセンティブを支給する場合があります。 ◇ 営業インセンティブ ＼月35万円～／大手Grで生命保険の事務や営業＊固定給＋インセンティブ♪,正社員,,※上記に加え、営業インセンティブを支給する場合があります。 ◇ 営業インセンティブ ＼月35万円～／大手Grで生命保険の事務や営業＊固定給＋インセンティブ♪,nan,不明,不明,不明,,,不明,未経験可,,,,ハイブリッド,,https://en-gage.net/user/search/desc/15663783/,2026-07-01,phase3_engage,engage
株式会社の,の,※インセンティブ制度あり。インセンティブだけで月100万円以上稼ぐ先輩社員もいます！ ■インセンティブ制度 ＼裁量大×高インセンティブ／住宅ローンの提案営業｜年収1000万円以上可｜成果は青天井｜賞与年3回,正社員,,※インセンティブ制度あり。インセンティブだけで月100万円以上稼ぐ先輩社員もいます！ ■インセンティブ制度 ＼裁量大×高インセンティブ／住宅ローンの提案営業｜年収1000万円以上可｜成果は青天井｜賞与年3回,nan,不明,不明,上限なし,,,不明,未経験可,,,,ハイブリッド,,https://en-gage.net/user/search/desc/7570626/,2026-07-01,phase3_engage,engage
株式会社の,の,求人TOP 求人検索 東京都の求人 港区の求人 SES営業！エンジニアの評価を最適化するお仕事！◆未経験OK！インセンティブあり！ 求人TOP 求人検索 ボンズテック株式会社 SES営業！エンジニアの評価を最適化するお仕事！◆未経験OK！インセンティブあり！ SES営業！エンジニアの評価を最適化するお仕事！◆未経験OK！インセンティブあり！ 営業の成果に応じてインセンティブがつきますので、やったらやったぶんだけ給与に反映される仕組みになっています。 ■インセンティブ制度あり,正社員,,求人TOP 求人検索 東京都の求人 港区の求人 SES営業！エンジニアの評価を最適化するお仕事！◆未経験OK！インセンティブあり！ 求人TOP 求人検索 ボンズテック株式会社 SES営業！エンジニアの評価を最適化するお仕事！◆未経験OK！インセンティブあり！ SES営業！エンジニアの評価を最適化するお仕事！◆未経験OK！インセンティブあり！ 営業の成果に応じてインセンティブがつきますので、やったらやったぶんだけ給与に反映される仕組みになっています。 ■インセンティブ制度あり,nan,不明,不明,不明,,,不明,未経験可,,,,不明,,https://en-gage.net/user/search/desc/2429962/,2026-07-01,phase3_engage,engage
株式会社ハッピーデザイン,ハッピーデザイン,成果に伴い、インセンティブを支給します。 ◇ 営業手当あり（成果に応じたインセンティブ支給）,正社員,,成果に伴い、インセンティブを支給します。 ◇ 営業手当あり（成果に応じたインセンティブ支給）,nan,不明,不明,不明,,,不明,未経験可,,,,ハイブリッド,,https://en-gage.net/user/search/desc/13785245/,2026-07-01,phase3_engage,engage
株式会社Center,center,求人TOP 求人検索 愛知県の求人 名古屋市の求人 中区の求人 法人企業に対するSES営業をお任せします！営業として稼ぎたいかた求む🔥インセンティブが豊富です💪 求人TOP 求人検索 株式会社Center Force 法人企業に対するSES営業をお任せします！営業として稼ぎたいかた求む🔥インセンティブが豊富です💪 法人企業に対するSES営業をお任せします！営業として稼ぎたいかた求む🔥インセンティブが豊富です💪 ◇高い歩合率で稼ぎやすい環境です！,正社員,,求人TOP 求人検索 愛知県の求人 名古屋市の求人 中区の求人 法人企業に対するSES営業をお任せします！営業として稼ぎたいかた求む🔥インセンティブが豊富です💪 求人TOP 求人検索 株式会社Center Force 法人企業に対するSES営業をお任せします！営業として稼ぎたいかた求む🔥インセンティブが豊富です💪 法人企業に対するSES営業をお任せします！営業として稼ぎたいかた求む🔥インセンティブが豊富です💪 ◇高い歩合率で稼ぎやすい環境です！,nan,不明,不明,不明,,,不明,未経験可,,,,不明,,https://en-gage.net/user/search/desc/10661959/,2026-07-01,phase3_engage,engage
株式会社（英文名称：P.EN.S,（英文名称：p.en.s,"求人TOP 求人検索 東京都の求人 中央区の求人 【SES営業経験者歓迎】インセンティブで稼げる環境／ノルマなし／年間休日130日／退職金あり 求人TOP 求人検索 ピー.エン.ス株式会社（英文名称：P.EN.S Co., Ltd.） 【SES営業経験者歓迎】インセンティブで稼げる環境／ノルマなし／年間休日130日／退職金あり 【SES営業経験者歓迎】インセンティブで稼げる環境／ノルマなし／年間休日130日／退職金あり ◇営業インセンティブ 基本給に加え、業界高還元のインセンティブ制度を導入。",正社員,,"求人TOP 求人検索 東京都の求人 中央区の求人 【SES営業経験者歓迎】インセンティブで稼げる環境／ノルマなし／年間休日130日／退職金あり 求人TOP 求人検索 ピー.エン.ス株式会社（英文名称：P.EN.S Co., Ltd.） 【SES営業経験者歓迎】インセンティブで稼げる環境／ノルマなし／年間休日130日／退職金あり 【SES営業経験者歓迎】インセンティブで稼げる環境／ノルマなし／年間休日130日／退職金あり ◇営業インセンティブ 基本給に加え、業界高還元のインセンティブ制度を導入。",nan,不明,不明,不明,,,なし,未経験可,,,,ハイブリッド,,https://en-gage.net/user/search/desc/16842674/,2026-07-01,phase3_engage,engage
株式会社ネットウェーブ,ネットウェーブ,＼裁量大×高インセンティブ／住宅ローンの提案営業｜年収1000万円以上可｜成果は青天井｜賞与年3回,正社員,,＼裁量大×高インセンティブ／住宅ローンの提案営業｜年収1000万円以上可｜成果は青天井｜賞与年3回,nan,不明,不明,上限なし,,,不明,,,,,ハイブリッド,,https://en-gage.net/user/search/desc/5761257/,2026-07-01,phase3_engage,engage
株式会社トップヒルズ,トップヒルズ,＼裁量大×高インセンティブ／住宅ローンの提案営業｜年収1000万円以上可｜成果は青天井｜賞与年3回,正社員,,＼裁量大×高インセンティブ／住宅ローンの提案営業｜年収1000万円以上可｜成果は青天井｜賞与年3回,nan,不明,不明,上限なし,,,不明,,,,,不明,,https://en-gage.net/user/search/desc/17236312/,2026-07-01,phase3_engage,engage
株式会社エフェクト,エフェクト,＼裁量大×高インセンティブ／住宅ローンの提案営業｜年収1000万円以上可｜成果は青天井｜賞与年3回,正社員,,＼裁量大×高インセンティブ／住宅ローンの提案営業｜年収1000万円以上可｜成果は青天井｜賞与年3回,nan,不明,不明,上限なし,,,不明,,,,,ハイブリッド,,https://en-gage.net/user/search/desc/13593890/,2026-07-01,phase3_engage,engage
株式会社effortact,effortact,※インセンティブ制度あり。 例：月給20万～30万+インセンティブ（30万）など ＼裁量大×高インセンティブ／住宅ローンの提案営業｜年収1000万円以上可｜成果は青天井｜賞与年3回,正社員,,※インセンティブ制度あり。 例：月給20万～30万+インセンティブ（30万）など ＼裁量大×高インセンティブ／住宅ローンの提案営業｜年収1000万円以上可｜成果は青天井｜賞与年3回,nan,不明,不明,上限なし,,,不明,未経験可,,,,ハイブリッド,,https://en-gage.net/user/search/desc/3933794/,2026-07-01,phase3_engage,engage
株式会社BIT,bit,＼裁量大×高インセンティブ／住宅ローンの提案営業｜年収1000万円以上可｜成果は青天井｜賞与年3回,正社員,,＼裁量大×高インセンティブ／住宅ローンの提案営業｜年収1000万円以上可｜成果は青天井｜賞与年3回,nan,不明,不明,上限なし,,,不明,,,,,ハイブリッド,,https://en-gage.net/user/search/desc/17284754/,2026-07-01,phase3_engage,engage
合同会社ミスターアウトバウンド,ミスターアウトバウンド,インサイドセールス【副業OK／リモート・在宅勤務 ／インセンティブあり】,正社員,,インサイドセールス【副業OK／リモート・在宅勤務 ／インセンティブあり】,nan,不明,不明,不明,,,不明,未経験可,,,,フルリモート,,https://en-gage.net/user/search/desc/11642360/,2026-07-01,phase3_engage,engage
株式会社エス・イー・プロジェクト,エスイープロジェクト,＼裁量大×高インセンティブ／住宅ローンの提案営業｜年収1000万円以上可｜成果は青天井｜賞与年3回,正社員,,＼裁量大×高インセンティブ／住宅ローンの提案営業｜年収1000万円以上可｜成果は青天井｜賞与年3回,nan,不明,不明,上限なし,,,不明,未経験可,,,,ハイブリッド,,https://en-gage.net/user/search/desc/2648378/,2026-07-01,phase3_engage,engage
株式会社InterLink,interlink,・インセンティブ：あり（成果に応じて支給） ＼裁量大×高インセンティブ／住宅ローンの提案営業｜年収1000万円以上可｜成果は青天井｜賞与年3回,正社員,,・インセンティブ：あり（成果に応じて支給） ＼裁量大×高インセンティブ／住宅ローンの提案営業｜年収1000万円以上可｜成果は青天井｜賞与年3回,nan,不明,不明,上限なし,,,不明,未経験可,,,,ハイブリッド,,https://en-gage.net/user/search/desc/15724778/,2026-07-01,phase3_engage,engage
株式会社の採用・求人情報,の採用求人情報,求人TOP 求人検索 東京都の求人 品川区の求人 IT 企画営業（SES）◆未経験歓迎／一部リモート／インセンティブあり◎/20代、30代女性活躍中 求人TOP 求人検索 Arcxia株式会社 IT 企画営業（SES）◆未経験歓迎／一部リモート／インセンティブあり◎/20代、30代女性活躍中 IT 企画営業（SES）◆未経験歓迎／一部リモート／インセンティブあり◎/20代、30代女性活躍中 ★月給25万円～＋インセンティブ＋賞与／成果が収入に直結 ・収入：月給25万～35万円＋インセンティブ＋賞与（業績連動）。経験者は優遇。,正社員,,求人TOP 求人検索 東京都の求人 品川区の求人 IT 企画営業（SES）◆未経験歓迎／一部リモート／インセンティブあり◎/20代、30代女性活躍中 求人TOP 求人検索 Arcxia株式会社 IT 企画営業（SES）◆未経験歓迎／一部リモート／インセンティブあり◎/20代、30代女性活躍中 IT 企画営業（SES）◆未経験歓迎／一部リモート／インセンティブあり◎/20代、30代女性活躍中 ★月給25万円～＋インセンティブ＋賞与／成果が収入に直結 ・収入：月給25万～35万円＋インセンティブ＋賞与（業績連動）。経験者は優遇。,nan,不明,不明,不明,,,不明,未経験可,,,,フルリモート,,https://en-gage.net/user/search/desc/2830136/,2026-07-01,phase3_engage,engage
株式会社Wisdom,wisdom,キャリアアドバイザー募集！【新規事業展開中！高額インセンティブ】あなたも仲間に入りませんか？,正社員,,キャリアアドバイザー募集！【新規事業展開中！高額インセンティブ】あなたも仲間に入りませんか？,nan,不明,不明,不明,6000000,10000000,不明,未経験可,,,,フルリモート,,https://en-gage.net/user/search/desc/17426013/,2026-07-01,phase3_engage,engage
株式会社ビズコネクト,ビズコネクト,＼裁量大×高インセンティブ／住宅ローンの提案営業｜年収1000万円以上可｜成果は青天井｜賞与年3回,正社員,,＼裁量大×高インセンティブ／住宅ローンの提案営業｜年収1000万円以上可｜成果は青天井｜賞与年3回,nan,不明,不明,上限なし,,,不明,,,,,ハイブリッド,,https://en-gage.net/user/search/desc/15784938/,2026-07-01,phase3_engage,engage
株式会社イントゥ,イントゥ,求人TOP 求人検索 東京都の求人 新宿区の求人 インセンティブ契約時100％／⼈材コーディネーター／営業経験者優遇／ 求人TOP 求人検索 株式会社イントゥ インセンティブ契約時100％／⼈材コーディネーター／営業経験者優遇／ インセンティブ契約時100％／⼈材コーディネーター／営業経験者優遇／ インセンティブは初回契約時、粗利100％を考えております。 上記に加え、インセンティブを支給します。 インセンティブは初回契約時、粗利100％を考えております。 ＼裁量大×高インセンティブ／住宅ローンの提案営業｜年収1000万円以上可｜成果は青天井｜賞与年3回,正社員,,求人TOP 求人検索 東京都の求人 新宿区の求人 インセンティブ契約時100％／⼈材コーディネーター／営業経験者優遇／ 求人TOP 求人検索 株式会社イントゥ インセンティブ契約時100％／⼈材コーディネーター／営業経験者優遇／ インセンティブ契約時100％／⼈材コーディネーター／営業経験者優遇／ インセンティブは初回契約時、粗利100％を考えております。 上記に加え、インセンティブを支給します。 インセンティブは初回契約時、粗利100％を考えております。 ＼裁量大×高インセンティブ／住宅ローンの提案営業｜年収1000万円以上可｜成果は青天井｜賞与年3回,nan,粗利,不明,上限なし,,,不明,,,,,ハイブリッド,,https://en-gage.net/user/search/desc/9368614/,2026-07-01,phase3_engage,engage
株式会社プラウドデータ,プラウドデータ,"固定給18万6,080円＋成果給5万3,920円＋インセンティブ キャリアアドバイザー募集【新規事業展開中！高額インセンティブ】あなたも仲間に入りませんか？",正社員,,"固定給18万6,080円＋成果給5万3,920円＋インセンティブ キャリアアドバイザー募集【新規事業展開中！高額インセンティブ】あなたも仲間に入りませんか？",nan,不明,不明,不明,,,不明,未経験可,,,,ハイブリッド,,https://en-gage.net/user/search/desc/8423410/,2026-07-01,phase3_engage,engage
株式会社クオンツ,クオンツ,※固定給の他にインセンティブあり キャリアアドバイザー募集【新規事業展開中！高額インセンティブ】あなたも仲間に入りませんか？,正社員,,※固定給の他にインセンティブあり キャリアアドバイザー募集【新規事業展開中！高額インセンティブ】あなたも仲間に入りませんか？,nan,不明,不明,不明,,,不明,未経験可,,,,ハイブリッド,,https://en-gage.net/user/search/desc/233622/,2026-07-01,phase3_engage,engage
