company_name,company_core,job_title,employment_type,base_salary_monthly,incentive_description,incentive_rate_pct,incentive_base,incentive_type,incentive_cap,expected_annual_min,expected_annual_max,has_quota,required_experience,employee_count,founded_year,hq_location,remote_policy,notes,source_url,crawl_date,data_source,channel
株式会社の,の,◆賞与と別にインセンティブ支給あり♪ 営業実績に応じたインセンティブ制度もあり、成果がしっかり評価される環境です。 インセンティブは新規受注実績に応じて支給します。,正社員,,◆賞与と別にインセンティブ支給あり♪ 営業実績に応じたインセンティブ制度もあり、成果がしっかり評価される環境です。 インセンティブは新規受注実績に応じて支給します。,nan,不明,不明,不明,,,不明,未経験可,,,,ハイブリッド,,https://en-gage.net/user/search/desc/17211935/,2026-07-01,phase3_engage,engage
株式会社の,の,＼裁量大×高インセンティブ／住宅ローンの提案営業｜年収1000万円以上可｜成果は青天井｜賞与年3回,正社員,,＼裁量大×高インセンティブ／住宅ローンの提案営業｜年収1000万円以上可｜成果は青天井｜賞与年3回,nan,不明,不明,上限なし,,,不明,,,,,ハイブリッド,,https://en-gage.net/user/search/desc/13036191/,2026-07-01,phase3_engage,engage
株式会社ユーアイソフトウェア,ユーアイソフトウェア,年齢関係なく高いインセンティブ報酬で稼げる！固定月給40万円以上！不用品買取の営業スタッフ,正社員,,年齢関係なく高いインセンティブ報酬で稼げる！固定月給40万円以上！不用品買取の営業スタッフ,nan,不明,不明,不明,,,なし,未経験可,,,,不明,,https://en-gage.net/user/search/desc/8497489/,2026-07-01,phase3_engage,engage
株式会社ロジ勤怠システム,ロジ勤怠システム,◇インセンティブ制度（2月、8月支給） ＜１社受注する度にインセンティブを支給＞ キャリアアドバイザー募集【新規事業展開中！高額インセンティブ】あなたも仲間に入りませんか？,正社員,,◇インセンティブ制度（2月、8月支給） ＜１社受注する度にインセンティブを支給＞ キャリアアドバイザー募集【新規事業展開中！高額インセンティブ】あなたも仲間に入りませんか？,nan,不明,不明,不明,,,不明,未経験可,,,,ハイブリッド,,https://en-gage.net/user/search/desc/10415922/,2026-07-01,phase3_engage,engage
株式会社Ｂ・Ｐ・Ｓ,ｂｐｓ,キャリアアドバイザー募集【新規事業展開中！高額インセンティブ】あなたも仲間に入りませんか？,正社員,240000,キャリアアドバイザー募集【新規事業展開中！高額インセンティブ】あなたも仲間に入りませんか？,nan,不明,不明,不明,,,不明,未経験可,,,,ハイブリッド,,https://en-gage.net/user/search/desc/4825992/,2026-07-01,phase3_engage,engage
株式会社の採用・求人情報,の採用求人情報,賞与は会社業績や個人評価に応じて支給しており、通常は年間2～3ヶ月分程度が一般的です。昨年度は業績好調により、**5.2ヶ月分（総支給額ベース）**を支給。社員の頑張りをしっかり還元する風土があります。 Webサイトの営業（未経験歓迎）◆インセンティブで月収100万円以上／報奨金も支給／年間休日127日,正社員,,賞与は会社業績や個人評価に応じて支給しており、通常は年間2～3ヶ月分程度が一般的です。昨年度は業績好調により、**5.2ヶ月分（総支給額ベース）**を支給。社員の頑張りをしっかり還元する風土があります。 Webサイトの営業（未経験歓迎）◆インセンティブで月収100万円以上／報奨金も支給／年間休日127日,nan,不明,不明,不明,,,不明,未経験可,,,,ハイブリッド,,https://en-gage.net/user/search/desc/17444218/,2026-07-01,phase3_engage,engage
株式会社ビヨンドソフトホールディングス,ビヨンドソフトホールディングス,＼裁量大×高インセンティブ／住宅ローンの提案営業｜年収1000万円以上可｜成果は青天井｜賞与年3回,正社員,,＼裁量大×高インセンティブ／住宅ローンの提案営業｜年収1000万円以上可｜成果は青天井｜賞与年3回,nan,不明,不明,上限なし,,,不明,未経験可,,,,ハイブリッド,,https://en-gage.net/user/search/desc/16629573/,2026-07-01,phase3_engage,engage
株式会社の,の,インセンティブ還元◎住宅ローン提案営業◆キャリアアップ可能！/re30058,正社員,,インセンティブ還元◎住宅ローン提案営業◆キャリアアップ可能！/re30058,nan,不明,不明,不明,,,不明,未経験可,,,,不明,,https://en-gage.net/user/search/desc/12134263/,2026-07-01,phase3_engage,engage
株式会社の,の,【未経験から年収1000万円へ】月給30万円＋高率歩合！充実研修で稼げる不動産営業に◎年休120日,正社員,,【未経験から年収1000万円へ】月給30万円＋高率歩合！充実研修で稼げる不動産営業に◎年休120日,nan,不明,不明,不明,,,不明,未経験可,,,,ハイブリッド,,https://en-gage.net/user/search/desc/16483829/,2026-07-01,phase3_engage,engage
株式会社の,の,（歩合によるインセンティブもありますので意欲のある方歓迎です。） ＼月35万円～／大手Grで生命保険の事務や営業＊固定給＋インセンティブ♪,正社員,,（歩合によるインセンティブもありますので意欲のある方歓迎です。） ＼月35万円～／大手Grで生命保険の事務や営業＊固定給＋インセンティブ♪,nan,不明,不明,不明,,,不明,,,,,ハイブリッド,,https://en-gage.net/user/search/desc/1195579/,2026-07-01,phase3_engage,engage
株式会社CocoPalette,cocopalette,・インセンティブ制度あり！頑張りをしっかり還元 ・営業インセンティブあり（実績に応じて随時支給） 骨を折るような仕事もありますが、その努力を社員に還元していくことを重視しています。薄利多売ではなく、一人ひとりのお客様と濃い関係を築き、社員へボーナスや働きやすい環境として返していく。これが当社の姿勢です。 ＼裁量大×高インセンティブ／住宅ローンの提案営業｜年収1000万円以上可｜成果は青天井｜賞与年3回,正社員,,・インセンティブ制度あり！頑張りをしっかり還元 ・営業インセンティブあり（実績に応じて随時支給） 骨を折るような仕事もありますが、その努力を社員に還元していくことを重視しています。薄利多売ではなく、一人ひとりのお客様と濃い関係を築き、社員へボーナスや働きやすい環境として返していく。これが当社の姿勢です。 ＼裁量大×高インセンティブ／住宅ローンの提案営業｜年収1000万円以上可｜成果は青天井｜賞与年3回,nan,不明,不明,上限なし,,,不明,未経験可,,,,ハイブリッド,,https://en-gage.net/user/search/desc/14765753/,2026-07-01,phase3_engage,engage
株式会社では、介護事業所向け業務支援システムやヘルパーと事業所のマッチングプラットフォーム開発など、様々な事業を立ち上げてきました。,では、介護事業所向け業務支援システムやヘルパーと事業所のマッチングプラットフォーム開発など、様々な事業を立ち上げてきました。,・想定年収：502万～600万＋インセンティブ報酬 ※1）インセンティブ制度あり（個人の成果に応じて、毎月支給） ＼裁量大×高インセンティブ／住宅ローンの提案営業｜年収1000万円以上可｜成果は青天井｜賞与年3回,正社員,,・想定年収：502万～600万＋インセンティブ報酬 ※1）インセンティブ制度あり（個人の成果に応じて、毎月支給） ＼裁量大×高インセンティブ／住宅ローンの提案営業｜年収1000万円以上可｜成果は青天井｜賞与年3回,nan,不明,不明,上限なし,,,不明,,,,,ハイブリッド,,https://en-gage.net/user/search/desc/8983222/,2026-07-01,phase3_engage,engage
株式会社Crestix,crestix,成果に応じてインセンティブとして しっかり還元される環境です。 インセンティブの平均支給額は月30万円。 ※ 成果に応じてインセンティブを支給。 ※ インセンティブ平均支給額は月30万円。 ◇インセンティブ制度あり ＼裁量大×高インセンティブ／住宅ローンの提案営業｜年収1000万円以上可｜成果は青天井｜賞与年3回,正社員,300000,成果に応じてインセンティブとして しっかり還元される環境です。 インセンティブの平均支給額は月30万円。 ※ 成果に応じてインセンティブを支給。 ※ インセンティブ平均支給額は月30万円。 ◇インセンティブ制度あり ＼裁量大×高インセンティブ／住宅ローンの提案営業｜年収1000万円以上可｜成果は青天井｜賞与年3回,nan,不明,不明,上限なし,4800000,6000000,不明,未経験可,,,,ハイブリッド,,https://en-gage.net/user/search/desc/17243890/,2026-07-01,phase3_engage,engage
株式会社富士ハウジング,富士ハウジング,求人TOP 求人検索 神奈川県の求人 藤沢市の求人 【100％反響営業／賃貸仲介営業】インセンティブあり｜完全週休2日制 求人TOP 求人検索 株式会社富士ハウジング 【100％反響営業／賃貸仲介営業】インセンティブあり｜完全週休2日制 【100％反響営業／賃貸仲介営業】インセンティブあり｜完全週休2日制 「休みが多く安定した会社で働きたい」「歩合があるところで稼ぎたい」といった転職動機をお聞きすることが多いです。 「前職では歩合率が低く、どれだけ成約をあげてもなかなか給与が上がらなかった。頑張りを適切に評価してもらえる環境で働きたい」,正社員,,求人TOP 求人検索 神奈川県の求人 藤沢市の求人 【100％反響営業／賃貸仲介営業】インセンティブあり｜完全週休2日制 求人TOP 求人検索 株式会社富士ハウジング 【100％反響営業／賃貸仲介営業】インセンティブあり｜完全週休2日制 【100％反響営業／賃貸仲介営業】インセンティブあり｜完全週休2日制 「休みが多く安定した会社で働きたい」「歩合があるところで稼ぎたい」といった転職動機をお聞きすることが多いです。 「前職では歩合率が低く、どれだけ成約をあげてもなかなか給与が上がらなかった。頑張りを適切に評価してもらえる環境で働きたい」,nan,不明,フロー型,不明,,,不明,未経験可,,,,不明,,https://en-gage.net/user/search/desc/14003204/,2026-07-01,phase3_engage,engage
株式会社イヴレス,イヴレス,❖ インセンティブで収入UP！ ◇ インセンティブあり ◇ 報奨金制度（営業職インセンティブ）,正社員,350000,❖ インセンティブで収入UP！ ◇ インセンティブあり ◇ 報奨金制度（営業職インセンティブ）,nan,不明,不明,不明,,,不明,未経験可,,,,不明,,https://en-gage.net/user/search/desc/17307835/,2026-07-01,phase3_engage,engage
合同会社シストリー,シストリー,・売上・粗利目標の達成に向けた営業活動,正社員,,・売上・粗利目標の達成に向けた営業活動,nan,粗利,不明,不明,,,不明,未経験可,,,,フルリモート,,https://en-gage.net/user/search/desc/14845297/,2026-07-01,phase3_engage,engage
株式会社熊本店,熊本店,"歩合給1契約10,466円～19,437円 歩合給を計算し、保障月給を超えた場合に歩合給を支給 未経験歓迎｜住宅リフォーム営業｜月給２０万円～＋歩合 【熊本市東区】　外装リフォーム営業★賞与年3回＆効率インセンティブ！年間休日108日",正社員,191688,"歩合給1契約10,466円～19,437円 歩合給を計算し、保障月給を超えた場合に歩合給を支給 未経験歓迎｜住宅リフォーム営業｜月給２０万円～＋歩合 【熊本市東区】　外装リフォーム営業★賞与年3回＆効率インセンティブ！年間休日108日",nan,不明,不明,不明,,,不明,未経験可,,,,不明,,https://en-gage.net/user/search/desc/7311146/,2026-07-01,phase3_engage,engage
株式会社アクセスブリッジ,アクセスブリッジ,オープニングスタッフ／高いインセンティブ報酬で稼げる！固定月収40万円以上！不用品買取の営業スタッフ,正社員,,オープニングスタッフ／高いインセンティブ報酬で稼げる！固定月収40万円以上！不用品買取の営業スタッフ,nan,不明,不明,不明,,,不明,未経験可,,,,不明,,https://en-gage.net/user/search/desc/3613204/,2026-07-01,phase3_engage,engage
株式会社オール,オール,【増収増益中】賞与年2回＋決算賞与でしっかり還元 月給23万円～30万円+インセンティブ+各種手当+賞与年2回+決算賞与 安定した固定給に、営業成績を反映したインセンティブを支給。 ちなみに月のインセンティブが100万円に達した先輩も多数！ 〇インセンティブ 自分が努力したことが評価されて、還元されるのはやっぱり嬉しいです。 産休前も歩合をたくさんいただいていたので、産休育休手当も充分にあり、子どもたちとゆったり過ごす毎日も最高でした。 自分が努力したことが評価されて、還元されるのはやっぱり嬉しいです。 産休前も歩合をたくさんいただいていたので、産休育休手当も充分にあり、子どもたちとゆったり過,正社員,,【増収増益中】賞与年2回＋決算賞与でしっかり還元 月給23万円～30万円+インセンティブ+各種手当+賞与年2回+決算賞与 安定した固定給に、営業成績を反映したインセンティブを支給。 ちなみに月のインセンティブが100万円に達した先輩も多数！ 〇インセンティブ 自分が努力したことが評価されて、還元されるのはやっぱり嬉しいです。 産休前も歩合をたくさんいただいていたので、産休育休手当も充分にあり、子どもたちとゆったり過ごす毎日も最高でした。 自分が努力したことが評価されて、還元されるのはやっぱり嬉しいです。 産休前も歩合をたくさんいただいていたので、産休育休手当も充分にあり、子どもたちとゆったり過ごす毎日も最高でした。 自分が努力したことが評価されて、還元されるのはやっぱり嬉しいです。 産休前も歩合をたくさんいただいていたので、産休育休手当も充分にあり、子どもたちとゆったり過ごす毎日も最高でした。,nan,不明,不明,不明,,,不明,未経験可,,,,不明,,https://en-gage.net/user/search/desc/11144648/,2026-07-01,phase3_engage,engage
株式会社アスペクト,アスペクト,＼裁量大×高インセンティブ／住宅ローンの提案営業｜年収1000万円以上可｜成果は青天井｜賞与年3回,正社員,,＼裁量大×高インセンティブ／住宅ローンの提案営業｜年収1000万円以上可｜成果は青天井｜賞与年3回,nan,不明,不明,上限なし,4000000,270000,不明,未経験可,,,,不明,,https://en-gage.net/user/search/desc/301744/,2026-07-01,phase3_engage,engage
株式会社グローバルキャスト,グローバルキャスト,＼裁量大×高インセンティブ／住宅ローンの提案営業｜年収1000万円以上可｜成果は青天井｜賞与年3回,正社員,,＼裁量大×高インセンティブ／住宅ローンの提案営業｜年収1000万円以上可｜成果は青天井｜賞与年3回,nan,不明,不明,上限なし,4000000,270000,不明,未経験可,,,,不明,,https://en-gage.net/user/search/desc/8958991/,2026-07-01,phase3_engage,engage
株式会社インタースペース,インタースペース,求人TOP 求人検索 東京都の求人 新宿区の求人 【業界未経験/第二新卒歓迎】未経験から広告業界へ！成果報酬型Web広告サービスの新規開拓営業 求人TOP 求人検索 株式会社インタースペース 【業界未経験/第二新卒歓迎】未経験から広告業界へ！成果報酬型Web広告サービスの新規開拓営業 【業界未経験/第二新卒歓迎】未経験から広告業界へ！成果報酬型Web広告サービスの新規開拓営業 自社成果報酬型広告サービス「アクセストレード」の新規顧客開拓を担うコアメンバーとしてご活躍いただきます。 アクセストレードは、広告掲載メディア様を訪問したユーザーが、会員登録や商品購入など、広告主様が設定した条件を満たし,正社員,,求人TOP 求人検索 東京都の求人 新宿区の求人 【業界未経験/第二新卒歓迎】未経験から広告業界へ！成果報酬型Web広告サービスの新規開拓営業 求人TOP 求人検索 株式会社インタースペース 【業界未経験/第二新卒歓迎】未経験から広告業界へ！成果報酬型Web広告サービスの新規開拓営業 【業界未経験/第二新卒歓迎】未経験から広告業界へ！成果報酬型Web広告サービスの新規開拓営業 自社成果報酬型広告サービス「アクセストレード」の新規顧客開拓を担うコアメンバーとしてご活躍いただきます。 アクセストレードは、広告掲載メディア様を訪問したユーザーが、会員登録や商品購入など、広告主様が設定した条件を満たしたときに広告費が発生する成果報酬型Web広告サービスです。,nan,不明,不明,不明,,,不明,未経験可,,,,ハイブリッド,,https://en-gage.net/user/search/desc/9728830/,2026-07-01,phase3_engage,engage
株式会社カイショー,カイショー,〇想定月収：固定24万円＋インセンティブ（実績に応じて）＋残業代（別途100％支給）＋交通費（規定あり） ※賞与（年２回）、残業手当、他諸手当、営業インセンティブ　等を含む 〇インセンティブ,正社員,,〇想定月収：固定24万円＋インセンティブ（実績に応じて）＋残業代（別途100％支給）＋交通費（規定あり） ※賞与（年２回）、残業手当、他諸手当、営業インセンティブ　等を含む 〇インセンティブ,nan,不明,不明,不明,,,不明,未経験可,,,,不明,,https://en-gage.net/user/search/desc/15735019/,2026-07-01,phase3_engage,engage
株式会社の,の,＼月35万円～／大手Grで生命保険の事務や営業＊固定給＋インセンティブ♪,正社員,,＼月35万円～／大手Grで生命保険の事務や営業＊固定給＋インセンティブ♪,nan,不明,不明,不明,,,不明,未経験可,,,,ハイブリッド,,https://en-gage.net/user/search/desc/5357444/,2026-07-01,phase3_engage,engage
株式会社EMI,emi,＼裁量大×高インセンティブ／住宅ローンの提案営業｜年収1000万円以上可｜成果は青天井｜賞与年3回,正社員,,＼裁量大×高インセンティブ／住宅ローンの提案営業｜年収1000万円以上可｜成果は青天井｜賞与年3回,nan,不明,不明,上限なし,,,不明,未経験可,,,,不明,,https://en-gage.net/user/search/desc/5283911/,2026-07-01,phase3_engage,engage
株式会社ナレルグループ,ナレルグループ,求人TOP 求人検索 東京都の求人 千代田区の求人 【ナレルグループ｜新規上場】法人営業/インセンティブ制度/未経験歓迎/年間休日120日/土日祝休み 求人TOP 求人検索 株式会社ナレルグループ 【ナレルグループ｜新規上場】法人営業/インセンティブ制度/未経験歓迎/年間休日120日/土日祝休み 【ナレルグループ｜新規上場】法人営業/インセンティブ制度/未経験歓迎/年間休日120日/土日祝休み 営業実績は社内で認められる１つの要素にもなり、インセンティブとして目に見える評価で返ってきます。 インセンティブも充実しているので、成果が給与で還元されるやりがいある仕事です。,正社員,,求人TOP 求人検索 東京都の求人 千代田区の求人 【ナレルグループ｜新規上場】法人営業/インセンティブ制度/未経験歓迎/年間休日120日/土日祝休み 求人TOP 求人検索 株式会社ナレルグループ 【ナレルグループ｜新規上場】法人営業/インセンティブ制度/未経験歓迎/年間休日120日/土日祝休み 【ナレルグループ｜新規上場】法人営業/インセンティブ制度/未経験歓迎/年間休日120日/土日祝休み 営業実績は社内で認められる１つの要素にもなり、インセンティブとして目に見える評価で返ってきます。 インセンティブも充実しているので、成果が給与で還元されるやりがいある仕事です。,nan,不明,不明,不明,,,不明,未経験可,,,,ハイブリッド,,https://en-gage.net/user/search/desc/5590819/,2026-07-01,phase3_engage,engage
株式会社ハウシーク,ハウシーク,求人TOP 求人検索 愛知県の求人 名古屋市の求人 港区の求人 不動産仲介営業／100％反響営業！受託力重視◎インセンティブ充実◎＜売却査定に強い不動産仲介営業＞ 求人TOP 求人検索 株式会社ハウシーク 不動産仲介営業／100％反響営業！受託力重視◎インセンティブ充実◎＜売却査定に強い不動産仲介営業＞ 不動産仲介営業／100％反響営業！受託力重視◎インセンティブ充実◎＜売却査定に強い不動産仲介営業＞ 不動産仲介営業／100％反響営業！受託力重視◎インセンティブ充実◎＜売却査定に強い不動産仲介営業＞ ⭐月間平均インセンティブ【31.5万円】 ※月間平均インセンティブは 粗利の16.5％～22％,正社員,,求人TOP 求人検索 愛知県の求人 名古屋市の求人 港区の求人 不動産仲介営業／100％反響営業！受託力重視◎インセンティブ充実◎＜売却査定に強い不動産仲介営業＞ 求人TOP 求人検索 株式会社ハウシーク 不動産仲介営業／100％反響営業！受託力重視◎インセンティブ充実◎＜売却査定に強い不動産仲介営業＞ 不動産仲介営業／100％反響営業！受託力重視◎インセンティブ充実◎＜売却査定に強い不動産仲介営業＞ 不動産仲介営業／100％反響営業！受託力重視◎インセンティブ充実◎＜売却査定に強い不動産仲介営業＞ ⭐月間平均インセンティブ【31.5万円】 ※月間平均インセンティブは 粗利の16.5％～22％から インセンティブとして還元されます。 ・インセンティブ支給 評価基準は明確です。媒介取得件数・専任率・成約率・粗利額これらをもとに評価され、査定力や提案力が収入へ直結します。,nan,粗利,フロー型,不明,,,不明,未経験可,,,,不明,,https://en-gage.net/user/search/desc/16482969/,2026-07-01,phase3_engage,engage
株式会社ニトエル,ニトエル,求人TOP 求人検索 愛媛県の求人 松山市の求人 企業の＼困った／を解決するコンサルティングセールス✨【努力を見逃さない】インセンティブ制度｜提案営業 求人TOP 求人検索 株式会社ニトエル 企業の＼困った／を解決するコンサルティングセールス✨【努力を見逃さない】インセンティブ制度｜提案営業 企業の＼困った／を解決するコンサルティングセールス✨【努力を見逃さない】インセンティブ制度｜提案営業 ※スタート給与27万円＋賞与年2回＋インセンティブ 入社1ヶ月目からインセンティブを獲得する社員も多く、 ※インセンティブは成果・役割に応じて支給,正社員,,求人TOP 求人検索 愛媛県の求人 松山市の求人 企業の＼困った／を解決するコンサルティングセールス✨【努力を見逃さない】インセンティブ制度｜提案営業 求人TOP 求人検索 株式会社ニトエル 企業の＼困った／を解決するコンサルティングセールス✨【努力を見逃さない】インセンティブ制度｜提案営業 企業の＼困った／を解決するコンサルティングセールス✨【努力を見逃さない】インセンティブ制度｜提案営業 ※スタート給与27万円＋賞与年2回＋インセンティブ 入社1ヶ月目からインセンティブを獲得する社員も多く、 ※インセンティブは成果・役割に応じて支給,nan,不明,不明,不明,,,不明,未経験可,,,,不明,,https://en-gage.net/user/search/desc/15963203/,2026-07-01,phase3_engage,engage
