company_name,employment_type,base_salary_monthly,incentive_description,incentive_rate_pct,incentive_base,incentive_type,incentive_cap,expected_annual_min,expected_annual_max,has_quota,required_experience,employee_count,founded_year,hq_location,remote_policy,notes,source_url,crawl_date,data_source
株式会社ブレイカーズ,正社員,,【還元率の高さ】…最大77％の還元率 ・未経験者：23万円～＋その他インセンティブ＋超過残業代＋交通費 ・経験者　：30万円～60万円＋その他インセンティブ インセンティブ（受注した案件によって変動。1件当たり3万円から15万円支給。年間合計100万円以上の実績の社員もいます。） 【実務経験半年～OK】エンジニア｜高還元率×案件豊富｜キャリアの幅を広げる環境｜一次請け案件が中心,,不明,不明,不明,,,不明,未経験可,,,,ハイブリッド,,https://en-gage.net/user/search/desc/8068168/,2026-07-01,phase3_llm
株式会社ウェルスペック,正社員,,,,不明,不明,不明,,,不明,未経験可,,,,ハイブリッド,,https://en-gage.net/user/search/desc/17431396/,2026-07-01,phase3_llm
株式会社Growship,正社員,,,,不明,不明,不明,,,不明,未経験可,,,,ハイブリッド,,https://en-gage.net/user/search/desc/15697472/,2026-07-01,phase3_llm
株式会社TERRA,正社員,,,,不明,不明,上限なし,,,なし,未経験可,,,,不明,,https://en-gage.net/user/search/desc/11104833/,2026-07-01,phase3_llm
株式会社エイビス,正社員,,不動産賃貸業◎未経験OK／高水準のインセンティブあり／入社1年目で年収500万円～1000万円も可！ 【８割が未経験の業界】◎歩合で収入UP◎キャリアアップ歓迎 ◎週休3日もOK◎アウトソーシング営業,,不明,不明,不明,,,なし,未経験可,,,,ハイブリッド,,https://en-gage.net/user/search/desc/16662069/,2026-07-01,phase3_llm
株式会社フレッシー,正社員,,,,不明,不明,不明,,,不明,未経験可,,,,ハイブリッド,,https://en-gage.net/user/search/desc/3308443/,2026-07-01,phase3_llm
株式会社Necmos,正社員,,業界最高水準の還元率を実現しております。 【業界初】上昇還元率制により、 成長=還元率Upを実現 📌【Point 1】給与は業界最高水準！還元率83～93.3% 成長 = 還元率UP 「上昇還元率制」 会社利益は一律10万円、残りはエンジニアへ還元。単価が上がれば、還元率も上がるモチベーションアップの評価制度。 上昇還元率制とは 会社利益は一律10万円、残りはエンジニアへ還元 Necmosでは、会社がもらう利益は一律で月10万円だけと決めており、それ以外はすべてエンジニアに還元。だから、自分の働きがどれだけの価値を生んでいるかが明確で、納得感を持って働けます。 会社利益が一律で固定されているため、単価が上がると、この固定額の割合が減る分、自身の還元率が高まる仕組みになっています。,,不明,不明,不明,,,不明,未経験可,,,,フルリモート,,https://en-gage.net/user/search/desc/13533761/,2026-07-01,phase3_llm
株式会社の,正社員,,＊賞与・インセンティブあり（業績による）,,不明,不明,不明,,,なし,未経験可,,,,ハイブリッド,,https://en-gage.net/user/search/desc/15156719/,2026-07-01,phase3_llm
株式会社スカイセンス,正社員,,,,不明,不明,不明,,,不明,未経験可,,,,ハイブリッド,,https://en-gage.net/user/search/desc/17027111/,2026-07-01,phase3_llm
株式会社の,正社員,,✅最大30％の高インセンティブ率！ 賞与(インセンティブ)支給月：6月、12月 ＼裁量大×高インセンティブ／住宅ローンの提案営業｜年収1000万円以上可｜成果は青天井｜賞与年3回,,不明,不明,上限なし,,,不明,未経験可,,,,不明,,https://en-gage.net/user/search/desc/15458350/,2026-07-01,phase3_llm
株式会社の,正社員,,,,不明,不明,不明,,,不明,未経験可,,,,フルリモート,,https://en-gage.net/user/search/desc/15683690/,2026-07-01,phase3_llm
合同会社ReBuild,正社員,,,,不明,不明,不明,,,不明,未経験可,,,,不明,,https://en-gage.net/user/search/desc/14155800/,2026-07-01,phase3_llm
株式会社クレス,正社員,,その他、月々の給与の他に営業インセンティブ制度有,,不明,不明,不明,6000000.0,10000000.0,不明,未経験可,,,,ハイブリッド,,https://en-gage.net/user/search/desc/11124940/,2026-07-01,phase3_llm
株式会社よかわん,正社員,,,,不明,不明,不明,,,不明,未経験可,,,,ハイブリッド,,https://en-gage.net/user/search/desc/16012433/,2026-07-01,phase3_llm
合同会社FYB,正社員,,求人TOP 求人検索 東京都の求人 調布市の求人 SES営業／経験者募集／完全在宅／週2日～・1日2h～OK／成果に応じてインセンティブ支給 求人TOP 求人検索 合同会社FYB SES営業／経験者募集／完全在宅／週2日～・1日2h～OK／成果に応じてインセンティブ支給 SES営業／経験者募集／完全在宅／週2日～・1日2h～OK／成果に応じてインセンティブ支給 ■成果をしっかり還元 時給に加えてインセンティブ制度あり。 時給：1250円以上＋ 成果報酬（インセン）あり,,不明,不明,不明,,,不明,未経験可,,,,フルリモート,,https://en-gage.net/user/search/desc/17165538/,2026-07-01,phase3_llm
株式会社サンソフト,正社員,,求人TOP 求人検索 東京都の求人 中央区の求人 【IT営業／SES営業】土日祝休み｜在宅制度｜インセンティブあり 求人TOP 求人検索 株式会社サンソフト 【IT営業／SES営業】土日祝休み｜在宅制度｜インセンティブあり 【IT営業／SES営業】土日祝休み｜在宅制度｜インセンティブあり ・インセンティブ制度あり,,不明,不明,不明,,,不明,未経験可,,,,ハイブリッド,,https://en-gage.net/user/search/desc/17406595/,2026-07-01,phase3_llm
合同会社ダイク・カンパニー,正社員,,,,不明,不明,不明,,,不明,未経験可,,,,ハイブリッド,,https://en-gage.net/user/search/desc/17279237/,2026-07-01,phase3_llm
株式会社の採用・求人情報,正社員,,,,不明,不明,不明,,,不明,未経験可,,,,ハイブリッド,,https://en-gage.net/user/search/desc/6673613/,2026-07-01,phase3_llm
株式会社コアシンク,正社員,,,,不明,不明,不明,,,不明,未経験可,,,,ハイブリッド,,https://en-gage.net/user/search/desc/14906008/,2026-07-01,phase3_llm
株式会社ユニコーンテクノロジー,正社員,,,,不明,不明,不明,,,不明,未経験可,,,,ハイブリッド,,https://en-gage.net/user/search/desc/4783194/,2026-07-01,phase3_llm
株式会社システム・コミュニケート,正社員,,キャリアアドバイザー募集【新規事業展開中！高額インセンティブ】あなたも仲間に入りませんか？,,不明,不明,不明,,,不明,未経験可,,,,ハイブリッド,,https://en-gage.net/user/search/desc/17108010/,2026-07-01,phase3_llm
株式会社一,正社員,,,,不明,不明,不明,,,不明,未経験可,,,,ハイブリッド,,https://en-gage.net/user/search/desc/14727541/,2026-07-01,phase3_llm
株式会社テイクス,正社員,,,,不明,不明,不明,,,不明,未経験可,,,,ハイブリッド,,https://en-gage.net/user/search/desc/17008433/,2026-07-01,phase3_llm
株式会社キャリアブロックス,正社員,,,,不明,不明,不明,,,不明,未経験可,,,,ハイブリッド,,https://en-gage.net/user/search/desc/10555197/,2026-07-01,phase3_llm
株式会社ガトラボ,正社員,,,,不明,不明,不明,,,不明,未経験可,,,,ハイブリッド,,https://en-gage.net/user/search/desc/12912902/,2026-07-01,phase3_llm
株式会社生和,正社員,,,,不明,不明,不明,,,不明,未経験可,,,,ハイブリッド,,https://en-gage.net/user/search/desc/10675541/,2026-07-01,phase3_llm
株式会社ワンウェブ,正社員,,※単価連動型(高還元)となっており、前職給料を考慮し、,,不明,不明,不明,,,不明,未経験可,,,,ハイブリッド,,https://en-gage.net/user/search/desc/15487347/,2026-07-01,phase3_llm
株式会社ピイアイシイ,正社員,,【経験者募集】システムエンジニア（Web・オープン系）◆案件選択制度有／還元率80％以上／リモート可,,不明,不明,不明,,,不明,,,,,ハイブリッド,,https://en-gage.net/user/search/desc/4723569/,2026-07-01,phase3_llm
株式会社の採用・求人情報,正社員,,求人TOP 求人検索 東京都の求人 千代田区の求人 平均年齢29歳！【東京SES営業】成果報酬あり／在宅併用／年間休日127日／完全土日祝休み／副業OK 求人TOP 求人検索 エンパワー株式会社 平均年齢29歳！【東京SES営業】成果報酬あり／在宅併用／年間休日127日／完全土日祝休み／副業OK 平均年齢29歳！【東京SES営業】成果報酬あり／在宅併用／年間休日127日／完全土日祝休み／副業OK 【成果報酬】 毎月の担当稼働売上からのインセンティブ制度があるため、契約数が増えれば増えるほど、毎月の営業手当が増えるため、給与など待遇面に反映され大きなやりがいになります。,,不明,不明,不明,,,不明,未経験可,,,,ハイブリッド,,https://en-gage.net/user/search/desc/16243103/,2026-07-01,phase3_llm
株式会社の,正社員,,,,不明,不明,不明,,,不明,,,,,ハイブリッド,,https://en-gage.net/user/search/desc/5053853/,2026-07-01,phase3_llm
株式会社ＮＩＳ,正社員,,＼月35万円～／大手Grで生命保険の事務や営業＊固定給＋インセンティブ♪,,不明,不明,不明,,,不明,未経験可,,,,ハイブリッド,,https://en-gage.net/user/search/desc/17333406/,2026-07-01,phase3_llm
株式会社の,正社員,,＼裁量大×高インセンティブ／住宅ローンの提案営業｜年収1000万円以上可｜成果は青天井｜賞与年3回,,不明,不明,上限なし,,,不明,未経験可,,,,不明,,https://en-gage.net/user/search/desc/16926644/,2026-07-01,phase3_llm
株式会社スタッフライフ,正社員,,求人TOP 求人検索 東京都の求人 渋谷区の求人 SES営業◎インセンティブ制度あり｜ワークライフバランスを整え、人のキャリアサポートを！ 求人TOP 求人検索 株式会社スタッフライフ SES営業◎インセンティブ制度あり｜ワークライフバランスを整え、人のキャリアサポートを！ SES営業◎インセンティブ制度あり｜ワークライフバランスを整え、人のキャリアサポートを！,,不明,不明,不明,,,不明,未経験可,,,,ハイブリッド,,https://en-gage.net/user/search/desc/14428213/,2026-07-01,phase3_llm
株式会社エスジー,正社員,,,,不明,不明,不明,,,不明,,,,,ハイブリッド,,https://en-gage.net/user/search/desc/6424911/,2026-07-01,phase3_llm
株式会社の,正社員,,,,不明,不明,不明,,,不明,未経験可,,,,ハイブリッド,,https://en-gage.net/user/search/desc/17276721/,2026-07-01,phase3_llm
株式会社スキルマーク,正社員,,求人TOP 求人検索 北海道の求人 札幌市の求人 北区の求人 【SES事業拡大中×還元率90%】札幌SE・PG募集！経験2年以上／年収UP保証 ＆福利厚生も充実！ 求人TOP 求人検索 株式会社スキルマーク 【SES事業拡大中×還元率90%】札幌SE・PG募集！経験2年以上／年収UP保証 ＆福利厚生も充実！ 【SES事業拡大中×還元率90%】札幌SE・PG募集！経験2年以上／年収UP保証 ＆福利厚生も充実！ 【SES事業拡大中×還元率90%】札幌SE・PG募集！経験2年以上／年収UP保証 ＆福利厚生も充実！ 私達は社員の生活と仕事の質を向上し、豊かな人生を歩んでほしいと願い、売上の約90％以上を個人へ還元しています。社員一人一人が充実した生活を送ることで、顧客へのサービス品質が向上し会社も成長します。 月額個人売上の約90％を「給与 + 社会保険」で還元しています。 個人の売上から90%を社員の給与等の人件費として還元しています。札幌の中小企業では高水準の給与となるよう調整しています。 【札幌】ITエンジニア｜還元率90% × 医療費補償 × 案件選択 × 在宅可× 企業型DC,,不明,不明,不明,,,不明,未経験可,,,,ハイブリッド,,https://en-gage.net/user/search/desc/13814130/,2026-07-01,phase3_llm
株式会社の,正社員,,,,不明,不明,不明,,,不明,未経験可,,,,ハイブリッド,,https://en-gage.net/user/search/desc/12496794/,2026-07-01,phase3_llm
株式会社GOOYA,正社員,,,,不明,不明,不明,,,不明,未経験可,,,,ハイブリッド,,https://en-gage.net/user/search/desc/12666715/,2026-07-01,phase3_llm
株式会社の,正社員,,,,不明,不明,不明,,,不明,未経験可,,,,ハイブリッド,,https://en-gage.net/user/search/desc/16922798/,2026-07-01,phase3_llm
株式会社ＩｎｎｏｖａｔｉｏｎＰｌｕｓ),正社員,,,,不明,不明,不明,,,不明,未経験可,,,,ハイブリッド,,https://en-gage.net/user/search/desc/14344254/,2026-07-01,phase3_llm
株式会社の,正社員,,,,不明,不明,不明,,,不明,未経験可,,,,フルリモート,,https://en-gage.net/user/search/desc/12802963/,2026-07-01,phase3_llm
株式会社の採用・求人情報,正社員,,4. 成果がそのまま返るインセンティブ（計算式は面接で全開示） 月額給与約24万円～（成果に応じてインセンティブあり）。【モデル年収例】１年目 約350万円（成果を出したケース）／約300万円（基礎を固めて立ち上げ中のケース）／３年目モデル 約450万円前後。インセンティブの計算式は面接でお伝えします。 事業内容	1/高還元SES事業,,不明,不明,不明,,,不明,未経験可,,,,ハイブリッド,,https://en-gage.net/user/search/desc/17328598/,2026-07-01,phase3_llm
株式会社Space,正社員,,弊社はオフィスをバーチャルオフィスにすることで可能な限り運営コストを下げ、その分エンジニアに還元する努力をしております。,,不明,不明,不明,,,不明,未経験可,,,,ハイブリッド,,https://en-gage.net/user/search/desc/10711065/,2026-07-01,phase3_llm
株式会社の,正社員,,,,不明,不明,不明,,,不明,,,,,ハイブリッド,,https://en-gage.net/user/search/desc/16309540/,2026-07-01,phase3_llm
株式会社サンシーア,正社員,,,,不明,不明,不明,,,不明,未経験可,,,,ハイブリッド,,https://en-gage.net/user/search/desc/14285544/,2026-07-01,phase3_llm
株式会社アスタ,正社員,,インセンティブ制度あり。 ＼裁量大×高インセンティブ／住宅ローンの提案営業｜年収1000万円以上可｜成果は青天井｜賞与年3回,,不明,不明,上限なし,4000000.0,270000.0,不明,未経験可,,,,ハイブリッド,,https://en-gage.net/user/search/desc/15360637/,2026-07-01,phase3_llm
株式会社の,正社員,,,,不明,不明,不明,,,なし,未経験可,,,,ハイブリッド,,https://en-gage.net/user/search/desc/7570224/,2026-07-01,phase3_llm
株式会社グロシード,正社員,,,,不明,不明,不明,,,不明,,,,,フルリモート,,https://en-gage.net/user/search/desc/15950395/,2026-07-01,phase3_llm
株式会社クラフト情報システム,正社員,,,,不明,不明,不明,,,不明,未経験可,,,,不明,,https://en-gage.net/user/search/desc/15654855/,2026-07-01,phase3_llm
株式会社の,正社員,,,,不明,不明,不明,,,不明,未経験可,,,,ハイブリッド,,https://en-gage.net/user/search/desc/1533163/,2026-07-01,phase3_llm
株式会社よかわん,正社員,,,,不明,不明,不明,,,不明,未経験可,,,,ハイブリッド,,https://en-gage.net/user/search/desc/16102161/,2026-07-01,phase3_llm
株式会社サカタ製作所,正社員,,※インセンティブ制度あり,,不明,不明,不明,,,不明,未経験可,,,,ハイブリッド,,https://en-gage.net/user/search/desc/14372621/,2026-07-01,phase3_llm
株式会社ユニバーサルコンツェルン,正社員,,※上記に加え、営業インセンティブを支給する場合があります。 ◇ 営業インセンティブ ＼月35万円～／大手Grで生命保険の事務や営業＊固定給＋インセンティブ♪,,不明,不明,不明,,,不明,未経験可,,,,ハイブリッド,,https://en-gage.net/user/search/desc/15663783/,2026-07-01,phase3_llm
株式会社スミリオン,正社員,,,,不明,不明,不明,,,不明,未経験可,,,,ハイブリッド,,https://en-gage.net/user/search/desc/14389636/,2026-07-01,phase3_llm
株式会社の,正社員,,※インセンティブ制度あり。インセンティブだけで月100万円以上稼ぐ先輩社員もいます！ ■インセンティブ制度 ＼裁量大×高インセンティブ／住宅ローンの提案営業｜年収1000万円以上可｜成果は青天井｜賞与年3回,,不明,不明,上限なし,,,不明,未経験可,,,,ハイブリッド,,https://en-gage.net/user/search/desc/7570626/,2026-07-01,phase3_llm
株式会社エム・アンド・アイ,正社員,,,,不明,不明,不明,,,不明,未経験可,,,,不明,,https://en-gage.net/user/search/desc/10397187/,2026-07-01,phase3_llm
株式会社の,正社員,,,,不明,不明,不明,,,不明,未経験可,,,,ハイブリッド,,https://en-gage.net/user/search/desc/1591417/,2026-07-01,phase3_llm
株式会社Xedge,正社員,,,,不明,不明,不明,,,不明,未経験可,,,,ハイブリッド,,https://en-gage.net/user/search/desc/13445747/,2026-07-01,phase3_llm
株式会社フロンティアソリューション,正社員,,,,不明,不明,不明,,,なし,未経験可,,,,ハイブリッド,,https://en-gage.net/user/search/desc/16153327/,2026-07-01,phase3_llm
株式会社0235,正社員,,,,不明,不明,不明,,,不明,未経験可,,,,ハイブリッド,,https://en-gage.net/user/search/desc/8861333/,2026-07-01,phase3_llm
株式会社の採用・求人情報,正社員,,【実務経験半年～OK】エンジニア｜高還元率×案件豊富｜キャリアの幅を広げる環境｜一次請け案件が中心,,不明,不明,不明,,,不明,未経験可,,,,フルリモート,,https://en-gage.net/user/search/desc/17149488/,2026-07-01,phase3_llm
株式会社フューチャーブレイン,正社員,,,,不明,不明,不明,,,不明,未経験可,,,,フルリモート,,https://en-gage.net/user/search/desc/7752967/,2026-07-01,phase3_llm
株式会社シャルム,正社員,,求人TOP 求人検索 北海道の求人 札幌市の求人 北区の求人 【高還元SES】プロジェクトマネージャー（PM／PMO）１０名大募集経験1年以上！ 札幌 求人TOP 求人検索 株式会社シャルム 【高還元SES】プロジェクトマネージャー（PM／PMO）１０名大募集経験1年以上！ 札幌 【高還元SES】プロジェクトマネージャー（PM／PMO）１０名大募集経験1年以上！ 札幌 ■会社には粗利10％のみ残します！ 会社がいただく経費は、運営費および会社負担分の社保、単価に対して10％粗利のみ。 その他は社員にすべて還元いたします。 この粗利10％は、次の社員を雇用するための採用費として有意義に使用します！ ・自身の成長を顧客貢献に還元し、さらに飛躍を目指したい方,10.0,粗利,不明,不明,,,不明,未経験可,,,,ハイブリッド,,https://en-gage.net/user/search/desc/16792299/,2026-07-01,phase3_llm
株式会社オキシス,正社員,,,,不明,不明,不明,,,不明,未経験可,,,,不明,,https://en-gage.net/user/search/desc/17216423/,2026-07-01,phase3_llm
株式会社エーピーテック,正社員,,,,不明,不明,不明,,,不明,,,,,フルリモート,,https://en-gage.net/user/search/desc/15914827/,2026-07-01,phase3_llm
株式会社の,正社員,,求人TOP 求人検索 東京都の求人 港区の求人 SES営業！エンジニアの評価を最適化するお仕事！◆未経験OK！インセンティブあり！ 求人TOP 求人検索 ボンズテック株式会社 SES営業！エンジニアの評価を最適化するお仕事！◆未経験OK！インセンティブあり！ SES営業！エンジニアの評価を最適化するお仕事！◆未経験OK！インセンティブあり！ 営業の成果に応じてインセンティブがつきますので、やったらやったぶんだけ給与に反映される仕組みになっています。 ■インセンティブ制度あり,,不明,不明,不明,,,不明,未経験可,,,,不明,,https://en-gage.net/user/search/desc/2429962/,2026-07-01,phase3_llm
株式会社の採用・求人情報,正社員,,求人TOP 求人検索 東京都の求人 渋谷区の求人 【サーバーサイトエンジニア】新還元方式で年収UP⤴️受託開発/DX推進/SES🔶多様なキャリアパス 求人TOP 求人検索 フリーランスコネクト株式会社 【サーバーサイトエンジニア】新還元方式で年収UP⤴️受託開発/DX推進/SES🔶多様なキャリアパス 【サーバーサイトエンジニア】新還元方式で年収UP⤴️受託開発/DX推進/SES🔶多様なキャリアパス ⚫︎高額インセンティブを年4回支給！ エンジニアへ ”最大限の還元をする” 「フリコネダイレクト」で自ら案件成約時の成果報酬,,不明,フロー型,不明,,,不明,未経験可,,,,ハイブリッド,,https://en-gage.net/user/search/desc/17241494/,2026-07-01,phase3_llm
株式会社グルーファーム,正社員,,,,不明,不明,不明,,,不明,未経験可,,,,ハイブリッド,,https://en-gage.net/user/search/desc/14336682/,2026-07-01,phase3_llm
株式会社ハッピーデザイン,正社員,,成果に伴い、インセンティブを支給します。 ◇ 営業手当あり（成果に応じたインセンティブ支給）,,不明,不明,不明,,,不明,未経験可,,,,ハイブリッド,,https://en-gage.net/user/search/desc/13785245/,2026-07-01,phase3_llm
株式会社ナレッジ・キューブ・システムズ,正社員,,,,不明,不明,不明,,,不明,,,,,ハイブリッド,,https://en-gage.net/user/search/desc/9678595/,2026-07-01,phase3_llm
株式会社ワンウェブ,正社員,,※単価連動型(高還元)となっており、前職給料を考慮し、,,不明,不明,不明,,,不明,,,,,ハイブリッド,,https://en-gage.net/user/search/desc/15486998/,2026-07-01,phase3_llm
株式会社ラセン,正社員,,,,不明,不明,不明,,,不明,未経験可,,,,ハイブリッド,,https://en-gage.net/user/search/desc/13634157/,2026-07-01,phase3_llm
株式会社アルテニア,正社員,,,,不明,不明,不明,,,不明,未経験可,,,,ハイブリッド,,https://en-gage.net/user/search/desc/15707125/,2026-07-01,phase3_llm
株式会社Center,正社員,,求人TOP 求人検索 愛知県の求人 名古屋市の求人 中区の求人 法人企業に対するSES営業をお任せします！営業として稼ぎたいかた求む🔥インセンティブが豊富です💪 求人TOP 求人検索 株式会社Center Force 法人企業に対するSES営業をお任せします！営業として稼ぎたいかた求む🔥インセンティブが豊富です💪 法人企業に対するSES営業をお任せします！営業として稼ぎたいかた求む🔥インセンティブが豊富です💪 ◇高い歩合率で稼ぎやすい環境です！,,不明,不明,不明,,,不明,未経験可,,,,不明,,https://en-gage.net/user/search/desc/10661959/,2026-07-01,phase3_llm
株式会社の,正社員,,・福利厚生、インセンティブ等の待遇については面談時に,,不明,不明,不明,,,不明,未経験可,,,,不明,,https://en-gage.net/user/search/desc/9213588/,2026-07-01,phase3_llm
株式会社シャルム,正社員,,求人TOP 求人検索 北海道の求人 札幌市の求人 北区の求人 【高還元SES】システムエンジニア１０名大募集経験1年以上！開発でもインフラでもOK◎ 札幌 求人TOP 求人検索 株式会社シャルム 【高還元SES】システムエンジニア１０名大募集経験1年以上！開発でもインフラでもOK◎ 札幌 【高還元SES】システムエンジニア１０名大募集経験1年以上！開発でもインフラでもOK◎ 札幌 ■会社には粗利10％のみ残します！ 会社がいただく経費は、運営費および会社負担分の社保、単価に対して10％粗利のみ。 その他は社員にすべて還元いたします。 この粗利10％は、次の社員を雇用するための採用費として有意義に使用します！ ・自身の成長を顧客貢献に還元し、さらに飛躍を目指したい方,10.0,粗利,不明,不明,,,不明,未経験可,,,,ハイブリッド,,https://en-gage.net/user/search/desc/16792524/,2026-07-01,phase3_llm
株式会社ＵＰＦ,正社員,,,,不明,不明,不明,,,不明,未経験可,,,,不明,,https://en-gage.net/user/search/desc/17394019/,2026-07-01,phase3_llm
株式会社ソフトユージング,正社員,,,,不明,不明,不明,,,不明,未経験可,,,,フルリモート,,https://en-gage.net/user/search/desc/5273932/,2026-07-01,phase3_llm
株式会社フィクシー,正社員,,※インセンティブ制度なし,,不明,不明,不明,,,なし,未経験可,,,,ハイブリッド,,https://en-gage.net/user/search/desc/14777100/,2026-07-01,phase3_llm
株式会社の,正社員,,,,不明,不明,不明,,,不明,未経験可,,,,不明,,https://en-gage.net/user/search/desc/2272505/,2026-07-01,phase3_llm
