company_name,company_core,job_title,employment_type,base_salary_monthly,incentive_description,incentive_rate_pct,incentive_base,incentive_type,incentive_cap,expected_annual_min,expected_annual_max,has_quota,required_experience,employee_count,founded_year,hq_location,remote_policy,notes,source_url,crawl_date,data_source,channel
株式会社CocoPalette,cocopalette,２．インセンティブは見直しながら調整し、達成感に繋げられます。 ●年収378万円／入社3年目／営業メンバー、25歳（インセンティブ含まず） ●年収448万円／入社8年目／営業リーダー、30歳（インセンティブ含まず） ●年収518万円／入社13年目／営業部課長、35歳（インセンティブ含まず） 想定年収とは別に、実績によってインセンティブが加給されます。 ＼裁量大×高インセンティブ／住宅ローンの提案営業｜年収1000万円以上可｜成果は青天井｜賞与年3回,正社員,,２．インセンティブは見直しながら調整し、達成感に繋げられます。 ●年収378万円／入社3年目／営業メンバー、25歳（インセンティブ含まず） ●年収448万円／入社8年目／営業リーダー、30歳（インセンティブ含まず） ●年収518万円／入社13年目／営業部課長、35歳（インセンティブ含まず） 想定年収とは別に、実績によってインセンティブが加給されます。 ＼裁量大×高インセンティブ／住宅ローンの提案営業｜年収1000万円以上可｜成果は青天井｜賞与年3回,nan,不明,不明,上限なし,,,不明,未経験可,,,,ハイブリッド,,https://en-gage.net/user/search/desc/13120406/,2026-07-01,phase3_engage,engage
株式会社ツリーベル,ツリーベル,＼裁量大×高インセンティブ／住宅ローンの提案営業｜年収1000万円以上可｜成果は青天井｜賞与年3回,正社員,,＼裁量大×高インセンティブ／住宅ローンの提案営業｜年収1000万円以上可｜成果は青天井｜賞与年3回,nan,不明,不明,上限なし,,,不明,未経験可,,,,ハイブリッド,,https://en-gage.net/user/search/desc/50486/,2026-07-01,phase3_engage,engage
株式会社ユービー,ユービー,【営業部創設メンバー】月32万円～/高インセンティブ/未経験可/管理職候補/週休2日/残業ほぼ無し,正社員,,【営業部創設メンバー】月32万円～/高インセンティブ/未経験可/管理職候補/週休2日/残業ほぼ無し,nan,不明,不明,不明,,,なし,未経験可,,,,ハイブリッド,,https://en-gage.net/user/search/desc/11454070/,2026-07-01,phase3_engage,engage
株式会社アクターリアリティー,アクターリアリティー,＼裁量大×高インセンティブ／住宅ローンの提案営業｜年収1000万円以上可｜成果は青天井｜賞与年3回,正社員,,＼裁量大×高インセンティブ／住宅ローンの提案営業｜年収1000万円以上可｜成果は青天井｜賞与年3回,nan,不明,不明,上限なし,,,不明,未経験可,,,,ハイブリッド,,https://en-gage.net/user/search/desc/8819955/,2026-07-01,phase3_engage,engage
株式会社の,の,基本給のほかに営業成果に対してインセンティブの支給があります,正社員,,基本給のほかに営業成果に対してインセンティブの支給があります,nan,不明,不明,不明,,,不明,未経験可,,,,ハイブリッド,,https://en-gage.net/user/search/desc/5553988/,2026-07-01,phase3_engage,engage
株式会社の,の,求人TOP 求人検索 東京都の求人 豊島区の求人 【IT営業】＼未経験から始めるマッチング営業／歩合制でしっかり稼げる！◆月給25万～／年休121日 求人TOP 求人検索 CSエコー株式会社 【IT営業】＼未経験から始めるマッチング営業／歩合制でしっかり稼げる！◆月給25万～／年休121日 【IT営業】＼未経験から始めるマッチング営業／歩合制でしっかり稼げる！◆月給25万～／年休121日 【インセンティブ制度】 当社では成果に応じたインセンティブ制度を導入しています。 月給25万円～＋歩合 （基本給18万円に加えて一律支給の営業手当7万円＋歩合）,正社員,,求人TOP 求人検索 東京都の求人 豊島区の求人 【IT営業】＼未経験から始めるマッチング営業／歩合制でしっかり稼げる！◆月給25万～／年休121日 求人TOP 求人検索 CSエコー株式会社 【IT営業】＼未経験から始めるマッチング営業／歩合制でしっかり稼げる！◆月給25万～／年休121日 【IT営業】＼未経験から始めるマッチング営業／歩合制でしっかり稼げる！◆月給25万～／年休121日 【インセンティブ制度】 当社では成果に応じたインセンティブ制度を導入しています。 月給25万円～＋歩合 （基本給18万円に加えて一律支給の営業手当7万円＋歩合）,nan,不明,不明,不明,,,なし,未経験可,,,,ハイブリッド,,https://en-gage.net/user/search/desc/14024087/,2026-07-01,phase3_engage,engage
株式会社Ｐ,ｐ,●年収440万円／入社2年目／基本給+ 賞与＆インセンティブ 140万 ●年収540万円／入社5年目／基本給 + 賞与＆インセンティブ 240万 ◇インセンティブ 営業成果に基づいたインセンティブを還元します。営業として出した数値が給与に反映されやすい仕組みになっています。,正社員,,●年収440万円／入社2年目／基本給+ 賞与＆インセンティブ 140万 ●年収540万円／入社5年目／基本給 + 賞与＆インセンティブ 240万 ◇インセンティブ 営業成果に基づいたインセンティブを還元します。営業として出した数値が給与に反映されやすい仕組みになっています。,nan,不明,不明,不明,,,不明,未経験可,,,,ハイブリッド,,https://en-gage.net/user/search/desc/8330626/,2026-07-01,phase3_engage,engage
株式会社の採用・求人情報,の採用求人情報,求人TOP 求人検索 東京都の求人 港区の求人 新卒からIT営業に挑戦！賞与3ヶ月ごと×高インセンティブ。やる気がそのまま収入に反映！ 求人TOP 求人検索 イネーブルメント株式会社 新卒からIT営業に挑戦！賞与3ヶ月ごと×高インセンティブ。やる気がそのまま収入に反映！ 新卒からIT営業に挑戦！賞与3ヶ月ごと×高インセンティブ。やる気がそのまま収入に反映！ 賞与3ヶ月1回、3ヶ月分の報酬、他社より高いインセンティブ、報酬パーセントは面談の時にお伝えいたします。 期間中の成果次第で正社員化（インセンティブ報酬）も検討可能です。 ※従業員規模や組織構造、会社業績によってインセンティブ制度について3,正社員,,求人TOP 求人検索 東京都の求人 港区の求人 新卒からIT営業に挑戦！賞与3ヶ月ごと×高インセンティブ。やる気がそのまま収入に反映！ 求人TOP 求人検索 イネーブルメント株式会社 新卒からIT営業に挑戦！賞与3ヶ月ごと×高インセンティブ。やる気がそのまま収入に反映！ 新卒からIT営業に挑戦！賞与3ヶ月ごと×高インセンティブ。やる気がそのまま収入に反映！ 賞与3ヶ月1回、3ヶ月分の報酬、他社より高いインセンティブ、報酬パーセントは面談の時にお伝えいたします。 期間中の成果次第で正社員化（インセンティブ報酬）も検討可能です。 ※従業員規模や組織構造、会社業績によってインセンティブ制度について3年に1度見直しがございます。,nan,不明,ストック型,不明,,,不明,未経験可,,,,フルリモート,,https://en-gage.net/user/search/desc/12147121/,2026-07-01,phase3_engage,engage
株式会社ハッピーデザイン,ハッピーデザイン,成果に伴い、インセンティブを支給します。 ◇ 営業手当あり（成果に応じたインセンティブ支給）,正社員,,成果に伴い、インセンティブを支給します。 ◇ 営業手当あり（成果に応じたインセンティブ支給）,nan,不明,不明,不明,,,不明,未経験可,,,,ハイブリッド,,https://en-gage.net/user/search/desc/17359589/,2026-07-01,phase3_engage,engage
株式会社Ｄｅｆ,ｄｅｆ,給与：月収27万＋月次歩合＋賞与 入社初年度から月給＋月次歩合で月収40万円以上も無理なく可能です。 キャリアアドバイザー募集！【新規事業展開中！高額インセンティブ】あなたも仲間に入りませんか？,正社員,,給与：月収27万＋月次歩合＋賞与 入社初年度から月給＋月次歩合で月収40万円以上も無理なく可能です。 キャリアアドバイザー募集！【新規事業展開中！高額インセンティブ】あなたも仲間に入りませんか？,nan,不明,不明,不明,,,不明,未経験可,,,,ハイブリッド,,https://en-gage.net/user/search/desc/15051567/,2026-07-01,phase3_engage,engage
株式会社システムイオ,システムイオ,求人TOP 求人検索 東京都の求人 港区の求人 【東京本社】新規クライアントを開拓するなど自由度の高い【ＩＴ営業】インセンティブあり 求人TOP 求人検索 株式会社システムイオ 【東京本社】新規クライアントを開拓するなど自由度の高い【ＩＴ営業】インセンティブあり 【東京本社】新規クライアントを開拓するなど自由度の高い【ＩＴ営業】インセンティブあり,正社員,,求人TOP 求人検索 東京都の求人 港区の求人 【東京本社】新規クライアントを開拓するなど自由度の高い【ＩＴ営業】インセンティブあり 求人TOP 求人検索 株式会社システムイオ 【東京本社】新規クライアントを開拓するなど自由度の高い【ＩＴ営業】インセンティブあり 【東京本社】新規クライアントを開拓するなど自由度の高い【ＩＴ営業】インセンティブあり,nan,不明,不明,不明,,,不明,未経験可,,,,不明,,https://en-gage.net/user/search/desc/2888935/,2026-07-01,phase3_engage,engage
株式会社の,の,＼裁量大×高インセンティブ／住宅ローンの提案営業｜年収1000万円以上可｜成果は青天井｜賞与年3回,正社員,316900,＼裁量大×高インセンティブ／住宅ローンの提案営業｜年収1000万円以上可｜成果は青天井｜賞与年3回,nan,不明,不明,上限なし,,,不明,,,,,ハイブリッド,,https://en-gage.net/user/search/desc/16683981/,2026-07-01,phase3_engage,engage
株式会社の,の,＼裁量大×高インセンティブ／住宅ローンの提案営業｜年収1000万円以上可｜成果は青天井｜賞与年3回,正社員,,＼裁量大×高インセンティブ／住宅ローンの提案営業｜年収1000万円以上可｜成果は青天井｜賞与年3回,nan,不明,不明,上限なし,,,不明,未経験可,,,,不明,,https://en-gage.net/user/search/desc/3614284/,2026-07-01,phase3_engage,engage
株式会社ＳＫＫｎｅｘｔ,ｓｋｋｎｅｘｔ,求人TOP 求人検索 東京都の求人 新宿区の求人 IT営業/インセンティブあり/年間休日120日以上/未経験歓迎 求人TOP 求人検索 株式会社ＳＫＫｎｅｘｔ IT営業/インセンティブあり/年間休日120日以上/未経験歓迎 IT営業/インセンティブあり/年間休日120日以上/未経験歓迎 ◆ インセンティブあり。成果を正しく評価,,,求人TOP 求人検索 東京都の求人 新宿区の求人 IT営業/インセンティブあり/年間休日120日以上/未経験歓迎 求人TOP 求人検索 株式会社ＳＫＫｎｅｘｔ IT営業/インセンティブあり/年間休日120日以上/未経験歓迎 IT営業/インセンティブあり/年間休日120日以上/未経験歓迎 ◆ インセンティブあり。成果を正しく評価,nan,不明,不明,不明,,,不明,未経験可,,,,ハイブリッド,,https://en-gage.net/user/search/desc/15796091/,2026-07-01,phase3_engage,engage
株式会社の,の,＼裁量大×高インセンティブ／住宅ローンの提案営業｜年収1000万円以上可｜成果は青天井｜賞与年3回,正社員,,＼裁量大×高インセンティブ／住宅ローンの提案営業｜年収1000万円以上可｜成果は青天井｜賞与年3回,nan,不明,不明,上限なし,,,不明,未経験可,,,,ハイブリッド,,https://en-gage.net/user/search/desc/8052006/,2026-07-01,phase3_engage,engage
株式会社の採用・求人情報,の採用求人情報,求人TOP 求人検索 東京都の求人 新宿区の求人 IT営業◆特許取得の商品力が強み／AI搭載／未経験からも売れる／残業なし／インセンティブ充実 求人TOP 求人検索 JetB株式会社 IT営業◆特許取得の商品力が強み／AI搭載／未経験からも売れる／残業なし／インセンティブ充実 IT営業◆特許取得の商品力が強み／AI搭載／未経験からも売れる／残業なし／インセンティブ充実 ・成果を正当に評価し、給与や昇格で還元してくれる会社で活躍したいという方 月給30万円～+インセンティブ ※インセンティブ1件あたり1.5万～5万円（成約件数により1件あたりのインセンティブ上昇）。 月給30万円 +インセンティ,正社員,,求人TOP 求人検索 東京都の求人 新宿区の求人 IT営業◆特許取得の商品力が強み／AI搭載／未経験からも売れる／残業なし／インセンティブ充実 求人TOP 求人検索 JetB株式会社 IT営業◆特許取得の商品力が強み／AI搭載／未経験からも売れる／残業なし／インセンティブ充実 IT営業◆特許取得の商品力が強み／AI搭載／未経験からも売れる／残業なし／インセンティブ充実 ・成果を正当に評価し、給与や昇格で還元してくれる会社で活躍したいという方 月給30万円～+インセンティブ ※インセンティブ1件あたり1.5万～5万円（成約件数により1件あたりのインセンティブ上昇）。 月給30万円 +インセンティブ,nan,不明,フロー型,不明,,,不明,未経験可,,,,ハイブリッド,,https://en-gage.net/user/search/desc/6767866/,2026-07-01,phase3_engage,engage
株式会社ＮｅｔＦｉｌｅ,ｎｅｔｆｉｌｅ,求人TOP 求人検索 神奈川県の求人 横浜市の求人 中区の求人 【IT営業】営業職募集/経験者や未経験も大歓迎/インセンティブで高還元！！ 求人TOP 求人検索 株式会社ＮｅｔＦｉｌｅ 【IT営業】営業職募集/経験者や未経験も大歓迎/インセンティブで高還元！！ 【IT営業】営業職募集/経験者や未経験も大歓迎/インセンティブで高還元！！ ■━ インセンティブ ━■ 業界内でインセンティブの還元率は非常に高く、 業界内でインセンティブの還元率は非常に高い水準になっております。 ◇高水準のインセンティブ還元率を求めている方,正社員,,求人TOP 求人検索 神奈川県の求人 横浜市の求人 中区の求人 【IT営業】営業職募集/経験者や未経験も大歓迎/インセンティブで高還元！！ 求人TOP 求人検索 株式会社ＮｅｔＦｉｌｅ 【IT営業】営業職募集/経験者や未経験も大歓迎/インセンティブで高還元！！ 【IT営業】営業職募集/経験者や未経験も大歓迎/インセンティブで高還元！！ ■━ インセンティブ ━■ 業界内でインセンティブの還元率は非常に高く、 業界内でインセンティブの還元率は非常に高い水準になっております。 ◇高水準のインセンティブ還元率を求めている方,nan,不明,不明,不明,,,不明,未経験可,,,,不明,,https://en-gage.net/user/search/desc/8819484/,2026-07-01,phase3_engage,engage
株式会社SEシェア,seシェア,◎今後、給与制度なども変革し、インセンティブ制度なども構築したいと考えています。給与に関する提案や交渉なども歓迎です！ キャリアアドバイザー募集【新規事業展開中！高額インセンティブ】あなたも仲間に入りませんか？,正社員,,◎今後、給与制度なども変革し、インセンティブ制度なども構築したいと考えています。給与に関する提案や交渉なども歓迎です！ キャリアアドバイザー募集【新規事業展開中！高額インセンティブ】あなたも仲間に入りませんか？,nan,不明,不明,不明,,,不明,未経験可,,,,ハイブリッド,,https://en-gage.net/user/search/desc/11902102/,2026-07-01,phase3_engage,engage
合同会社コアアクシス,コアアクシス,求人TOP 求人検索 東京都の求人 品川区の求人 【法人営業】企業のDXや課題解決を叶えるITセールス！★インセンティブあり／リモート可 求人TOP 求人検索 合同会社コアアクシス 【法人営業】企業のDXや課題解決を叶えるITセールス！★インセンティブあり／リモート可 【法人営業】企業のDXや課題解決を叶えるITセールス！★インセンティブあり／リモート可 インセンティブ制度あり,正社員,,求人TOP 求人検索 東京都の求人 品川区の求人 【法人営業】企業のDXや課題解決を叶えるITセールス！★インセンティブあり／リモート可 求人TOP 求人検索 合同会社コアアクシス 【法人営業】企業のDXや課題解決を叶えるITセールス！★インセンティブあり／リモート可 【法人営業】企業のDXや課題解決を叶えるITセールス！★インセンティブあり／リモート可 インセンティブ制度あり,nan,不明,不明,不明,,,不明,未経験可,,,,ハイブリッド,,https://en-gage.net/user/search/desc/17329422/,2026-07-01,phase3_engage,engage
株式会社ベオスアイティーホールディングス,ベオスアイティーホールディングス,求人TOP 求人検索 東京都の求人 新宿区の求人 IT営業 ★未経験歓迎｜月給25万円以上｜高水準のインセンティブ制度あり｜営業の平均月収75万円！ 求人TOP 求人検索 株式会社ベオスアイティーホールディングス IT営業 ★未経験歓迎｜月給25万円以上｜高水準のインセンティブ制度あり｜営業の平均月収75万円！ IT営業 ★未経験歓迎｜月給25万円以上｜高水準のインセンティブ制度あり｜営業の平均月収75万円！ ★成果に応じたインセンティブ ●年収870万円／入社3年目／月給65万円＋インセンティブ＋賞与 ※別途インセンティブ有 ■報奨金（インセンティブ）,正社員,,求人TOP 求人検索 東京都の求人 新宿区の求人 IT営業 ★未経験歓迎｜月給25万円以上｜高水準のインセンティブ制度あり｜営業の平均月収75万円！ 求人TOP 求人検索 株式会社ベオスアイティーホールディングス IT営業 ★未経験歓迎｜月給25万円以上｜高水準のインセンティブ制度あり｜営業の平均月収75万円！ IT営業 ★未経験歓迎｜月給25万円以上｜高水準のインセンティブ制度あり｜営業の平均月収75万円！ ★成果に応じたインセンティブ ●年収870万円／入社3年目／月給65万円＋インセンティブ＋賞与 ※別途インセンティブ有 ■報奨金（インセンティブ）,nan,不明,フロー型,不明,,,不明,未経験可,,,,ハイブリッド,,https://en-gage.net/user/search/desc/15426020/,2026-07-01,phase3_engage,engage
株式会社MagicPlus,magicplus,求人TOP 求人検索 東京都の求人 千代田区の求人 経験者歓迎！都内でのIT営業急募！基本給とは別にインセンティブのプラス有！！年収1000万円以上も可 求人TOP 求人検索 株式会社MagicPlus 経験者歓迎！都内でのIT営業急募！基本給とは別にインセンティブのプラス有！！年収1000万円以上も可 経験者歓迎！都内でのIT営業急募！基本給とは別にインセンティブのプラス有！！年収1000万円以上も可 ＊営業職務手当有：案件・売上金額によって歩合報酬を加算します!,正社員,,求人TOP 求人検索 東京都の求人 千代田区の求人 経験者歓迎！都内でのIT営業急募！基本給とは別にインセンティブのプラス有！！年収1000万円以上も可 求人TOP 求人検索 株式会社MagicPlus 経験者歓迎！都内でのIT営業急募！基本給とは別にインセンティブのプラス有！！年収1000万円以上も可 経験者歓迎！都内でのIT営業急募！基本給とは別にインセンティブのプラス有！！年収1000万円以上も可 ＊営業職務手当有：案件・売上金額によって歩合報酬を加算します!,nan,不明,不明,不明,,,不明,未経験可,,,,ハイブリッド,,https://en-gage.net/user/search/desc/15169888/,2026-07-01,phase3_engage,engage
株式会社エヌエム・ヒューマテック,エヌエムヒューマテック,＼裁量大×高インセンティブ／住宅ローンの提案営業｜年収1000万円以上可｜成果は青天井｜賞与年3回,正社員,,＼裁量大×高インセンティブ／住宅ローンの提案営業｜年収1000万円以上可｜成果は青天井｜賞与年3回,nan,不明,不明,上限なし,,,不明,未経験可,,,,ハイブリッド,,https://en-gage.net/user/search/desc/5620668/,2026-07-01,phase3_engage,engage
株式会社アイビネット,アイビネット,当社のインセンティブは、営業利益の《20％》を支給！ 社員の中にはインセンティブだけで 頑張った分はしっかりと還元されるため、 ★売上の20％をインセンティブとして還元 1契約で数ヶ月間はコンスタントにインセンティブ発生 「インセンティブ率が高くて嬉しい。それだけで月50万円以上稼ぐ先輩も！」（26歳／元工場スタッフ・入社1年目） そして成果が出たら、インセンティブはチームで山分け！最初から稼ぎやすい環境です。 入社半年後に、全員が月給3万円UP！さらに、先ほど紹介した「チーム制」のおかげで、平均月15万円以上、2年目にはほとんどの人が毎月10万円以上のインセンティブを獲得しています。 つまり,正社員,,当社のインセンティブは、営業利益の《20％》を支給！ 社員の中にはインセンティブだけで 頑張った分はしっかりと還元されるため、 ★売上の20％をインセンティブとして還元 1契約で数ヶ月間はコンスタントにインセンティブ発生 「インセンティブ率が高くて嬉しい。それだけで月50万円以上稼ぐ先輩も！」（26歳／元工場スタッフ・入社1年目） そして成果が出たら、インセンティブはチームで山分け！最初から稼ぎやすい環境です。 入社半年後に、全員が月給3万円UP！さらに、先ほど紹介した「チーム制」のおかげで、平均月15万円以上、2年目にはほとんどの人が毎月10万円以上のインセンティブを獲得しています。 つまり2年目には、月給28万円＋インセンティブ15万円＋諸手当＝月収40万円以上が叶うということ。頑張った結果が「収入」という目に見える形で返ってくるので、ずっとモチベーション高く働けます！,nan,不明,不明,不明,,,なし,未経験可,,,,フルリモート,,https://en-gage.net/user/search/desc/12436240/,2026-07-01,phase3_engage,engage
株式会社TBTソリューションズ,tbtソリューションズ,＼裁量大×高インセンティブ／住宅ローンの提案営業｜年収1000万円以上可｜成果は青天井｜賞与年3回,正社員,,＼裁量大×高インセンティブ／住宅ローンの提案営業｜年収1000万円以上可｜成果は青天井｜賞与年3回,nan,不明,不明,上限なし,,,不明,未経験可,,,,ハイブリッド,,https://en-gage.net/user/search/desc/10622395/,2026-07-01,phase3_engage,engage
株式会社トラストアンドテクノロジー,トラストアンドテクノロジー,キャリアアドバイザー募集【新規事業展開中！高額インセンティブ】あなたも仲間に入りませんか？,正社員,,キャリアアドバイザー募集【新規事業展開中！高額インセンティブ】あなたも仲間に入りませんか？,nan,不明,不明,不明,,,不明,未経験可,,,,ハイブリッド,,https://en-gage.net/user/search/desc/16229739/,2026-07-01,phase3_engage,engage
