company,contact_name,email,type,memo,industry_status
株式会社ダートフィッシュ・ジャパン,,,,事務所移転：千代田区,review
株式会社サクラ情報システム,,,,38,include
東都テレコム株式会社,,info@touto-telecom.co.jp,,,review
株式会社ティー・アンド・ユー,,,,,review
ユニリンク株式会社,,,,63,review
株式会社サンメディア,,info@smedia.co.jp,,76,review
株式会社サンライズ・テクノロジー,,,,,include
ユーロテック情報システム販売株式会社,,,,78,include
株式会社テック・エス・シー,,info_tsc@tech-sc.co.jp,,,review
株式会社ジィック,,,,43,review
総合情報開発株式会社,,,,,include
株式会社デジタルライン,,,,,include
株式会社デジタルライン,,,,12,include
株式会社ユニバーサルコンピュータサービス,,,,,include
株式会社ねこねこエンジニアリング,,,,,include
株式会社エヌネットワーク,,,,,include
株式会社エヌ・アイ・エス,,,,3,review
株式会社ワイヤレスジャパン,,info@rwj.co.jp,,,review
株式会社クリアス・テクノロジー,,,,twitter,include
株式会社ワイドテック,,,,,review
株式会社グレープ・ワン,,,,,review
株式会社スタッフ東京支社,,,,,review
株式会社オープングルーヴ,,,,21,review
株式会社地球健康クラブ,,,,,review
株式会社地球健康クラブ,,,,,review
ティ・エフ・ダブル　ジャパン株式会社,,,,問い合わせフォーム反応なし,review
セットワークス株式会社,,,,,review
ブライテクノ株式会社,,,,電話・メールのみ,include
株式会社クリスチャントゥデイ,,,,宗教関係,review
株式会社興和システムサービス,,,,,include
株式会社LCL,,hr_japan@lclsystem.com,,24,review
株式会社aimot,,,,,review
株式会社エーピーエス,,,,2023/05/08,review
株式会社シティリバース,,,,2021/10/20　　27,review
株式会社エーピーエス,,,,,review
株式会社ハイスポット,,,,,review
株式会社そふと屋,,,,,review
デマンドリンク株式会社,,,,,review
株式会社セキュアスカイ・テクノロジー,,,,,include
株式会社コネクティル,,,,117,review
株式会社アディット,,soumu.info.2022@addit.jp,,67,review
株式会社ティー・シー・エフ,,,,,review
エル・エス・アイジャパン株式会社,,,,110,review
ピットクルー株式会社,,,SES,拒否,review
株式会社マッシュマトリックス,,,,,review
株式会社AEVIC,,,,2023/05/09,review
セントラルソフト株式会社,,,,4/22,include
株式会社アールブリッジ,,,,117,review
ルネット有限会社,,,,19,review
Team_K株式会社,,,,,review
ミクウガジャパン株式会社,,,,,review
ミタカ通信株式会社,,info@mitaka-com.co.jp,,mail　5/2,review
株式会社DistantViewPlus,,,,8/3(月)13:30~,review
株式会社ディスタント・ビュー,,,,24,review
株式会社ユキリエ,,,,,review
株式会社センシズ,,,,,review
株式会社翔洋,,,,2/7,review
株式会社エレム,,,,,review
株式会社ソフトウェアセンター,,,,,include
RIKAI株式会社,,contact@rikai.technology,,4/4,include
RIKAI株式会社,,,,,include
ナビオコンピュータ株式会社,,,,,include
株式会社つり情報社,,,,,include
株式会社つり情報社,,,,,include
株式会社メディアコンピューターシステムズ,,,,,include
ウェイアップシステム株式会社,,,,,include
株式会社フジソフトラボ,,kb_jinji@fujisoftlabo.co.jp,,電話・メールのみ,include
株式会社アイエスアール,,,,メール済,review
株式会社ネットユーコム,,,,2,review
有限会社ラング・エッジ,,contact@langedge.jp,,,review
愛立瑞株式会社,,,,,review
株式会社ネットコンピュータ研究所,,,,HPなし,include
株式会社空ネット,,,,,review
株式会社パワーウェイ,,,,HPなし,review
株式会社ジーエフイー,,,,7,review
株式会社ウィザー綜研,,,,,review
株式会社サイクス,,info@sics-inc.jp,,114,review
ビスタシステムズ株式会社,,,,リンクなし,include
株式会社コスメディア,,,,22　問い合わせフォーム・メールアドレスなし,review
株式会社光和コンピューター,,,,,include
株式会社ベーシックシステム,,,,35,include
株式会社ステッピングストーンズ,,info@s-ss.co.jp,,150,review
株式会社アイ・エイ・シイ,,,,2023/05/09,review
株式会社バックス,,saiyo@buk.co.jp,,,review
株式会社ディア・ワークス,,,,,review
株式会社プレジャ,,,,2023/4/24,review
株式会社プロトソフト,,,,56,include
日本ビジコム株式会社,,,,,review
株式会社アイレックス・ジャパン,,,,,review
株式会社ハブロッツ,,,,,review
キャリアネットオークション株式会社,,,,リンク切れ,review
株式会社L is B,,,,拒否,review
エフサステクノロジーズ東日本株式会社,,,,117,include
株式会社ウェルネット,,,,メール済,review
コムサクシード株式会社,,,,担当不在,review
グローススクウェア株式会社,,,,塩対応,review
GrowtheSquare株式会社,,,,2023/05/10,review
株式会社クリソフト,,info@cresoft.co.jp,,メールのみ,include
株式会社セブントラスト,,recruit@seventrust.co.jp,,,review
コンポーネントデザイン株式会社,,,,146,review
有限会社アイリスサービス,,,,,review
ゼロプライド株式会社,,,,,review
株式会社ディー・トレンド・ジャパン,,,,25,review
株式会社イワタ,,,,42,review
ユーアイソフト株式会社,,info@youisoft.jp,,81,include
株式会社エム・クレスト,,Info-m@m-crest.co.jp,,21,review
株式会社ビジネスビジョン,,inquiry@b-vision.co.jp,,,review
LYC株式会社,,eigyou@lyc.co.jp,,mail 4/3,review
株式会社フューチャーコネクション,,,,40,review
リンクラフト株式会社,,,,5/7,review
株式会社サクセスプラン,,,,47,review
株式会社コンセプトアンドデザイン,,,,36,review
合同会社ミルディア,,,,2/8,review
株式会社カレイドスコープ,,,,リンク切れ,review
智源株式会社,,,,,review
株式会社シーアイシー,,business@ci-corp.jp,,32,review
オブザーブ株式会社,,,,,review
株式会社ハンドワークス,,,,,review
株式会社シジスカイ,,,,,review
株式会社Q&Qビジネスパートナーズ,,,,35,review
データトレック株式会社,,,,,include
株式会社アクティブ・ワーク,,,,担当不在：再度連絡,review
株式会社ドゥファイン,,,,,review
株式会社JFS,,,,122,review
株式会社AUG,,,,5/12,review
株式会社プロシステム,,,,73,include
HeligateJapan合同会社,,sales@heligate.co.jp,,4/2,review
株式会社with-net,,info@with-net.tokyo,,126,review
CSUNPOWERジャパンテクノロジー株式会社,,,,,include
株式会社GORACREW,,,,39,review
株式会社コラビー,,,,,review
ターボシステムズ株式会社,,,,4/22,include
株式会社プラスフォーユー,,,,95,review
株式会社ティ・アンド・エム,,,,40,review
株式会社システムエッジ,,,,84,include
株式会社リンコム,,,,,review
Trigger株式会社,,sales@trigger4.com,,,review
Growfit株式会社,,,,Twitter,review
株式会社ライズインフォメーション,,,,,review
インユニゾン株式会社,,inquiry@inunison.co.jp,,リンク切れ,review
エンコムウェア株式会社,,,,開発しかやっていない,include
株式会社スペースサービス,,,,129,review
株式会社ＢＯＯＳＴＲＹ,,,,,review
株式会社インビリティー,,,,メール済,review
株式会社セプト,,,,Twitter,review
株式会社マネジメント・ジャパン,,,,24,review
株式会社エーアイスクエア,,,,,review
株式会社セプト,,,,,review
フジ・コンピューター・サイエンス株式会社,,contact@fuji-com.co.jp,,mail　5/1,include
智源株式会社,,toiawase@sowinfo.co.jp,,電話・メールのみ,review
株式会社ジェイシイエル,,,,121,review
株式会社ヨキリコジャパン,,,,,review
株式会社ヴィバーク,,,,118,review
株式会社潤滑通信社,,,,,review
株式会社　潤滑通信社,,lub@juntsu.co.jp,,mail　5/12,review
株式会社環境シミュレーション,,info_e-sim@env-simulation.com,,,review
株式会社NAP,,yangxu@nap-japan.net,,112,review
"株式会社ライブネス(liveness,Inc.)",,,,,review
株式会社ライブネス,,,,,review
株式会社BOOSTRY,,,,5/14,review
株式会社テトラシステムデザイン,,,,107,include
株式会社アドバンスト_インテリジェント_サービス,,,,,review
日本ビジコム株式会社,,,,1/28,review
富士通エフサス東日本カスタマサービス株式会社,,,,,review
株式会社情報処理システム研究所,,,,64,include
株式会社ジョインフォース,,info@joinforce.co.jp,,109,review
環境ライフテクノロジー株式会社,,,,問い合わせフォームなし,include
株式会社モバイルインターネットテクノロジー,,,,,include
株式会社ヒューマネージ,,,,,review
ヤフー株式会社,,,,,review
スポーツナビ株式会社,,,,,review
株式会社一休,,,,,review
LINEヤフー株式会社,,,,,review
ダイナテック株式会社,,,,,review
株式会社フォース・スペース,,,,,review
アイティメディア株式会社,,,,,review
株式会社パピレス,,,,,review
発注ナビ株式会社,,,,mail 1/21,review
アイティメディア株式会社,,,,4/9,review
株式会社アンドテック,,,,再度連絡,review
株式会社創新ラボ,,info@soushin-lab.co.jp,,43,review
株式会社人財ラボ,,,,,review
アースインターシステムズ株式会社,,,,,include
株式会社セキュアブレイン,,,,,review
株式会社アンドテック,,,,,review
株式会社ファイブ・ディグリーズ,,,,,review
株式会社キュービックス,,,,,review
株式会社クオリクス,,,,リンクなし,review
株式会社イーウェル,,,,56,review
有限会社コアプラネット,,,,,review
株式会社eヘルスケア,,,,5/15,review
株式会社ロボカル,,,,,review
エコナビスタ株式会社,,,,4/14,review
株式会社ココペリ,,,,37,review
株式会社WHERE,,,,14,review
株式会社エッセンシャル,,,,問い合わせフォームなし,review
株式会社センチュリーシステムズ,,,,146,include
株式会社アライアンスグループ,,,,,review
株式会社アドイン研究所,,,,56,review
ランスタッド株式会社,,,,,review
株式会社リンクアンドコミュニケーション,,,,,review
株式会社フーバーブレイン,,,,,review
株式会社ニーズウェル,,,,,review
東京システム開発株式会社,,,,2/3,include
株式会社アジェンテ,,,,41,review
株式会社リンクスアンドコミュニケーション,,,,,review
株式会社ライフ技術研究所,,,,HPなし,review
ソフィアメディカルインフォ株式会社,,,,電話・メールのみ,review
株式会社SY総合研究所,,,,69,review
株式会社lord,,,,,review
株式会社ステラリンク,,,,144,review
日本電子計算株式会社,,,,,review
株式会社ナビット,,,,,review
バリューネットワークス株式会社,,vnc-inq@v-networks.co.jp,,mail　4/30,include
マザーファースト株式会社,,,,,review
カラーズ2株式会社,,,,リンク切れ,review
進歩技研有限会社,,,,,review
株式会社フェニックステクノロジー,,,,,include
株式会社ジャパン・カレント,,,,147,review
株式会社SPJ,,,,114,review
デザイニック株式会社,,,,,review
エムシーエス株式会社,,info@mcscorp.co.jp,,,review
株式会社災害対応システム開発,,,,,include
株式会社ホット・ウイングス,,,,メール済み,review
株式会社プライムセオリー,,info@primetheory.jp,,18,review
株式会社Pikawaka,,,,,review
クロスソル株式会社,,,,27,review
Generipse合同会社,,,,,review
FastFront（ファストフロント）株式会社,,,,4/2,review
株式会社GeekBridge,,,,5/15,review
株式会社EAPJAPAN,,,,,review
有限会社アイリアル,,,,,review
株式会社タベッタ,,,,,review
株式会社SOstyling,,,,,review
株式会社ジョイント,,,,112,review
カラーズ２株式会社,,,,リンク切れ,review
株式会社エッグル,,,,,review
株式会社ＧｅｅｋＢｒｉｄｇｅ,,,,,review
フィットアプリケーション株式会社,,,,HPなし,review
デジストラコンサルティング株式会社,,info@digistr.co.jp,,113,review
有限会社イー・エイド,,info@eaid.jp,,,review
株式会社ファイブアイ,,,,30,review
株式会社クオータシステム,,info@quotasystem.net,,電話・メールのみ,include
株式会社CODE_COMPANY,,,,5/14,review
GOJU株式会社,,,,,review
株式会社ヒートビート,,,,,review
お茶の水ウェルズ家庭教師センターグループ,,info@wells-inc.co.jp,,,review
株式会社拓,,,,,review
ソシオプラス株式会社,,,,4/22,review
ジェイスカイ株式会社,,,,HPなし,review
ドレッドノート株式会社,,,,88,review
株式会社ケーアンドエス,,info@kemu-sys.com,,38,review
昭和システム開発株式会社,,,,,include
ゼネラル・ビジネス・サービス 株式会社,,,,16時までに電話,review
Talknote株式会社,,,,4/7,review
株式会社JSOL,,,,,review
株式会社レミシー,,,,,review
株式会社サイト・パブリス,,,,,review
株式会社ヒートビート,,,,,review
株式会社タベッタ,,,,5,review
アルゴ・プロダクツ株式会社,,,,,review
株式会社サンテメディカルソリューションズ,,,,89,review
株式会社アップフィールズ,,,,,review
クレッシー株式会社,,,,4/17,review
AcrossOver合同会社,,,,問い合わせ済み(１回),review
株式会社TORICO,,,,,review
ミノー株式会社,,,,,review
株式会社セミナーインフォ,,,,31,review
株式会社セミナーインフォ,,,,,review
3Aスポーツ株式会社,,,,問い合わせ済み(１回),review
株式会社アルゴ,,,,28,review
株式会社日本クラウディア,,,,,review
株式会社日本クラウディア,,,,24,review
NSK株式会社,,,,4/4,review
NSK株式会社,,,,,review
株式会社アフタータイム,,,,112,review
株式会社ケイ・アイ・エス・エス,,inquiry@kiss21.co.jp,,4　背品に関する問い合わせのみ,review
株式会社CRUDIST,,info@crudist.jp,,mail 5/15,review
株式会社CCG　WORKING　HEADS,,,,5/14,review
アートソフト株式会社,,,,HPなし,include
株式会社アライアンス,,,,メール,review
株式会社プロトシステム,,,,57,include
株式会社ジョイテック,,,,114,review
株式会社国際疾病管理研究所,,,,,review
株式会社ファインビズ,,info-f@finebiz.jp,,21,review
株式会社ヒューマニクス,,,,64,review
ユニバースケープ株式会社,,,,5/7,review
日本コンピューターテクノス株式会社,,,,,include
株式会社フォトメ,,,,,review
株式会社ホロニックス,,,,60,review
株式会社シニア経理財務,,,,,review
アルカディア・システムズ株式会社,,,,15時ごろに担当の打ち合わせが終わる,include
株式会社J-TEC,,,,21,review
株式会社ジーエイシージャパン,,,,15,review
株式会社ファーストウェア,,,,37,review
株式会社サイエンスリサーチアンドコンサルティング,,,,115,review
マグマックス株式会社,,,,,review
KDDIデジタルセキュリティ株式会社,,,,,include
株式会社ナムザック・ジャパン,,nj_support@namzak.co.jp,,メールのみ,review
株式会社花省,,,,,review
株式会社エーラボ,,,,96,review
株式会社ジェルシステム,,,,,include
C2C_Platform株式会社,,,,問い合わせ済み(１回),review
有限会社フウズラボ,,,,mail 1/13,review
株式会社アイリス,,,,,review
株式会社GrowEgg,,,SES,,review
株式会社シーシーアール,,,,117,review
株式会社アイネスリレーションズ,,,,67,review
株式会社KDS,,,,拒否,review
株式会社アークシステム技研,,,,電話のみ,include
システムセンス株式会社,,,,,include
株式会社多田経営研究所,,,,,review
株式会社アスク,,,,14,review
株式会社フルイヤーマーケティング,,,,,review
株式会社クランタス,,,,,review
株式会社ルーシップ,,,,,review
株式会社ゲームアディクト,,,,,review
株式会社ティージーエス,,,,,review
株式会社INSPION,,,,営業NG,review
株式会社ユーシス,,,,74,review
株式会社ルーシップ,,,,43,review
JIPテクノサイエンス株式会社,,,,4/3,include
株式会社ソフトフロントジャパン,,,,87,include
雪瓦合同会社,,contact@snowtiles-sw.co.jp,,営業NG,review
株式会社てんとうむし,,,,,review
株式会社てんとうむし,,,,,review
株式会社キュア,,,,,review
株式会社UWAM,,,,65,review
株式会社UWAM,,,,,review
株式会社ReChain,,,,123,review
ノグワークス株式会社,,info@nog-works.com,,mail　4/30,review
クレアティー・サービス株式会社,,,,,review
エフ・プラネット株式会社,,,,mail 4/15,review
エフ・プラット株式会社,,,,mail 4/15,review
ドーンコーラス合同会社,,support@dawnchorus.co.jp,,4/30,review
ジェイサート株式会社,,,,4/21,review
PAIR株式会社,,support@pair-ai.com,,,include
PAIR株式会社,,,,リンク切れ,include
アルフレッサメディカルサービス株式会社,,,,4/10,review
株式会社ステラ・テクノロジー,,info@stella-tech.co.jp,,,include
日本データネットコミュニケーションズ株式会社,,,,,include
FIコンサルティング株式会社,,info@ficonsul.com,,電話・メールのみ,review
有限会社クリエイティブ・ビジョン,,cvmail@cv-net.co.jp,,電話・メールのみ,review
株式会社ＵＢＧ,,,,94、電話のみ,review
株式会社テリロジーワークス,,,,,review
株式会社アドベンテック,,,,担当不在：メール済,review
株式会社サンケイソフテックス,,soumu@sankei-softex.jp,,104,review
株式会社SYNCHRO,,,,78,review
VTVジャパン株式会社,,,,4/8,review
株式会社カントー,,,,製品にする問い合わせのみ,review
株式会社リンクトゥモロー,,,,,review
株式会社マイティテクノ,,,,,include
株式会社ジョルテ,,,,,review
株式会社イベントバンク,,,,55,review
株式会社イベントバンク,,,,,review
株式会社コムソフト,,,,86,include
KDDIデジタルデザイン株式会社,,,,,include
三菱電機エンジニアリング株式会社,,,,,include
ブレインセラーズ・ドットコム株式会社,,,,,review
株式会社テリロジーホールディングス,,,,,review
ソシオネット株式会社,,,,繫がらず,review
株式会社アブソリューション,,,,2023/05/09,review
ファンテック株式会社,,webmaster@funtech.co.jp,,mail　5/1,review
株式会社FIT's,,,,5/15,include
株式会社エヌ・ケイ・システム,,info_n@nksystem.net.,,124,include
FutureRays株式会社,,,,,review
株式会社リクルートカーセンサー,,,,,review
株式会社ジェニュイン,,,,河合アポ済,review
株式会社あまなつ,,,,77,review
株式会社ジェニュイン,,,,,review
株式会社アンヴィル,,,,,review
株式会社アンヴィル,,,,メール済み,review
株式会社イーサーブ,,,,41,review
株式会社イーサーブ,,,,,review
株式会社イーサーブ,,,,,review
株式会社メディア・ラウンジ,,,,43,review
株式会社メディア・ラウンジ,,,,,review
スポットツアー株式会社,,,,,review
スポットツアー株式会社,,,,,review
株式会社テン・クラフト,,,,94,review
ゲルヒン株式会社,,,,,review
グルーヴ・ギア株式会社,,,,折り返し待ち,review
インターリンク株式会社,,,,twitter,review
株式会社ＲＮＡコンサルティング,,,,,review
ネットストリーム株式会社,,,,,review
株式会社MIRACREW,,,,34,review
日本システムクリエータ株式会社,,,,1/29,include
株式会社情報ネットワーククリエイト,,,,69,include
フォージビジョン株式会社,,,,113,review
フォージビジョン株式会社,,,,,review
シャーク・デザイナー株式会社,,,,,review
株式会社バラックス,,,,Twitter,review
株式会社京浜データプロセス,,,,,include
有限会社スターブライト,,,,mail 1/15,review
株式会社ミンカブ・ジ・インフォノイド,,,,,review
PropTechplus株式会社,,,,,review
株式会社マイクログローブ,,,,,review
株式会社丹青ヒューマネット,,,,,review
株式会社エルスデータ,,marketing@elsedata.co.jp,,77,include
株式会社ATHENA,,,,,review
ジーアンドジープランニング株式会社,,contact@ggp.co.jp,,mail 4/18,review
コムソフト株式会社,,,,4/17,include
株式会社三木森,,,,,review
株式会社リクルートカーセンサー,,,,,review
株式会社リクルートカーセンサー,,,,,review
株式会社ファンクリエイト,,,,12,review
株式会社R102,,,,17,review
株式会社クート,,info@coot.co.jp,,メールのみ,review
株式会社Finatextホールディングス,,,,5/15,review
株式会社Finatextホールディングス,,,,5/15,review
株式会社KICOシステムズ,,,,,include
徳和CALS株式会社,,tokyo@tokuwa.co.jp,,電話・メールのみ,review
株式会社SOZO,,,,,review
株式会社セキュリティソフトウェア,,,,61,include
株式会社デジタルイノベーションイニシアティブ,,,,,include
株式会社デジタルイノベーションイニシアティブ,,,,28,include
株式会社ユニコ・ジャパン・インターナショナル,,,,,review
システムアーク株式会社,,soumu@sys-ark.co.jp,,mail　4/21,include
株式会社オンリー・ワン,,,,転職・派遣関係　問い合わせフォーム・メールアドレスなし,review
シナジーマーケティング株式会社,,,,繋がらず：番号なし,review
イーディーコントライブ株式会社,,,,,review
株式会社DECO,,,,5/15,review
株式会社DECO,,,,5/15,review
株式会社STRASSE,,,,95,review
オフィスコム株式会社,,ocprivacy@officecom.co.jp,,4/15,review
株式会社バスクリン,,,,,review
株式会社ATJC,,,,,review
株式会社SIG,,,,メール済,review
株式会社ITPM,,,,,include
株式会社システムサイエンス研究所,,info@ms.sylc.co.jp,,74,include
株式会社イーエムエス,,info@ems-to.jp,,49,review
orosy株式会社,,info@orosy.com,,mail 4/4,review
orosy株式会社,,,,,review
株式会社ヴォーグ,,,,,review
アイソフト株式会社,,,,リンク切れ,include
出版技研株式会社,,mail@shuppan-giken.co.jp,,電話・メールのみ,review
シナジー・ソリューションズ株式会社,,,,76,review
JBTV株式会社,,,,4/3,review
株式会社インフォメーション・ディベロプメント,,,,,review
株式会社IDホールディングス,,,,,review
株式会社IDホールディングス,,,,,review
エバーネットデータ株式会社,,,,,include
中日本システム設計株式会社,,info@nsst.co.jp,,,include
ATLinkage株式会社,,,,下記とい同じ,review
ATLinkage株式会社,,,,問い合わせ済み(１回),review
株式会社ブックウォーカー,,,,,review
株式会社アーク情報システム,,,,,include
株式会社アコーズ,,,,15時半担当が戻ってくる,review
株式会社システムパートナー,,,,59,include
ワールドトレーディング株式会社,,,,,review
株式会社ＯＡＧコンサルティング,,,,32,review
株式会社axxe,,,,,review
株式会社ジー・コード,,,,HPなし　株式会社エフ・コードの子会社,review
株式会社souco,,,,123,review
株式会社souco,,,,,review
株式会社ワークスアプリケーションズ・フロンティア,,,,,review
スケーラブルシステムズ株式会社,,,,4/21,include
株式会社Provigent,,,,47,review
バルテス・モバイルテクノロジー株式会社,,,,派遣免許取得後連絡,include
ダイソン株式会社,,,,,review
株式会社ティー・エル・エー,,,,,review
株式会社ティー・エル・エー,,,,,review
株式会社グッドマンサービス,,,,リゾート関係,review
建美家株式会社,,,,,review
健美家株式会社,,,,,review
株式会社LIFULLsenior,,,,8,review
株式会社LIFULLsenior,,,,,review
株式会社LIFULL,,,,9,review
株式会社LIFULL,,,,,review
株式会社dreamstock,,,,,review
株式会社コムウェイ,,,,河合アポ済,review
株式会社イノウ,,,,68,review
株式会社イノウ,,,,,review
バルテス株式会社,,,,,review
麹町パートナーズ株式会社,,,,,review
麹町パートナーズ株式会社,,,,2/8,review
株式会社アイロバ,,,,,review
株式会社アイロバ,,,,,review
コグニザントジャパン株式会社,,,,,review
株式会社チエ・オプティマム・ソリューションズ,,,,,review
株式会社Mi6,,,,43,review
株式会社ビットオン,,,,,review
有限会社ルートライン,,,,mail 1/9,review
ベビカム株式会社,,,,,review
ベビカム株式会社,,,,,review
株式会社エイチケー・アソシエーツ,,,,,review
株式会社ホワイトDB,,,,,review
株式会社ホワイトDB,,,,,review
株式会社Mi6,,,,,review
株式会社ユーショップデジタルリンク,,,,,include
エイシーティ株式会社,,,,,review
株式会社ウェブエイト,,,,63,review
株式会社ウェブエイト,,,,,review
株式会社プレイヤーネットワークシステムズ,,,,16,include
株式会社プレイヤーズネットワークシステムズ,,,,17,include
インターブレーン株式会社,,info@interbrn.com,,4/11,review
株式会社シムサム・メディア,,,,14,review
株式会社シムサム・メディア,,,,5/8,review
