company,contact_name,email,type,memo,industry_status
株式会社アイエスティー,,,,42,review
株式会社リライアブル,,info@reliable-japan.jp,,,review
株式会社アズム,,,,118,review
55株式会社,,,,,review
薬学生タイムズ株式会社,,,,,review
株式会社タスケ,,,,20,review
株式会社食レコ,,,,,review
薬学性タイムズ株式会社,,,,,review
株式会社FRINGE,,,,不在,review
株式会社ヴァーチュオーゾ,,,,34,review
株式会社デルタプラス,,,,,review
株式会社LifeBox,,,,11,review
株式会社てへぺろ,,,,105,review
株式会社トリトメ,,,,48,review
株式会社エクスマート,,,,122,review
株式会社ＧＥＥＫＳ,,,,80,review
インテレクチュアルアセットマネジメント株式会社,,,,,review
４DP株式会社,,,,問い合わせ済み(１回),review
株式会社ドリームファクトリー,,,,,review
株式会社英伝堂,,,,21,review
株式会社バタフライプロジェクト,,,,16,review
株式会社インタークリエイト,,,,20,review
株式会社KAZAK,,,,74,review
株式会社CAROA,,,,5/14,review
株式会社テックワン,,,,,review
株式会社グラス,,,,問い合わせフォーム・メールアドレスなし,review
株式会社ＣＲＯＳＳＹ,,,,,review
株式会社アトラグ,,,,15,review
銀之丞合同会社,,,,公式HP不明,review
ワーカーズマーク株式会社,,info@wsm.co.jp,,mail 5/7,review
株式会社グリッターライン,,,,,review
株式会社LYLA,,,,,review
合同会社クロスアイ,,,,,review
株式会社ネットオン,,,,24,review
株式会社エーオー・プレミューラ,,,,リンクなし,review
株式会社メディアコンシェル,,,,,review
リヤネス株式会社,,aoki@lienes-inc.com,,mail 5/7,review
株式会社エクスマート,,,,,review
4DP株式会社,,,,,review
株式会社アニマルライフ,,,,127,review
株式会社JTOWER,,,,,review
株式会社ダブルスタンダード,,,,担当者が在宅のためHPより問い合わせしてほしい,review
株式会社HRビジョン,,,,128,review
株式会社ノップ・ノグ,,,,,review
ＨＤＣＳ株式会社,,,,4/2,review
株式会社BREASTO,,,,5/14,review
株式会社ジェイネット,,,,108,review
QualityTimeConsulting株式会社,,,,4/4,review
株式会社RASHISA,,,,13,review
株式会社コパイロツト,,,,112 リンク繋がらない,review
株式会社青山セレクト,,hp_contact@a-sel.com,,,review
株式会社ウェブライフ,,,,48,review
株式会社メソッド,,,,55,review
株式会社ブランコ・ジャパン,,,,,review
アララ株式会社,,,,4/9,review
株式会社KDDIウェブコミュニケーションズ,,,,72,review
株式会社SCSKサービスウェア,,,,番号なし,review
株式会社コデックス,,,,124,review
株式会社北海道CSK,,,,リンクなし,review
株式会社アークフィリア,,,,47,review
ルミックス・インターナショナル株式会社,,,,,review
uCloudlinkJapan株式会社,,,,mail 4/7,review
株式会社AGORA TECHNO,,,SES,SESはやってない,include
株式会社ＡＧＯＲＡＴＥＣＨＮＯ,,,,5/12,review
株式会社ウエスト,,,,,review
シアトルコンサルティング株式会社,,,,本社にTEL,review
LIN株式会社,,,,4/3,review
ファンクショット株式会社,,,,5/1,review
有限会社スピードビジネス,,info@speedbusiness.com,,mail 1/14,review
株式会社carrierSeed,,,,5/14,review
株式会社ビーライン,,,,,review
株式会社イー・ウーマン,,,,72,review
株式会社帝国データバンク,,,,情報調査機関,include
株式会社帝国データバンク情報システム,,,,26,include
株式会社帝国データバンクアクシス,,,,,include
株式会社ニュークラフト,,,,91,review
トランコムSC株式会社,,,,89,review
株式会社ボーディングパス,,,,82,review
株式会社ボーディングバス,,,,,review
株式会社キュリオ,,,,リンクなし,review
株式会社マネーコミュニケーションズ,,,,,review
株式会社ルトワ,,,,,review
株式会社ウェルクラフト,,,,43,review
株式会社AoyamaStatAppPartners,,info@aoyama-sap.co.jp,,mail　5/12,review
株式会社ファーストシード,,,,,review
METATEAM株式会社,,,,,review
有限会社ＣＧＥＮＥ,,,,,review
株式会社タスケ,,,,,review
株式会社インタークリエイト,,,,,review
株式会社ラクーダ,,,,8,review
株式会社アニマルライフ研究所,,,,126,review
みらいマルシェ株式会社,,,,5/2,review
アイデアマンズ株式会社,,,,会員登録必要,review
株式会社オリエンタルリザレクション,,,,リンクなし,review
株式会社ARNE_Technologies,,,,5/12,review
有限会社イー・グルーヴ,,,,,review
リンク・スミス株式会社,,,,5/7,review
株式会社caroa,,,,5/14,review
株式会社フラッグス,,,,,review
株式会社インターパイロン,,,,6,review
株式会社ゼネレイション,,,,2021/7/8,review
株式会社musubisu,,,,118,review
有限会社伸和スタッフ,,,,,review
株式会社Reveshare,,,,111,review
株式会社ジョイプランニング,,info@2jikai-p.net,,,review
ヒューコス株式会社,,hu-toiawase@tte-net.com,,mail　5/1,review
株式会社ケンツー,,,,92,review
株式会社ヒューマネット,,jinji@humanetwk.jp,,63,review
GEMPartners株式会社,,,,,review
GEM_Partners株式会社,,,,4/2,review
株式会社CircleFlow,,,,,review
株式会社プライム・テック,,,,,review
ドリームジョイン株式会社,,,,,review
きらぼしテック株式会社,,,,66,review
株式会社テクノロジックアート,,,,58,include
有限会社五樹工房,,,,,review
株式会社ハッピーコム,,,,,review
株式会社ハッピーコム,,,,,review
デジタルサーカス株式会社,,,,拒否,include
ショップ・アンド・チェック・ジャパン株式会社,,,,リンク切れ,review
オールインワンソリューション株式会社,,,,リンクなし,review
株式会社ナビタイムジャパン,,,,15,review
株式会社ココロザシ,,,,リンクなし,review
株式会社アルキューブ,,,,33,review
株式会社アルスキューブ,,,,,review
アセンション・ジャパン株式会社,,,,リンク切れ,review
株式会社イソラコミュニケーションズ,,info@isola.co.jp,,90,review
株式会社モバイルオーダーラボ,,,,問い合わせ済み,review
株式会社SLジャパン,,,,16,review
株式会社ドリームキャリア,,,,9,review
LiME株式会社,,,,,review
LiME株式会社,,,,SNSのみ,review
株式会社テオトリンク,,,,5,review
株式会社CircleFlow,,,,5/14,review
株式会社Anfini,,,,5/12,review
株式会社ソナーユー,,,,,review
エイアンドエー株式会社,,,,繋がらず,review
株式会社パソナデジタルソリューションズ,,,,,include
パブマティック株式会社,,,,HP開かない,review
ソリッド株式会社,,eigyo@v-solid.co.jp,,,review
株式会社マイティ・マイティ,,,,,review
モバイル・コマース・ソリューション株式会社,,,,再度連絡,review
モバイル・コマース・ソリューション株式会社,,,,5/2,review
メディカルクラウド株式会社,,,,リンクなし,include
有限会社ジェイオンライン,,,,,review
フィクスドスター株式会社,,,,122,review
有限会社アリウーブ,,,,,review
株式会社メディカルコンチェルト,,,,,review
株式会社ティープラス,,,,,review
株式会社アドバイザーグループ,,,,40,review
株式会社オタツー,,,,依頼に関する相談のみ,review
株式会社ブレインウェーブ,,,,,review
株式会社スマート・エックス,,,,リンクなし,review
株式会社ゼロソフト,,,,13,include
株式会社ハッカ・インターナショナル,,,,,review
株式会社イズム・ネットワークス,,,,,include
システム・ファームズ株式会社,,,,リンクなし,include
株式会社日本ポイントアネックス,,,,リンクなし,review
株式会社風光る,,,,,review
株式会社セイル,,,,2021/7/2,review
株式会社Violet,,,,50,review
株式会社Violet,,,,,review
株式会社ベストソリューション,,,,,review
株式会社エス・ワイ・エス・,,,,81,review
INCLUSIVE株式会社,,,,4/3,review
株式会社エス・ワイ・エス,,,,,review
株式会社サウスポー,,,,,review
株式会社ピーシープロモーション,,,,,review
株式会社エムケーシー・パートナーズ,,,,128,review
株式会社グローバル・コミュニケーション・インク,,,,117,review
株式会社プレステージ,,prestige@pre21.jp,,,review
インスタンス株式会社,,,,Twitter,review
株式会社エー・アンド・ビー・コンピュータ,,,,折り返し待ち,include
アートトレーディング株式会社,,,,,review
株式会社アーバーズ,,,,17,review
テクノプロ・ホールディングス株式会社,,,,118,include
株式会社シ－ビジョン,,,,65,review
株式会社クロスシード,,,,58,review
株式会社青山プランニングアーツ,,,,,review
ソリッドシード株式会社,,,,,review
株式会社文システム,,,,21,include
株式会社DMI,,,,5/15,review
株式会社grooves,,,,,review
NESTBOWL株式会社,,,,4/4,review
株式会社イエスウィキャン,,,,115,review
Supership株式会社,,,,住所：港区 7/4,review
有限会社アントレンヌ,,,,リンクなし,review
株式会社アジャイルＨＲ,,,,30,review
株式会社エル・カミノ・リアル,,,,メール済,review
株式会社マガボン,,,,,review
永和情報システム株式会社,,,,拒否,include
CAPXLE株式会社,,,,HP情報なし,include
合同会社tolico,,info@tolico.com,,,review
"ncloudCo.,Ltd",,,,,review
株式会社Ainer,,,,リンク切れ,review
株式会社ピクセルグリッド,,,,33,review
ジャパンミュージックネットワーク株式会社,,,,mail　4/21,include
株式会社シップ,,,,30,review
株式会社キャンプフォー,,,,,review
フォーザウィン株式会社,,,,115,review
株式会社SIX,,info@sixinc.jp,,27,review
株式会社フレームワークス,,,,,review
株式会社エクストーン,,,,25/04/16 相川問い合わせメール,review
株式会社トレンドメーカー,,info@trendmaker-inc.com,,29,review
株式会社ファイブ,,,,31,review
株式会社オールキャリア,,,,5,review
株式会社ＡＩＲ,,,,,review
デービープロ株式会社,,info@db-pro.com,,,review
株式会社エムズ,,,,117,review
株式会社セキュリティデザイン,,,,,review
株式会社テクノデジタル,,,,交流会,include
株式会社ウィザード,,,,メール済,review
株式会社メガリンク,,,,60,review
スターシステムズ株式会社,,,,,include
株式会社SpiderLabs,,,,,review
タイム・コマース株式会社,,,,担当不在：再度連絡,review
株式会社Mimmy,,,,36,review
株式会社ファミワン,,,,,review
株式会社ユニソフト,,,,48,include
有限会社スクリプト,,,,mail 1/15,review
株式会社SPIDERLABS,,,,,review
株式会社デジタルアテンダント,,,,31,include
株式会社ソーシャルPLUS,,,,,review
株式会社ネットマーケティング,,,,4,review
株式会社ナレッジコンスタント,,,,10,review
株式会社CAICA_DIGITAL,,,,,include
株式会社ネクスグループ,,,,55,review
株式会社実業之日本総合研究所,,,,,review
株式会社カーグ,,,,メール済,review
有限会社エフユー,,,,,review
有限会社ト・ヘン,,,,,review
株式会社まほろば,,support@maho-roba.biz,,21,review
スタークラウド株式会社,,,,4/21,include
キャッシュビー株式会社,,,,4/16,review
ビービーメディア株式会社,,,,,review
inMusicJapan株式会社,,,,,review
株式会社久,,,,9,review
株式会社ranryu,,,,14,review
株式会社ビーワークス,,,,,review
有限会社マクシスプランニング,,,,mail 1/10,review
ジオサーフ株式会社,,,,拒否,review
株式会社オリオンITマネジメント,,,,,include
サイオステクノロジー株式会社,,,,再度連絡,include
株式会社地方創生テクノロジーラボ,,,,,include
株式会社地方創生テクノロジーラボ,,,,,include
株式会社SIエージェンシー,,,,,review
SIA株式会社,,,,4/7,review
株式会社ピースファクトリー,,,,61,review
株式会社ProchainStaff,,,,,review
有限会社ウィステリア,,,,,review
Tangerine株式会社,,,,,review
Ｔａｎｇｅｒｉｎｅ株式会社,,,,4/7,review
株式会社GSM,,,,17,review
株式会社GSM,,,,,review
株式会社ユビテックソリューションズ,,,,,review
ジーアイクラウド株式会社,,,,119,include
株式会社サードパーティートラスト,,,,120,review
株式会社Khariis,,,,59,review
コネヒト株式会社,,,,4/17,review
三和コンピューター株式会社,,,,,include
エキサイト株式会社,,,,,review
株式会社富士誇,,,,,review
株式会社サードパーティートラスト,,,,,review
株式会社プレミアムエージェンシー,,,,,review
JCN株式会社,,,,,review
JCN株式会社,,,,4/3,review
株式会社メディアシーク,,,,37,review
カイト株式会社,,,,,review
Radiotalk株式会社,,,,4/4,review
イグジット株式会社,,,,4/10,review
イグジット株式会社,,,,,review
株式会社エー・ピーシーソフトウェア,,,,129,include
株式会社扇,,,,5/12,review
株式会社アイカラー,,,,27,review
株式会社ヴァンクールプロモーション,,,,28,review
アイ・ティ・マネジメント株式会社,,info@itmanagement.co.jp,,,review
株式会社マックスマネジメント,,,,28,review
モノリス株式会社,,,,,review
コムシスモバイル株式会社,,,,4/17,review
株式会社パーミッション,,,,3/18,review
グループネット株式会社,,,,,review
株式会社エモーショナルエージェント,,,,95,review
ネクストウェア株式会社,,,,,review
株式会社データフォーシーズ,,,,49,include
株式会社D4cプレミアム,,,,5/14,review
株式会社フィース,,,,,review
株式会社アップス,,,,リンクなし,review
さくら情報システム株式会社,,,,4/18,include
サクサホールディンクス株式会社,,,,,review
サクサ株式会社,,,,,review
株式会社ブルートーン,,,,36,review
株式会社ブルートーン,,,,,review
株式会社ネクストジェン,,,,44,review
ピーエスケー株式会社,,,,,review
ピーエスケー株式会社,,,,,review
AXLBIT株式会社,,,,問い合わせ済み(１回),include
AXLBIT株式会社,,,,,include
株式会社カータシースタイル,,,,リンクなし,review
株式会社デジタルファーム,,,,,include
株式会社シェア・アベニュー,,,,29,review
東栄電気工業株式会社,,formmail@toeidenki.co.jp,,,review
メディック投資顧問株式会社,,,,5/2,review
メディック投資顧問株式会社,,,,5/2,review
株式会社リアレーション,,,,リンクなし,review
株式会社New_Normal,,,,96,review
アトリビュート株式会社,,,,4/9,review
東京ソフト販売株式会社,,info@tokyosoft.jp,,2/3,include
株式会社SYSTEMPLANNNINGASSOCIATION,,,,72,review
株式会社フィット・コム,,,,リンクなし,review
ドットプルーフ株式会社,,,,95,review
株式会社コーディックス,,,,,review
株式会社イディオ・サバン,,,,76,review
Visolab株式会社,,,,4/8,review
株式会社ライゾマティクス,,,,,review
株式会社ヴィレッジアイランド,,,,98,review
テノン・システムコンサルティング株式会社,,,,繫がらず：在宅,include
株式会社Ｂｕｚｚｒｅａｃｈ,,,,,review
エフコム東日本株式会社,,,,HP情報なし,include
ネットスター株式会社,,,,繋がらず：リモート,review
株式会社ミディー,,,,リンクなし,review
株式会社KAgent,,,,77,review
ウォンテッドリー株式会社,,,,4/14,review
株式会社キャリアインデックス,,,,マーケティング関係,review
ウォンテッドリー株式会社,,,,,review
株式会社ディー,,,,,review
株式会社ADSS,,,,リンクなし,review
ミルーム株式会社,,,,,review
ミルーム株式会社,,,,,review
株式会社宇賀神企画,,,,,review
株式会社ルーターズ,,,,リンクなし,review
モノスタイル株式会社,,,,88,review
株式会社ＢＡＸＳ,,,,,review
株式会社テレホンサービス,,,,,review
株式会社ビットストロング,,,,,review
株式会社パーソナルシステム,,,,12,include
株式会社アイ・エス・アイソフトウェアー,,,,リンクなし,include
プライムソリューションズ株式会社,,,,メール,review
株式会社テックス,,,,リンクなし,review
株式会社PMC,,,,68,review
株式会社テクノジャパン,,,,77,include
フラッシュコーポレーション合同会社,,,,,review
ACNジャパン合同会社,,IBOSupport@acnjapan.co.jp,,,review
株式会社カリス,,,,メール済,review
株式会社フラグシップテクノロジーズ,,,,リンクなし,include
株式会社タスク,,,,,review
カストプラス株式会社,,docbasket@custplus.co.jp,,mail 4/16,review
株式会社パークフル,,,,,review
株式会社ブルカ,,info@mail.blca.jp,,,review
ブルーアライアンス株式会社,,info@bluealliance.co.jp,,84,review
株式会社Ｄｅｐｏｒｔａ,,,,,review
Brothers＆Co.株式会社,,,,問い合わせ済み(１回),review
株式会社ステップワン,,,,147,review
株式会社イプロス,,,,56,review
シーエヌシー株式会社,,,,,review
株式会社フォイス,,,,,review
株式会社シーエーセールスタッフ,,,,20,review
華智ジャパン株式会社,,,,担当不在,review
株式会社メディアコンテンツファクトリー,,,,,review
株式会社サンネクト,,,,84,review
株式会社サファリゲームズ,,,,10,review
株式会社シダン,,,,31,review
サイジニア株式会社,,,,,review
株式会社スマートスタイル,,,,113,review
ミテネインターネット株式会社,,,,,review
株式会社ヴァリューシステム,,,,拒否,include
株式会社MJC,,,,,review
株式会社ソフトウェア・サービス,,,,103,include
ピド株式会社,,,,リンクなし,review
株式会社アイキューブドシステムズ,,,,22,include
プロパティデータバンク株式会社,,,,,include
株式会社エクセル,,,,メール済,review
株式会社ディンプス,,,,7,review
輸出入・港湾関連情報処理センター株式会社,,,,色々窓口がある,include
株式会社ネットのエース,,info@net-ace.jp,,12,review
株式会社ネットのエース,,,,,review
株式会社TDモバイル,,,,37,review
株式会社文化放送開発センター,,,,,include
株式会社フューチャーインフィニティ,,,,42,review
ファーストアカウンティング株式会社,,,,136,review
株式会社ジーテック,,,,93,review
株式会社アムス,,,,メール済,review
ニホンモニター株式会社,,,,リンクなし,review
株式会社プラットイーズ,,info@plat-ease.co.jp,,86,review
株式会社メディアリンク・アイ,,info@medialink-i.co.jp,,,review
株式会社ディーラウンド,,,,,review
株式会社パークフル,,,,,review
株式会社トレンディ,,,,31,review
株式会社文化放送開発センター,,,,,include
東京エージェンシー株式会社,,,,,review
株式会社イズム（浜松町）,,,,メール済,review
ECマーケティング株式会社,,,,,review
オーバル・パートナーズ株式会社,,,,,review
シーデービージャパン株式会社,,,,本社:栃木,review
株式会社アメレックス・エナジー・コム,,,,63,review
ノートウェア株式会社,,,,拒否,review
ティアイシーエンジニアリング株式会社,,info@ticeng.co.jp,,,include
株式会社アクティブマーケティングシステム,,info@ams-jp.com,,84,include
キャディック株式会社,,,,リンクなし,review
株式会社バーチャルネットサポート,,,,,review
株式会社エルアール,,,,82,review
Bodygram_Japan株式会社,,,,,review
令和プランニング合同会社,,,,,review
株式会社エージ―ネディア,,,,,review
株式会社ギルド,,,,人材関係,review
株式会社モエルゼ,,,,10/20,review
株式会社ファーストエージェント,,,,Twitter,review
株式会社エージーネディア,,,,番なし：メール済,review
株式会社SolutionHack,,,,7/27,review
ダイヤネットシステム株式会社,,,,繫がらず,include
PSIマーケティング株式会社,,,,4/4,review
MotherComputer株式会社,,,,,review
Asterix株式会社,,,,メール済,review
株式会社エイル,,info@eir-note.com,,27,review
株式会社ティーアール,,,,tr@tr-pro.co.jp　カメラ照明　23,review
FrontierTech合同会社,,,,contact@frontiertech.jp,review
株式会社プレザント,,,,,review
有限会社ヒミコ・ソリューションズ,,,,mail 1/13,review
株式会社モイズ,,,,1,review
ターリー･セキュア･ウォレット株式会社,,,,,review
イーエムキューブ株式会社,,,,,review
PSIマーケティング株式会社,,,,,review
株式会社スターブレイン,,,,16,review
株式会社メディアバーンフィナンシャルシステムズ,,,,リンクなし,include
株式会社メディアバーン,,,,31,review
株式会社ティージー情報ネットワーク,,,,,include
ワールドトレーディング株式会社,,latex@kokusaiexpress.com,,mail 5/7,review
株式会社AT情報研,,,,8/5(水)15:00~,include
株式会社ピーエスシー,,,,,review
株式会社ソフテス,,,,,review
株式会社ファインデックス,,,,,review
株式会社綜合キャリアオプション,,,,,review
株式会社ピーエスシー,,,,75,review
日本アドバンス・テクノロジー株式会社,,,,,include
イエローテイルズ株式会社,,,,4/10,review
株式会社アルディート,,,,19,review
株式会社ザイナス,,,,河合アポ済,review
ピットメディア・マーケティングス株式会社,,,,,review
株式会社インディゾーン,,,,120,review
株式会社エフイーティーブイ,,,,62,review
株式会社デジタルトラスト,,,,リンクなし,include
株式会社ヒスコム,,,,,review
SOC株式会社,,,,リンクなし,review
株式会社アルスノヴァ,,,,大阪に電話転送される,review
SOCソリューションズ株式会社,,,,,review
株式会社アダムアップ,,,,102,review
株式会社プラスワン・クリエイティブ,,,,,review
株式会社ダイカン,,,,リンクなし,review
株式会社タクマテクノス,,,,,include
グラビティ株式会社,,,,,review
合同会社DMUX,,info@dmux.jp,,,review
株式会社ゼンブックス,,,,142,review
株式会社スターブレイン,,,,,review
株式会社NAACS,,,,115,review
株式会社Eraise,,,,5/15,review
ミュールズ株式会社,,,,,review
テトレ株式会社,,,,4/30,review
NewRetailTechnology株式会社,,,,4/4,review
ゼンエルディーンインターナショナル株式会社,,,,リンク切れ,review
株式会社エーテル,,,,106,review
株式会社ソートフル,,,,137,review
株式会社Seneprout,,info@sensprout.com,,,review
株式会社東京三信電機,,tsd@tokyo-sanshin.co.jp,,,review
株式会社楽久屋,,,,,review
三菱スペース・ソフトウエア株式会社,,,,リンクなし,include
日本プロセス株式会社,,,,,review
株式会社ミエデンシステムソリューション,,,,,include
ライフタイムズ株式会社,,,,50,review
コンピュータシステム株式会社,,,,149,include
三菱電機ソフトウェア株式会社,,,,,include
株式会社フリーダム・グループ,,pregis.info@free-dom.net,,61,review
株式会社プラスワン・クリエイティブ,,,,93,review
株式会社トータルマーケティングＤ・Ｓ,,,,,review
コーデンテクノインフォ株式会社,,,,4/17,include
株式会社AGARU,,,,,review
インターヘッド株式会社,,,,4/11,review
株式会社ルクレ,,,,33,review
株式会社DigiBook,,info@lecre.jp,,mail 5/15,review
株式会社ティーケーラボ,,,,12,review
ジェミー株式会社,,,,,review
株式会社BEFORWORD,,,,8/4(火)11:00~,review
株式会社ＢｅＦｏｒｗａｒｄ,,,,,review
エクスペリアンジャパン株式会社,,,,,review
株式会社エキスプレス・コンテンツバンク,,,,17,review
株式会社クーインターナショナル,,info@kooint.co.jp,,確認画面ボタンを押すとエラーになる,review
株式会社Freewill,,,,,review
株式会社Kyash,,,,34,review
こりっち株株式会社,,,,4/17,review
株式会社マイネット・グループ,,,,,review
株式会社マイネット,,,,,review
コンテンツワークス株式会社,,,,4/17,review
アールビー・エコー株式会社,,,,,review
株式会社ジャパンミュージックデータ,,,,,include
株式会社ジャパンミュージックデータ,,,,133,include
株式会社PIVOT,,,,78,review
インフォメーションシステムズ株式会社,,,,4/11,include
株式会社スーパーワン,,,,,review
株式会社クライマーズ,,,,,review
株式会社GIANTY,,,,68,review
エンパワーショップ株式会社,,,,4/15,review
Spready株式会社,,,,4/7,review
コロニーインタラクティブ株式会社,,,,4/17,review
エンパワーショップ株式会社,,,,,review
株式会社マンガボックス,,,,,review
株式会社マンガボックス,,,,,review
日本オラクル株式会社,,,,,review
株式会社キャリエール,,,,リンク繋がらない,review
株式会社キャリエール,,,,リンク繋がらない,review
株式会社CareerMeet,,,,,review
株式会社ビジネスバンク,,,,13,review
株式会社リトルソフトウェア,,contact@littlesoftware.jp,,,include
株式会社ふりー,,,,,review
株式会社ファースト・トライアル,,,,,review
