company,contact_name,email,type,memo,industry_status
株式会社ユー・エス・イー,,,,メール,review
株式会社ビッグタウンズ,,info@bigtowns.co.jp,,89,review
株式会社船井総研ホールディングス,,,,,review
株式会社スマイルマイスター,,,,102,review
株式会社シードシステム,,,,87,include
サンブロードバンド株式会社,,,,本社:愛媛,review
株式会社システムクレール,,,,担当不在,include
株式会社サイバーフォートレス,,,,81,include
株式会社エーピーコミュニケーションズ,,,,メール済,review
株式会社エイチ・エル・シー,,,,58,review
株式会社フリーダムランド,,,,7月3日の16時に担当者ヨシムラ様。070-7471-1151到着したら電話してください,review
株式会社キャリアヴェイル,,,,,review
アイシーティー・トラスト株式会社,,,,7/8 zoom商談,review
株式会社コムスクエア,,,,87,review
株式会社サターンテック,,,,28,review
株式会社いい生活,,,,116,review
株式会社イノベーションプラス,,,,,review
株式会社テクノモバイル,,,,メール送信7/7,include
株式会社ユーエムイーネッツ,,,,77,review
株式会社テイパーズ,,,,,review
日本ディクス株式会社,,,,,review
株式会社ワークプライムコントラクト,,,,,review
株式会社ラポールスター,,,,人だしのみ,review
株式会社コミット,,,,106,review
株式会社クレスコ,,,,,review
株式会社コシダテック,,,,25,review
株式会社リアルネットシステム,,,,,include
コンピュータ・レスキュー株式会社,,,,,include
株式会社リヴィティエ,,,,35,review
Plus_forever株式会社,,,,,review
グローバルビジネスソリューション株式会社,,,,,review
株式会社ユーネット,,,,68,review
株式会社ブロードリーフ,,,,85,review
日本システムケア株式会社,,,,,include
株式会社ウィズダム,,,,10/8再度連絡,review
株式会社リブセンス,,,,,review
コンピュータリピート株式会社,,,,,include
株式会社ユー・エス・エル,,,,84,review
株式会社システム情報センター,,,,39,include
株式会社グッド・フィール,,,,,review
株式会社エスユーエス,,,,,review
株式会社USD,,,,75,review
株式会社クルーク,,,,メール済,review
株式会社スペースキー,,,,131,review
株式会社ヴィズリアラーニング,,,,129,review
株式会社京葉,,,,受付NG,review
株式会社キャリアジャパン,,,,メール済,review
株式会社アクシスデザイン,,,,,review
銀河ソフトウェア株式会社,,,,アポ済,include
株式会社ランコムシステムズテクノロジー,,,,58,include
株式会社タイムインターメディア,,,,担当 オオタ様,review
株式会社コンフィデンス,,,,2,review
株式会社ベリサーブ,,,,,review
株式会社セレッテ,,,,18,review
株式会社メガ・テクノロジー,,,,担当不在,include
株式会社エイペック,,,,×,review
株式会社ドキドキグルーヴワークス,,,,,review
アルサーガパートナーズ株式会社,,,,4/10,review
株式会社リンケージ,,,,47,review
株式会社BASIS,,info@e-basis.co.jp,,mail 5/14,review
株式会社ディレクターズ,,,,9,review
株式会社コモドソリューションズ,,,,72,review
株式会社VOICE,,,,45,review
にっぽんマルシェ通信株式会社,,,,,review
原本株式会社,,,,2/5,review
株式会社IRRobotics,,,,55,review
株式会社アーバン・ウェブ,,,,15,review
株式会社デンケン,,,,92,review
株式会社自動計測,,,,,review
株式会社てくのろ,,,,HP情報なし,include
株式会社ベインキャリージャパン,,,SES,SESの協業は今募集してない,include
株式会社クリエイト・マンパワーサービス,,,,IT派遣サイト,include
株式会社バードネットワークス,,,,,include
株式会社助太刀,,,,,review
株式会社ブックルックチーム,,,,48,review
株式会社サイサン,,,,110,review
株式会社ラズライン,,,,2,review
日本エンジニアリングソリューションズ株式会社,,,,,include
新日本テクトス株式会社,,,,,review
株式会社ティスメ,,,,,review
日本企画株式会社,,,,,review
株式会社ブレーンナレッジシステムズ,,,,,include
株式会社エスプール,,,,,review
株式会社オールフォーエスピー,,,,×,review
株式会社ブレイントラスト,,,,10,review
株式会社リアファクトリー,,,,,review
株式会社レグルカセ,,,,,review
株式会社トレックス,,,,,review
株式会社テンプレイト,,,,担当不在,review
株式会社ストーンシステム,,,,×,include
株式会社横芝,,,,,review
株式会社エイシス,,,,69,review
株式会社テクノエージェント,,,,Twitter,include
富士通エフサス・カスタマサービス株式会社,,,,,review
株式会社コンテンツワン,,,,,review
株式会社エム・アイ・ピー,,,,,review
株式会社ヴィジョナリー,,,,×,review
株式会社エフ・ディー・シー,,,,メール済,review
有限会社カトウシステムプランニング,,,,,include
日本システム・エイト株式会社,,,,アポ○,include
株式会社ビジネスコム・システム,,,,,include
株式会社イーゼ,,,,,review
株式会社エディックワークス,,,,,review
アルファパートナーズ株式会社,,,,メール送信済,review
株式会社ウェブレッジ,,,,担当が休み、月曜日に電話,review
株式会社ユースリー,,,,71,review
株式会社テクノレーガ,,,,,include
アイムファクトリー株式会社,,,,tasaki@aim-factory.com,review
株式会社ユーフォリア,,,,ITではない,include
株式会社コスモピア,,,,2　人材派遣,review
株式会社ラック,,,,,review
株式会社ワンズコーポレーション,,,,41,review
関東情報サービス株式会社,,,,,include
株式会社ファースト・トラック,,,,担当 サカタ様,review
株式会社網屋,,,,×,review
川研ファインケミカル株式会社,,,,,review
株式会社スペース,,,,135,review
株式会社UpJapan,,,,現在使われていない,review
富士ネットシステムズ株式会社,,,,,include
株式会社フォーティス,,,,,review
株式会社スータブル・ソリューションズ,,,,,review
株式会社ティ・ティ・ワン,,,,37,review
株式会社トランザクション・メディア・ネットワークス,,,,,include
株式会社サイバーディフェンス研究所,,,,89,include
株式会社ヒューマンテック,,,SES,,review
株式会社デルタソリューションズ,,,,,review
株式会社ジー・コミュニケーション,,,,45,review
株式会社フロイント,,,,担当不在。会議中なのでまた後日とのこと,review
株式会社エイ・ヴォーチェ,,,,アポ○,review
株式会社シ・エム・シ,,,,64,review
株式会社コムネックス,,,,82,review
株式会社ラムタソリューションズ,,,,,review
株式会社テイクス,,,,メールのみ対応 ＨＰのパートナー募集,review
株式会社ヤット,,,,担当体調不良、後日荷電OK。7/5担当不在 かわされてる？,review
株式会社インフィニコ,,,,93,review
株式会社イフェクト,,,,担当 ヤマモト,review
株式会社AsianBridge,,,,5/12,review
株式会社クリエイト工房,,,,サイトログイン必要　メール済,review
株式会社ジェーエムエーシステムズ,,,,37,include
株式会社システムシンク,,,,担当不在,include
日本タタ・コンサルタンシー・サービシズ株式会社,,,,,review
株式会社フジボウル,,,,50,review
有限会社カイカイキキ,,,,,review
株式会社スプリントシステム,,,,×,include
株式会社エニー,,,,"139,404エラー",review
株式会社キャリアデザインITパートナーズ,,,,リンクなし,include
株式会社こども総合研究所,,,,122 リンク繋がらない,review
株式会社はてな,,,,11,review
株式会社シリアス プロ サポート,,,,98,review
株式会社スカイウィル,,,,46,review
株式会社エスネット,,,,メール済,review
株式会社平山,,,,,review
株式会社富士通システムズアプリケーション&サポート,,,,,include
株式会社キャピタル・アセット・プランニング,,,,リンク繋がらない,review
株式会社インタープレジゼント,,,,10/14(水)15:00~,review
株式会社エンジョイ,,,,受付NG,review
株式会社ライズウィル,,,,アポ○,review
株式会社ライズアドバンス,,,,,review
株式会社エン・PCサービス,,,,58,review
株式会社ダイヤモンドパーソネル,,,,,review
株式会社サクラ,,,,,review
東京情報システム株式会社,,,,,include
株式会社ネットホスピタル,,,,,review
株式会社アローシステム開発,,,,東京オフィスは03-3880-2712,include
株式会社ボイジャーインターナショナル,,,,,review
日本サード・パーティ株式会社,,,,1/29,review
株式会社トラスト・ネクストソリューションズ,,,,ビーネックスソリューションズに改名,review
株式会社ソフトフロンティア,,,,,include
株式会社ワンダーテクノス,,,,,include
株式会社ニュートン,,,,,review
株式会社グローバルネット,,,,,review
株式会社アムタス,,,,68,review
株式会社エフォーション,,,,アポ○,review
株式会社ファンコミュニケーションズ,,,,,review
株式会社イノベーション,,,,,review
株式会社サイバーセキュリティクラウド,,,,90,include
株式会社ネクストヴィジョン,,,,,review
株式会社パインフィールド,,,,本社埼玉、電話埼玉,review
株式会社ベネフィット,,,,100,review
株式会社リーデックス,,,,49,review
株式会社スリー・イー,,,,ファンクロックがお世話になってるとのこと：石田さんより,review
株式会社イマジカデジタルスケープ,,,,担当不在,include
株式会社ボルテージ,,,,,review
株式会社ソラテック,,,,メール送信済7/4,review
株式会社プラス・ワン,,,,,review
株式会社ムー,,,,×,review
株式会社ミラクルソリューション,,,,,review
株式会社フィアネス,,,,繋がらない,review
株式会社ゼロマーケティング,,,,,review
株式会社ドリコム,,,,50,review
株式会社リロパートナーズ,,,,,review
株式会社ソフトギア,,,,92,include
株式会社リキネットシステム,,,,,include
株式会社コアファイン,,,,リンクなし,review
株式会社フォトクリエイト,,,,,review
株式会社セラク,,,,担当から折り返しするとのこと,review
株式会社サイバービジョンホスティング,,,,82,include
株式会社ウィクレソフト・ジャパン,,,,メール済,include
株式会社エムティーアイ,,,,110,review
株式会社デジタルハーツホールディングス,,,,メールへdh_recruit@digitalhearts.com,include
株式会社デジタルハーツ,,,,,include
株式会社ジーニー,,,,83,review
株式会社ハンモック,,,,98,review
株式会社ウエストネット・テクノロジー,,,,不在,include
株式会社テクノウォーカー,,,,83,include
株式会社ノバックス,,,,23,review
株式会社テクノデータ,,,,×,include
株式会社サイゼント,,,,メール済,review
株式会社インテルバイザー,,,,交流会,review
株式会社エー・アンド・ディ,,,,8,review
株式会社ライブエスト,,,,14,review
株式会社タクミインフォメーションテクノロジー,,,,,include
コンピューター・システム・エコー株式会社,,,,13時に千葉か埼玉に電話,include
株式会社エル・アイ・システムズ,,,,86,include
共同システム開発株式会社,,,,二宮さん,include
株式会社デルク,,,,△,review
株式会社フレスタ,,,,HPから,review
株式会社シスナビ,,,,37,review
株式会社ビービージーシー,,,,,review
株式会社ユーナ,,,,,review
新日本エンジニアリング株式会社,,,,,include
株式会社トーセーシステムズ,,,,,include
株式会社ラクザイア,,,,,review
株式会社トゥインクル,,,,68,review
株式会社イレブンラボ,,,,メール済,review
日本オーディン株式会社,,,,,review
株式会社トランスアクト,,,,,review
株式会社ユービー,,,,66,review
株式会社カールビット,,,,,review
株式会社言語サービス,,,,河合アポ済,review
株式会社ティー・アール・シー,,,,34,review
株式会社スーパーシステムエンジニアリング,,,,,include
株式会社セイコウ,,,,,review
株式会社プラスナレッジ,,,,沖縄に,review
株式会社宮崎通信,,,,,review
株式会社コーエーテクモホールディングス,,,,84,review
株式会社シーグリーン,,,,,review
富士コンピュータ株式会社,,,,mail 1/20,include
株式会社テクノウェア,,,,×,include
株式会社インテリジブル,,,,拒否：期間開けて再度,review
空港情報通信株式会社,,,,,include
株式会社マックスシステム,,,,,include
株式会社マルヨシ,,,,,review
株式会社テックツリー,,,,111,review
株式会社ソラム,,,,76,review
株式会社モバイルコミュニケーションズ,,,,,review
株式会社ブレインパッド,,,,,review
株式会社オレンジネット,,,,メール済,review
a,,,,,review
株式会社インフィライズ,,,,,review
株式会社マンキャピタル,,,,,review
株式会社テクノフォー,,,,,include
株式会社アイアイ・ネットワーク,,,,,include
株式会社芝浦電子,,,,,review
ActLink株式会社,,info@actlink.co.jp,,リンク切れ,review
日本ラドウェア株式会社,,,,,review
株式会社Wonderwall,,c.hiruta@wonder-w.com,,,review
株式会社スパーククリエイティブ,,,,8,review
株式会社Sebs,,,,,review
アクロビット株式会社,,,,,review
株式会社アンテク,,,,,review
株式会社アサインナビ,,,,,review
株式会社フレアシステム,,,,,include
Octave合同会社,,,,,review
株式会社オンライズ,,,,,review
株式会社flixy,,,,,review
株式会社jItCom,,,,,review
LISUTO株式会社,,,,,review
ニチコマ合同会社,,,,,review
株式会社concept,,,,,review
株式会社クラン・アライズ,,,,リンクなし,review
株式会社YNP,,,,,review
株式会社Unigma,,,,,review
株式会社アイ・シー・ティー21,,,,,review
株式会社フジ東京サービス,,,,,review
株式会社GreenCube,,,,,review
株式会社ベネフィシャルテクノロジー,,,,1,include
アンドロボマテリアル株式会社,,,,,review
アンドロボティクス株式会社,,,,,review
CTW株式会社,,,,4/2,review
ソニアキューブ株式会社,,,,,review
株式会社アリソン,,,,43,review
コンピュータ・システムトレンド株式会社,,info@cst-d.co.jp,,mail　4/17,include
株式会社ウェブクリエイト,,info@webcreate.jp,,60,review
ケイプラス株式会社,,info@k-plus-inc.com,,,review
株式会社実務薬学総合研究所,,,,,review
モバイル・ネット・テクノロジー株式会社,,info@mn-t.jp,,85,include
有限会社プロサイト,,sales@prosite-jp.com,,mail 1/11,review
株式会社エンボディ,,,,32,review
株式会社ゲット・ニュース,,mail@getnews.co.jp,,97　ビルメンテナンス,review
有限会社テックジャパン,,,,,review
YS.co,,,,,review
サンテクニカル株式会社,,,,125,review
株式会社RubyOnRing,,,,90,review
株式会社クローバーマネキン紹介所,,kk.clover@nifty.com,,リンクなし,review
株式会社オフィス・マイン,,,,,review
株式会社オフィサム,,,,,review
株式会社ILG,,,,78,review
日本エコシステム株式会社,,,,行かなくていい,include
テクノバン株式会社,,,,,include
株式会社レジスタンス・ソル,,,,5,review
株式会社COSエンジニアリング,,,,,include
株式会社侍パートナーズ,,,,,review
株式会社テクニカルエージェント,,,SES,可 (10人月以下),review
株式会社インサット,,,,,review
株式会社サニー情報システム,,,,16,include
株式会社スカイシア,,info@skyseer.co.jp,,42,review
株式会社システムマネージメント,,,,,include
株式会社エクストリーム,,,,,review
株式会社ＪＣＤソリューション（現株式会社トップヒルズ）,,,,,review
株式会社パワーエッジ,,,SES,,review
株式会社シーオーエスエンジニアリング,,,SES,Twitter,include
株式会社E-STAGE,,,,,review
株式会社ハブ,,,,twitter,review
サンシード株式会社,,,,,review
株式会社システムサーバー,,,,,include
株式会社OverREVO,,,,114,review
日本情報株式会社,,,,,include
株式会社エークラス,,,,Twitter,review
株式会社NEFコミュニケーションズ,,,,,review
株式会社シェアコネクト,,,,27,review
株式会社日本ビジネスデータープロセシングセンター,,,,,include
株式会社ソフトライフ,,,,85,include
株式会社ラージック,,,,Twitter,review
株式会社セブン・ワイズ,,,,,review
中央情報システム株式会社,,,,,include
株式会社ビーハーフ,,,,,review
株式会社GEクリエイティブ,,,,,review
株式会社AGENCIA,,,,mail　5/12,review
株式会社AGENCIA,,info@agate-japan.com,,mail　5/12,review
株式会社HarvestBizCareer,,,,,review
システム・プロダクト株式会社,,,,茨城,include
株式会社テラソフト,,,,100,include
株式会社遠藤システム,,,,,include
株式会社ロジックデザイン,,,,,review
株式会社アイファ,,suda@eifer.jp,,57,review
株式会社東日本技術研究所,,,,,review
エクシードシステム株式会社,,,,本社：岡山県,include
株式会社一創,,,,協業用フォームなし,review
株式会社イーテクノロジー,,,,17,include
コンピュータ・アシスト株式会社,,,,4/17,include
株式会社ワイビーエス,,,,50,review
株式会社UNIT,,,,81,include
セルチェ株式会社,,,,mail 4/22,review
インフラウェア株式会社,,,,,include
有限会社スピシア,,,,,review
日興テクノス株式会社,,,,1/29,include
株式会社ブレスビット,,info-bb@breathbit.co.jp,,97,review
株式会社フリーダム,,,,62,review
株式会社ティオ,,,,36,review
有限会社ヤスダレジスター,,,,,review
有限会社ミグシステム,,info@mig.co.jp,,,include
株式会社メディカル・プロテオスコープ,,,,,review
シンストーン（新思通）株式会社,,,,営業所:横浜,review
株式会社アルトテクノロジー,,postmaster@altotec.co.jp,,9,include
ムラタ計測器サービス株式会社,,,,5/2,review
株式会社BRAINS,,,,,include
ユビアン有限会社,,toiawase@yubian.jp,,61,review
住電通信エンジニアリング株式会社,,,,,include
株式会社プライムセキュリティー,,,,,review
株式会社プロダクトイン,,,,65,review
株式会社IDサポート,,,,88,review
コーラルシステムズ株式会社,,nob@CoralSystems.com,,mail　4/17,include
有限会社ワイケー技研,,,,mail 1/9,review
株式会社ドクターソフト,,info@doctorsoft.co.jp,,,include
株式会社創盛,,,,,review
株式会社ノナシステム,,,,25,include
スクリプツ・ラボ有限会社,,,,58,review
アイゲージ株式会社,,,,,review
株式会社フイデイック,,,,,review
マクニカソリューションズ株式会社,,,,5/2,review
システムサプライ株式会社,,,,mail　4/21,include
株式会社スマートエナジー研究所,,,,,review
株式会社アーティファクト,,,,31,review
株式会社ジェイビッツ,,,,107,review
バイオコミュニケーションズ株式会社,,,,,review
株式会社ディビジョン・エンジニアリング,,info@division-engineering.com,,17,include
株式会社マリノ,,,,17,review
インフィニテグラ株式会社,,,,mail　4/11,review
岡谷エレクトロニクス株式会社,,,,5/8,review
株式会社a-LINK,,,,5/12,review
エボラニ株式会社,,,,114,review
先端技研株式会社,,,,,review
株式会社NTTデータ_オートモビリジェンス研究所,,,,57,include
株式会社ソフィックス,,,,113,review
ACテクノロジーズ株式会社,,web_inquiry@actex.co.jp,,,include
エヌ・ティ・ティ・データ・フォース株式会社,,,,,include
株式会社ケーウェイズ,,,,36,review
アートワーク株式会社,,,,4/8,review
株式会社アルル,,info@alulu.onmicrosoft.com,,109,review
日本電能株式会社,,,,mail 1/21,review
図研エルミック株式会社,,,,,review
株式会社ハートソフト,,,,8,include
株式会社アドユニーク,,,,17,review
株式会社日本コンピュータコンサルタント,,,,,include
日本ソフトウェアマネジメント株式会社,,jsm-info@jsm.co.jp,,1/29,include
ハマゴムエイコム株式会社,,,,,review
株式会社スペース・アイ,,,,134,review
株式会社エフケイ・ジャパン,,,,56,review
株式会社中央ソフト,,,,28,include
株式会社スカイ・ブレインズ,,,,47,review
株式会社アデックス,,,,66,review
株式会社横浜シスコム,,,,,review
株式会社アーチェスト,,,,35,review
株式会社ソリッドレイ研究所,,,,75,review
株式会社エフビズ,,,,48,review
株式会社ソフトジェネシス,,,,,include
株式会社ジェニシス,,,,94,review
株式会社アイツー,,,,122,review
株式会社ゼオシステム,,,,,include
株式会社コーエー情報,,webmaster@uainf.co.jp,,83,include
株式会社ユーエー情報,,,,79,include
アプリコット株式会社,,,,4/9,review
横浜テクノウェア株式会社,,,,5/8,include
天進技術株式会社,,,,,review
株式会社シルバコ・ジャパン,,,,,review
株式会社IDAJ,,,,91,review
株式会社サイグナス,,,,113,review
株式会社日立ハイシステム21,,,,41,include
株式会社横浜ビットシステム,,ml_contact@ybit.co.jp,,18,include
株式会社グレープシステム,,,,,include
株式会社GORIDE,,,,38,review
ソルトフィッシュ株式会社,,,,mail 4/22,review
ケーエルエー・テンコール株式会社,,,,4/17,review
株式会社グローバルシステムズ,,,,98,include
株式会社アットウェア,,,,93,review
株式会社アイネット,,,,66,review
株式会社横浜マイクロシステム,,,,,include
エヌディーエル株式会社,,info@ndlkk.co.jp,,mail 4/15,review
株式会社ユーズウェア,,,,73,review
インフォテクノ株式会社,,,,7/15(水)15:00-,include
株式会社システム・プランニング,,,,99,include
株式会社システムズリサーチ,,,,,include
株式会社NBEシステムズ,,soumu@nbe-systems.co.jp,,106,include
アーバンコーポレーション株式会社,,,,後日再度連絡,review
アークシステム株式会社,,,,"再度連絡
連絡先教え済",include
株式会社エーアイネット・テクノロジ,,,,127,include
グローブネット株式会社,,info@globenet.co.jp,,mail　4/17,review
スキルネット株式会社,,,,59,review
テクノ・チップス株式会社,,,,,include
六元素情報システム株式会社,,,,mail 1/8,include
有限会社システムクリエイトアソシエイツ,,,,,include
株式会社Soft,,,,7/21(火)11:00~,review
株式会社ブレインシステムズコンサルティング,,,,12,include
株式会社ネットプロ,,,,5,review
株式会社ゼロファイト,,info@xerophyte.jp,,12,review
株式会社ケンズシステム,,info@kens-sys.co.jp,,93　問い合わせフォーム・メールアドレスなし,include
株式会社ツクタ技研,,,,,review
ファインシステム株式会社,,,,,include
テクニカルジャパン株式会社,,,,mail済み,review
フロンテック株式会社,,recruit@frontech.co.jp,,mail　5/2,review
株式会社ベスタッフ,,,,,review
株式会社フジシステムズ,,,,,include
株式会社ソピアシステム,,,,120,include
株式会社アイティ・セック,,,,114,review
有限会社先端技術研究所,,,,,review
株式会社アクエスト,,,,116,review
株式会社アウラ,,,,"11,電話のみ",review
有限会社ヴィッセンシャフト,,aoyama@wissenschaft.co.jp,,,review
有限会社アプリ,,info@apli-inc.com,,,review
アテンティア株式会社,,info@atentia.co.jp,,mail 4/9,review
アルゴコンピューター株式会社,,info@argo-computer.co.jp,,4/10,include
モトミ株式会社,,info@motomi.co.jp,,mail　5/2,review
株式会社MHIパワーコントロールシステムズ,,,,45,include
株式会社アール・エフ,,,,1,review
株式会社アシェット,,,,42,review
株式会社エフエスエス,,,,61,review
アットセル株式会社,,,,4/9,review
ヨコハマシステムホルダー株式会社,,jinjibu@ys-holder.co.jp,,59,include
株式会社dcWORKS,,,,5/14,review
フォルテックス株式会社,,,,105,review
株式会社リムパック,,,,66,review
株式会社スカイナラ,,,,,review
株式会社日中ソフト,,info@ncsoft.ne.jp,,39,include
株式会社システムミラ,,m-info@mira.co.jp,,52,include
システム日本株式会社,,,,4/21,include
株式会社パラダイム・システムズ,,,,43,include
ピーアイピー株式会社,,,,6,review
株式会社テクノポート,,info@techno-port.co.jp,,,include
株式会社エフ・エス・ティー,,,,,review
株式会社アインス,,,,23,review
株式会社テクノブレーン,,,,67,include
新隆ジャパンシステムサービス株式会社,,webmaster@shinryu-ss.jp,,2/4,include
株式会社アイティージェー,,,,101,review
株式会社クラスターシステムズ,,cluster@clustersystems.co.jp,,,include
NEXELInternational株式会社,,,,4/4,review
株式会社神奈川トスバック,,info@tosbac.co.jp,,57,review
キートン株式会社,,,,4/16,review
