company,contact_name,email,type,memo,industry_status
イーソル株式会社,,sw-inq-jp@esol.co.jp,,,review
イーソル株式会社,,,,,review
株式会社スーパーリージョナル,,,,メール済み,review
SAVAWAY株式会社,,,,,review
マイケル株式会社,,info@michael-inc.com,,mail　5/2,review
株式会社ウィルグループ,,,,,review
株式会社ファーストアクセス,,,,,review
株式会社ロックビレッジ・テクノブレインズ,,,,22,include
株式会社ラモ,,lamo@mbr.ocn.ne.jp,,,review
株式会社ラモ,,,,,review
株式会社ルートゼロ,,,,,review
株式会社ルートゼロ,,,,交流会,review
株式会社MICX,,,,23年7月26日別担当と打合せ,review
エイ・アイ・エル株式会社,,,,,review
株式会社ワイズ・コーポレーション,,,,,review
株式会社フェムト,,,,,review
富士フイルムデジタルソリューションズ株式会社,,,,,include
株式会社エヌデーデー,,,,,review
株式会社パストラーレ,,,,,review
株式会社ケイエスジェイ,,,,123,review
ｍａｋｅｆｏｒ株式会社,,,,,review
株式会社海洋先端技術研究所,,ser_vice_1@ohti.co.jp,,,review
株式会社東放ヴィックス,,,,,review
株式会社グリーン情報システムズ,,,,リンク繋がらない,include
アシストマイクロ株式会社,,,,4/9,review
株式会社アクティヴオープンコミュニケーションズ,,,,93,review
株式会社スイフトコミュニケーションズ,,info@swift.co.jp,,50,review
株式会社多聞,,,,,review
FORNAX株式会社,,,,4/2,review
株式会社エニック,,,,4,review
techners株式会社,,,,4/7,review
株式会社エスミ,,,,24,review
株式会社KKEスマイルサポート,,,,,review
インフォアーツ株式会社,,,,4/11,review
株式会社データマックス,,,,,include
株式会社データマックス,,,,45,include
クロスコミュニケーションズ株式会社,,webmaster@crcom.co.jp,,4/17,review
株式会社イーミックス,,,,125,review
株式会社アールアイ,,,,125,review
株式会社テクトム,,postmaster@techtom.co.jp,,1,review
ファボック株式会社,,,,,review
サンウイング株式会社,,web2@sunwing.co.jp,,,review
株式会社シネマトゥデイ,,,,19,review
和道株式会社,,,,,review
有限会社エースリリーフ,,,,,review
株式会社紫技研,,info@muragi.jp,,,review
株式会社フリード・コム,,info@freed-com.jp,,59,review
株式会社L.O.Dクリエーション,,,,,review
株式会社AITS,,,,5/12,include
株式会社オプサス,,,,,review
株式会社Public_dots_&_Company,,,,38,review
株式会社ウェブエッジ,,,,62,review
ライフ・サービス・コンサルタンツ株式会社,,lsc@cyber.ocn.ne.jp,,,review
東京電通工株式会社,,,,,review
株式会社ユニツクス,,,,,review
ガナシス株式会社,,,,,review
ヨネイテクノサービス株式会社,,info@yonei-ts.co.jp,,リンク切れ,include
株式会社SHISHI,,,,,review
株式会社ステップステージ,,,,148,review
株式会社エイチケイロード,,hk_all@ml.hkroad.biz,,48,review
有限会社テクノアート,,info@tech-art.co.jp,,,include
有限会社アウトスタンディング,,aoyama@outstanding.co.jp,,,review
有限会社アウトスタンディング,,,,,review
株式会社楽楽エージェント,,,,,review
株式会社楽楽エージェント,,,,,review
株式会社パイオニーサービス,,,,,review
東京情報通信株式会社,,,,,include
サザンテック株式会社,,,,公式HP不明,review
坂本通信株式会社,,info@sakamoto-com.co.jp,,,review
ヤマモトジムキ株式会社,,,,,review
株式会社先進ランドリー研究所,,,,,review
緑の館株式会社,,sales_it@livlib.co.jp,,mail 1/8,review
株式会社先進ランドリー研究所,,,,,review
株式会社ナレッジフロー,,info@knowledge-flow.net,,,review
株式会社ナレッジフロー,,,,,review
株式会社テクネ,,,,事務所移転：町田,review
株式会社ネクストウェイ,,,,50,review
株式会社ネクストウェイ,,,,,review
株式会社アートブレインズ,,,,22,review
株式会社アムロ,,contact@a-mu-ro.co.jp,,67,review
株式会社ベルノース,,,,,review
有限会社システム町工房,,info@smkb.jp,,mail 1/15,include
株式会社サンヨ,,,,75,review
株式会社クラウドサービス,,,,,include
株式会社ハートメディア,,,,,review
株式会社アスペア,,,,,review
Egretcom株式会社,,info@egretcom.com,,mail 4/2,review
マイクロシステム株式会社,,,,,include
株式会社EMU,,sales@e-mu.jp,,mail 5/15,review
有限会社アイソフト,,z-irazu@isoft.co.jp,,,include
株式会社アラケル,,,,,review
株式会社クリアワークス,,info@clear-works.co.jp,,,review
コム・アシスト株式会社,,,,3,review
建築ソフト株式会社,,info@kentiku.co.jp,,,include
EJCOMS株式会社,,,,4/2,review
アスキーシステム株式会社,,info@askey.jp,,4/9,include
株式会社シンク・イメージ,,,,,review
株式会社エヴァーウィン,,info@everwin.co.jp,,info@everwin.co.jp,review
株式会社ピーエスイー,,mishii@pse.co.jp,,78,review
有限会社めぐみ,,,,,review
システムコミュニケーションズ株式会社,,,,85,include
株式会社ナレッジサテライト,,info@knowlsat.jp,,9,review
株式会社ナレッジサテライト,,,,,review
株式会社スリーフィールド,,,,,review
株式会社スリーフィールド,,,,84,review
株式会社プライムスタッフ,,,,,review
合同会社ほんわか,,,,2/8,review
合同会社ほんわか,,,,,review
イーソリューション株式会社,,,,リンク切れ,review
株式会社清水電子研究所,,sim21@shimizu-e.co.jp,,,review
株式会社PLESH,,,,71,review
株式会社PLESH,,,,,review
株式会社システム工房9,,,,,include
株式会社HAMAX,,,,4,review
有限会社スリーディレクション,,,,mail 1/14,review
株式会社アイコーシステム,,,,17,include
株式会社リサシステム,,,,,include
ジャパンハイテック株式会社,,,,,review
ジャパンハイテック株式会社,,Support@japanhitech.co.jp,,mail　4/21,review
株式会社イーエル・アイ,,,,48,review
有限会社ルートウェル,,,,,review
株式会社ロハスリーディング,,,,,review
株式会社ロハスリーディング,,,,,review
有限会社創造デザイン,,,,,review
株式会社アーキテクトイー,,,,60,review
株式会社電子光学研究所,,sales@dkl.co.jp,,,review
トロアヴァーグ株式会社,,,,87,review
株式会社エス・ケー・ケー,,,,89,review
株式会社小杉技研,,kosugi-hi@pluto.dti.ne.jp,,79,review
NS&C株式会社,,,,,review
株式会社Bartholo Japan,,,,不在,review
株式会社SKYHUMANSERVICE,,,,18,review
d3コム株式会社,,,,mail 4/2,review
株式会社ラグザイア,,,,7,review
株式会社サンライン,,,,69,review
株式会社ポートエモーショナル,,,,,review
株式会社SeaHalberd,,info@shb.tokyo,,55,review
アイワコンピューター株式会社,,info@aiwacomputer.com,,閉鎖済み,include
株式会社電子表現,,mailto@dhi.co.jp,,,review
株式会社ジョブウエスト,,,,,review
株式会社BuzzFunc,,,,5/14,review
伝送通信工業株式会社,,,,,review
株式会社リモデルパートナーズ,,,,65,review
株式会社リモデルパートナーズ,,,,,review
株式会社松浦商事,,partner@matsu-syo.co.jp,,,review
合資会社グランパワー,,,,,review
株式会社エルメック,,,,65,review
有限会社アンツ,,,,,review
有限会社アンツ,,,,,review
株式会社Puerto,,,,37,review
ヒューマネットシステム株式会社,,,,,include
アイエスティー株式会社,,,,リンク切れ,review
株式会社ビーライン,,info@beeline.co.jp,,,review
ナビコン株式会社,,,,4/30,review
株式会社navicon,,,,109,review
株式会社アリトンシステム研究所,,,,42,include
株式会社and.d,,,,5/12,review
株式会社and.d,,,,5/12,review
ケアミックス株式会社,,,,4/17,review
株式会社ビックボイス,,,,87,review
株式会社MDS,,,,,review
ケアミックス株式会社,,,,,review
知見パワー株式会社,,info@chikenpower.com,,info@chikenpower.com,review
株式会社地域経営プロジェクト,,project@lampj.co.jp,,,review
株式会社ユニテックス,,,,45,review
トラスト・ポート株式会社,,info@trust-port.com,,info@trust-port.com,review
株式会社ライジンシャ,,,,,review
株式会社アイ・キューブ,,,,,review
株式会社TERADA.LENON,,,,32,review
株式会社スマートプロップ,,info@smartprop.co.jp,,108,review
株式会社アトムズウェア,,,,,review
SOINN株式会社,,contact@soinn.com,,4/7,review
株式会社ソフト開発,,info@softkaihatsu.co.jp,,81,include
ＳＯＩＮＮ株式会社,,,,,review
株式会社柿生電設,,kakiodensetsu@nifty.com,,,review
有限会社ヒューマンテクノロジィーシステム,,,,mail 1/13,include
レデックス株式会社,,,,5/7,review
株式会社ファーマリンク,,,,,review
有限会社リーフ,,support@leafsystem.co.jp,,mail 1/10,review
サンリツオートメイション株式会社,,webmaster@sanritz.co.jp,,4/18,review
株式会社メカニカル技研,,,,,review
株式会社アール・ベゴ,,,,,review
ララコミュニケーションズ合同会社,,,,5/7,review
ライフセレモニー株式会社,,,,5/7,review
ライフセレモニー株式会社,,,,5/7,review
アイ・リンクス株式会社,,info@i-links.co.jp,,,review
株式会社マックステクノロジー,,info@macstechnology.co.jp,,,include
株式会社インフォサーブ,,other_info@infoserve.co.jp,,74,review
株式会社ベガシステム,,,,30,include
ATEサービス株式会社,,,,問い合わせ済み(１回),review
株式会社M&C,,,,,review
アイ・ティ・エフ株式会社,,,,,review
株式会社ジェーケーサイエンス,,,,34,review
株式会社ジェーケーサイエンス,,,,,review
株式会社ディアライズ,,info@dealize.co.jp,,info@dealize.co.jp,review
ジェーエスケイ株式会社,,information@jsk-ss.co.jp,,mail 4/18,review
フォーミュラ・ビジネス・インターネット有限会社,,info@formula.co.jp,,mail　5/1,review
株式会社LaboLive,,,,30,review
株式会社オフィスゲート,,info@office-gate.net,,工事関係,review
有限会社コムズインターナショナルトレーディング,,,,28,review
ISC株式会社,,info@isc-cop.net,,4/3,review
有限会社エムズ・ワークス,,,,,review
有限会社エムズ・ワークス,,,,,review
有限会社テイアンドエム,,,,,review
サーモコントロールサービス株式会社,,infomation@thermo-cs.jp,,mail 4/18,review
感性AI株式会社,,,,,include
株式会社インフォクラフト,,,,77,review
ネクストソリューション株式会社,,,,4/30,review
株式会社LaboLive,,,,,review
株式会社デジウェア,,info@digiware.co.jp,,48,review
株式会社京王ITソリューションズ,,,,,include
株式会社アニー,,,,130,review
株式会社サンエンジニアリング,,,,112,include
株式会社フォー,,,,74,review
有限会社ナレッジワークス,,,,メール,review
株式会社ヤマザキ,,,,,review
有限会社リンクウェイ,,,,mail 1/9,review
株式会社葉月商会,,info@hazuki.co.jp,,,review
株式会社リソリューション,,,,26,review
株式会社三誠,,,,,review
株式会社テスコ,,,,7,review
有限会社エポック,,,,,review
有限会社ブリックス,,info@bricks.co.jp,,,review
株式会社トウ・ソリューションズ,,,,,review
ストラテジー株式会社,,jishin_sales@estrat.co.jp,,,review
株式会社日総サービス,,,,,review
株式会社ピー・ディー・サービス,,,,,review
株式会社ヘルスケアリレイションズ,,,,,review
株式会社画像技研,,sales@gazogiken.co.jp,,,review
アイ・キャロット株式会社,,info@icarrot.co.jp,,nail 4/8,review
株式会社ハイスピード・パートナー,,,,44,review
株式会社ハイスピード・パートナー,,,,,review
株式会社ウィード,,,,,review
株式会社ウィード,,,,23,review
株式会社コーデック,,,,78 問い合わせフォーム・メールアドレスなし,review
東日本電気電話保守センター株式会社,,info@hn-hoshu.co.jp,,,review
UmeeTechnologies株式会社,,,,4/8,review
株式会社ビビアン,,,,,review
株式会社CodeNext,,info@codenext.jp,,mail 5/14,review
株式会社MNU,,,,22,review
有限会社wisdom,,,,,review
株式会社キキバーブ,,info@kiki-verb.com,,,review
株式会社CDE,,,,5/14,review
マイクロダイナミックス株式会社,,,,,review
株式会社シークフロント,,info@seek-front.com,,125,review
株式会社USTEER,,,,67,review
株式会社KANGEN_Holdings,,,,勉強会,review
株式会社nascimento,,contact@nascimento.co.jp,,111,review
株式会社nascimento,,,,,review
株式会社バムテック,,vamtec.ceo@nifty.com,,vamtec.ceo@nifty.com,review
株式会社Todotalk,,,,129,review
株式会社TodoTalk,,,,,review
株式会社サンカネットワーク,,,,110,include
日本システム総合研究所株式会社,,div01@nts-r.co.jp,,1/29,include
株式会社アムスコーポレーション,,,,69,review
アムスコーポレーション株式会社,,,,,review
プリモス事務所,,,,,review
プリモス事務所,,,,,review
株式会社システムリナックス総合研究所,,,,48,include
明成通信株式会社,,,,mail 1/17,review
アーティサン株式会社,,,,,review
多摩電設工業株式会社,,,,,review
株式会社LIB,,,SES,問い合わせフォームなし,review
ネクストポイント株式会社,,gad-01@go-nextpoint.com,,mail　4/30,review
株式会社ユーアイコム,,,,,review
恒栄通建株式会社,,,,,review
株式会社太田企画,,,,,review
ディレクトシステムサービス株式会社,,,,リンク切れ,include
株式会社S2プロダクション,,,,78,review
有限会社センテンス,,,,,review
有限会社マリンアート・コミュニケーションズ,,info@marineart-coms.com,,mail 1/10,review
株式会社テイルス,,information.tails@tails.co.jp,,11,review
株式会社ビーアンドケイ,,info@bkweb.jp,,,review
株式会社ビーアンドケイ,,,,,review
有限会社イクシス,,,,,review
グッチーポスト株式会社,,,,,review
グッチーポスト株式会社,,,,,review
株式会社ランドマーク,,,,,review
株式会社セイコウアートグレス,,,,71,review
株式会社国栄,,,,,review
有限会社エムアンドシーエンタープライズ,,,,,review
株式会社ソーシャルコミュニケーションズ,,,,送信できたか不明　139,review
株式会社ガプスモバイル,,,,リンク繋がらない　メール済,review
CTO株式会社,,,,リンク切れ,review
株式会社RESORZ,,,,,review
株式会社モバイル情報システム,,info@mobile2000.co.jp,,94,include
株式会社花咲ソリューション,,,,,review
株式会社マインズアイ,,,,,review
株式会社日本シスラボ,,,,可,review
エイアイエムシステム有限会社,,yara@aim-system.co.jp,,mai　4/14,include
櫻沢電設株式会社,,,,,review
株式会社クローバーシステム,,kanda@cloversystem.com,,120,include
株式会社デザインテック,,,,51,review
山崎教育システム株式会社,,,,,include
有限会社日本電化サービス,,y_ichikawa@care-nds.co.jp,,,review
株式会社フィールドプロ,,sales01@fieldpro.co.jp,,,review
株式会社トライプロ,,info@trypro.co.jp,,,review
株式会社レックスコーポレーション,,,,46,review
株式会社e-FLAGS,,customer@eflags.jp,,,review
YouTeacher株式会社,,youteacher@me.com,,4/8,review
株式会社商工中金情報,,,,,include
株式会社ビッグカントリー,,,,90,review
有限会社ソラ,,,,,review
株式会社シンクウェア,,info@think-ware.co.jp,,85,review
株式会社ナックソフトウェア,,,,22,include
広和企画株式会社,,info@douso.com,,,review
広和企画株式会社,,,,,review
光栄電機株式会社,,,,,review
巖電設工業株式会社,,info@iwao-d.co.jp,,mail 1/8,review
株式会社アテックスホールディングス,,,,,review
株式会社アテックスホールディングス,,,,65,review
株式会社Palms_Together,,,,,review
株式会社ワンタラント,,,,,review
多摩電気工事株式会社,,,,,review
コンピュターシュミレーションズ株式会社,,,,,review
コンピュータシミュレーションズ株式会社,,,,4/18,include
延山イステムプランニング株式会社,,,,リンク切れ,review
株式会社エム・テー・シー,,info.mtc@mtgrp.co.jp,,16,review
有限会社エーアンドディーネットワーク,,,,,include
株式会社宮島通建,,,,,review
アットマーク・インタラクティブ株式会社,,info@aic-g.com,,mail 4/9,review
株式会社A.C.T,,info@act-field.co.jp,,5/12,review
TKS株式会社,,info@tks-i.co.jp,,mail 4/7,review
コアズ株式会社,,info@cores1.com,,mail　4/17,review
東成ソフトウェア有限会社,,,,,include
株式会社ACE,,,,,review
株式会社ACE,,,,,review
ニュー・ビレッジ・テック株式会社,,,,4/30,review
株式会社エラン,,,,"93,問い合わせ先無し",review
株式会社日本住設,,,,,review
日野コンピューターシステム株式会社,,,,,include
昭栄テックス株式会社,,,,,review
システムアルバ株式会社,,,,電話のみ,include
有限会社ハイクエンジニアリング,,,,mail 1/13,include
有限会社ムーブコンピューター,,info@move-cp.co.jp,,mail 1/10,include
日本クリエートシステム株式会社,,info@9810.jp,,1/29,include
株式会社コメッツ,,info@comets.jp,,75,review
ウルトラメモリ株式会社,,,,4/14,review
ライジングサンコーポレーション株式会社,,support@rscsoft.co.jp,,55,review
株式会社イー・ウエスト,,info@ewest.co.jp,,71,review
株式会社日本ファーマテック・システムズ,,,,,include
株式会社教育ソフトウェア,,info@kyoikusw.co.jp,,,include
アートシステム株式会社,,,,2023/05/10,include
アートシステム株式会社,,,,,include
アートシステム株式会社,,,,,include
テクノヒューマンパワー株式会社,,,,,include
株式会社マン・マシンインターフェース,,,,9,review
株式会社マン・マシンインターフェース,,,,,review
株式会社アセンブル,,,,109,review
株式会社データーシステム,,,,56,include
株式会社ミュージック・マスター,,,,,review
株式会社サーキットプランニング,,,,,review
株式会社システムネットワーク,,stor@systemnetwork.jp,,61,include
株式会社無限の始まり,,,,Twitter,review
株式会社無限の始まり,,,,,review
株式会社無限の始まり,,,,,review
西武電機株式会社,,,,,review
有限会社トリプル・ウェーブ,,info@triplewave.jp,,,review
株式会社イェンドレッド,,skim@yndrd.com,,,review
有限会社ジャグランス,,webmaster@juglas.co.jp,,,review
株式会社高津戸電子,,,,,review
ティーズ・コム株式会社,,,,129,review
株式会社シンライン,,,,,review
株式会社シンライン,,,,62,review
株式会社小野システム,,,,,include
株式会社日野エンジニアリング,,,,,include
コスモ情報有限会社,,cosmojoho@nifty.com,,,include
株式会社ホットハート,,,,,review
株式会社パックスラジオ,,info2017@paxradio.co.jp,,,review
ウインテック株式会社,,otoiawase@wintec-corp.co.jp,,,review
株式会社ドラポケ,,,,22,review
ActAmuseJapan株式会社,,info-team@act-amuse-japan.co.jp,,下記と同じ,review
Act_Amuse_Japan株式会社,,,,問い合わせ済み(１回),review
株式会社エクスペリエンス,,,,123,review
株式会社エクスペリエンス,,,,,review
NIC株式会社,,,,,review
株式会社東洋通信,,,,,review
株式会社東洋通信,,,,,review
株式会社詩林堂,,,,85,review
株式会社テスコム,,,,6,review
合同会社ユーティリティ・アーミー,,,,2/8,review
株式会社相和,,,,,review
株式会社メイズ,,,,7,review
株式会社スマートブリッジ,,support@tintroom.jp,,,review
株式会社スマートブリッジ,,,,110,review
アジル株式会社,,info@j-agile.com,,4/9,review
コニカミノルタ情報システム株式会社,,,,6,include
コニカミノルタソフトウェア研究所株式会社,,,,4/17,include
株式会社昭電,,info@syouden.co.jp,,,review
有限会社ミノワ電子サービス,,,,mail 1/10,review
ビデオトロン株式会社,,sales@videotron.co.jp,,mail　5/1,review
三英電設株式会社,,,,,review
京西スタッフサービス株式会社,,,,2/7,review
株式会社ワーク企画,,,,,review
キャビンシステム株式会社,,,,,include
株式会社TFD,,,,27,review
株式会社プライズ,,,,,review
株式会社ユニマインド・テクノロジー,,,,,include
株式会社日本テクノス,,,,,include
アイビーマネジメント株式会社,,,,,review
アイビーマネジメント株式会社,,,,,review
株式会社スタジオル,,,,,review
株式会社スタジオル,,,,,review
有限会社ケイ・エス・エル,,,,40,review
有限会社マイズ,,,,,review
有限会社マイズ,,,,,review
株式会社TMEFuture,,,,5,review
株式会社アドニクス,,,,44,review
株式会社スカイキャリア,,info@sky-career.co.jp,,info@sky-career.co.jp　44,review
株式会社関東総業,,,,,review
新日本通信株式会社,,,,,review
株式会社タマテクニカル,,shimura@tamatech.com,,4,review
マリオライフ株式会社,,info@mariolife.co.jp,,mail　5/2,review
株式会社ムラウチネットワーク,,info@murauchi-net.co.jp,,,include
株式会社ゲインコントロール,,,,99　問い合わせフォーム開かない,review
株式会社大和宣広,,,,,review
株式会社大和宣広,,,,,review
株式会社ワープ,,info@jwp.jp,,,review
株式会社イーツリーズ・ジャパン,,,,21,review
フジ通信興業株式会社,,XLC06257@nifty.com,,mail　5/1,review
株式会社ケーエス・システム,,ksato@kssystem.jp,,35,include
株式会社カトム,,,,,review
株式会社ヒューマン・ライフ,,,,59,review
信和ユニテック株式会社,,info@shinwa-unitec.co.jp,,,review
合同会社MAEMO,,info@maemo-llc.com,,,review
合同会社MAEMO,,,,,review
有限会社和光通信システム,,,,,include
シンコー株式会社,,sinko_haba@nifty.com,,,review
株式会社インフォモーフ,,info@infomorph.jp,,53,review
株式会社ミスターディープロ,,info2@mr-dpro.com,,2,review
株式会社ミスターディープロ,,,,,review
ネットクリエイト株式会社,,,,4/30,review
株式会社プログレスマインド,,,,,review
株式会社プログレスマインド,,,,,review
株式会社PAI,,paisales@painext.com,,110,include
株式会社クリエイトバンク,,,,,review
株式会社ビルディット,,,,,review
株式会社イグレックス,,contact@igreks.jp,,,review
株式会社イグレックス,,,,97,review
株式会社マイソフト,,,,50,include
株式会社ヒューマンアイ,,,,,review
バディワークス有限会社,,,,27,review
株式会社メディカルアイ,,,,22,review
有限会社シー・クラフト,,,,,review
有限会社シー・クラフト,,,,10,review
株式会社アプト,,,,111,review
東西電業株式会社,,info@touzaikabu.com,,,review
株式会社デプロ,,,,,review
株式会社デージーエス・コンピュータ,,,,,include
ジャパンシステム株式会社,,info@jpnsys.co.jp,,4/21,include
株式会社東和キャスト,,,,,review
株式会社テンペスト,,info@tempest.co.jp,,87,review
コントロール・プラン有限会社,,,,,review
株式会社ヒノデン,,,,74,review
アイテレコム株式会社,,info@i-telecom.co.jp,,4/9,review
デザインデポ株式会社,,,,,review
SOCIALROBOTICS株式会社,,info@socrobo.com,,mail 4/7,review
株式会社コールシステム,,,,71,include
株式会社ラディアス,,contact@radias.com,,73,review
ブロードテック株式会社,,,,70,review
株式会社ネットスタッフ,,muroi@netstaff.co.jp,,,review
有限会社システムズ,,,,,include
株式会社シグマ,,,,,review
日本システム機器株式会社,,nsk-sys@rc4.so-net.ne.jp,,,include
株式会社ランタイムインスツルメンツ,,,,57,review
三英グラフィック・アーツ株式会社,,,,,review
株式会社ムラウチドットコム,,,,,review
株式会社ムラウチドットコム,,,,,review
株式会社夢現舎,,,,１１,review
有限会社オープンスフィア,,,,,review
有限会社協和電設,,kyowadensetsu@coda.ocn.ne.jp,,,review
有限会社オープンスフィア,,,,,review
有限会社ケイプランニング,,,,,review
株式会社シムス,,,,,review
株式会社テクノワープ,,,,57,include
株式会社テクノワープ,,,,,include
BUDDY株式会社,,,,,review
BRIDGE株式会社,,,,問い合わせ済み(１回),review
株式会社システムインテグレート,,mail-to@sic-tokyo.co.jp,,89,include
イーディテクノロジ株式会社,,info@ed-technology.co.jp,,mail 4/10,include
ソーバス株式会社,,otoi-awase@sorbus.co.jp,,リンク切れ,review
アソシエ・ネット・WORK株式会社,,,,,review
有限会社栄光通信,,eikou-tuu@extra.ocn.ne.jp,,mail 1/9,review
Seltech株式会社,,,,4/7,review
SODA株式会社,,,,4/7,review
SODA株式会社,,,,,review
Seltech株式会社,,,,,review
株式会社ソフィア・システム・サービス,,,,117,include
株式会社エー・アール・アイ,,webmaster@ari-web.com,,13,review
株式会社五大システム,,,,106,include
株式会社REC,,,,他業種,review
リブト株式会社,,,,5/7,review
株式会社トランスパーソナル・ワークス,,,,,review
株式会社ITA,,,,43,include
スペクトプラス株式会社,,contact@spectplus.com,,45,review
